(259199, -14, 4);[8, 10, 300, 40];משיח;68081;(5, 4, 45, 3, 68081);והחקים;3;(5, 4, 45, 10, 259199);אלה העדת והחקים והמשפטים אשר דבר משה אל בני ישראל בצאתם ממצרים
(601907, -14, 4);[8, 10, 300, 40];משיח;156330;(12, 28, 27, 5, 156330);קצח;3;(12, 28, 27, 16, 601907);כי לא בחרוץ יודש קצח ואופן עגלה על כמן יוסב כי במטה יחבט קצח וכמן בשבט
(870616, -14, 4);[8, 10, 300, 40];משיח;224502;(27, 27, 6, 9, 224502);זבחי;3;(27, 27, 6, 39, 870616);ועתה ירום ראשי על איבי סביבותי ואזבחה באהלו זבחי תרועה אשירה ואזמרה ליהוה
(925674, -14, 4);[8, 10, 300, 40];משיח;238147;(27, 119, 121, 5, 238147);תניחני;4;(27, 119, 121, 19, 925674);עשיתי משפט וצדק בל תניחני לעשקי
(952897, -14, 4);[8, 10, 300, 40];משיח;245053;(28, 19, 17, 3, 245053);חונן;1;(28, 19, 17, 9, 952897);מלוה יהוה חונן דל וגמלו ישלם לו
(1054925, -14, 4);[8, 10, 300, 40];משיח;271305;(35, 10, 4, 13, 271305);חדקל;1;(35, 10, 4, 52, 1054925);וביום עשרים וארבעה לחדש הראשון ואני הייתי על יד הנהר הגדול הוא חדקל
(1100130, -14, 4);[8, 10, 300, 40];משיח;282086;(38, 2, 24, 1, 282086);ואחר;3;(38, 2, 24, 3, 1100130);ואחר מות חצרון בכלב אפרתה ואשת חצרון אביה ותלד לו את אשחור אבי תקוע
(1110789, -14, 4);[8, 10, 300, 40];משיח;284682;(38, 8, 14, 1, 284682);ואחיו;3;(38, 8, 14, 3, 1110789);ואחיו ששק וירמות
(1153900, -14, 4);[8, 10, 300, 40];משיח;295116;(39, 9, 6, 13, 295116);חצי;1;(39, 9, 6, 48, 1153900);ולא האמנתי לדבריהם עד אשר באתי ותראינה עיני והנה לא הגד לי חצי מרבית חכמתך יספת על השמועה אשר שמעתי
(7858, -13, 4);[8, 10, 300, 40];משיח;2100;(1, 6, 21, 2, 2100);קח;2;(1, 6, 21, 6, 7858);ואתה קח לך מכל מאכל אשר יאכל ואספת אליך והיה לך ולהם לאכלה
(27132, -13, 4);[8, 10, 300, 40];משיח;7241;(1, 22, 3, 7, 7241);ויקח;4;(1, 22, 3, 29, 27132);וישכם אברהם בבקר ויחבש את חמרו ויקח את שני נעריו אתו ואת יצחק בנו ויבקע עצי עלה ויקם וילך אל המקום אשר אמר לו האלהים
(98079, -13, 4);[8, 10, 300, 40];משיח;25881;(2, 14, 2, 6, 25881);ויחנו;3;(2, 14, 2, 21, 98079);דבר אל בני ישראל וישבו ויחנו לפני פי החירת בין מגדל ובין הים לפני בעל צפן נכחו תחנו על הים
(197701, -13, 4);[8, 10, 300, 40];משיח;52130;(4, 6, 14, 18, 52130);אחד;2;(4, 6, 14, 68, 197701);והקריב את קרבנו ליהוה כבש בן שנתו תמים אחד לעלה וכבשה אחת בת שנתה תמימה לחטאת ואיל אחד תמים לשלמים
(420482, -13, 4);[8, 10, 300, 40];משיח;109412;(8, 22, 13, 13, 109412);וחרב;2;(8, 22, 13, 43, 420482);ויאמר אלו שאול למה קשרתם עלי אתה ובן ישי בתתך לו לחם וחרב ושאול לו באלהים לקום אלי לארב כיום הזה
(473432, -13, 4);[8, 10, 300, 40];משיח;123253;(9, 22, 43, 1, 123253);ואשחקם;4;(9, 22, 43, 4, 473432);ואשחקם כעפר ארץ כטיט חוצות אדקם ארקעם
(537311, -13, 4);[8, 10, 300, 40];משיח;139823;(11, 6, 7, 4, 139823);וישלח;5;(11, 6, 7, 15, 537311);ויאמר הרם לך וישלח ידו ויקחהו
(793982, -13, 4);[8, 10, 300, 40];משיח;205158;(14, 44, 11, 12, 205158);ישחטו;3;(14, 44, 11, 50, 793982);והיו במקדשי משרתים פקדות אל שערי הבית ומשרתים את הבית המה ישחטו את העלה ואת הזבח לעם והמה יעמדו לפניהם לשרתם
(825584, -13, 4);[8, 10, 300, 40];משיח;213132;(19, 2, 7, 5, 213132);ברחיה;3;(19, 2, 7, 21, 825584);לקצבי הרים ירדתי הארץ ברחיה בעדי לעולם ותעל משחת חיי יהוה אלהי
(875506, -13, 4);[8, 10, 300, 40];משיח;225732;(27, 35, 27, 2, 225732);וישמחו;5;(27, 35, 27, 9, 875506);ירנו וישמחו חפצי צדקי ויאמרו תמיד יגדל יהוה החפץ שלום עבדו
(944469, -13, 4);[8, 10, 300, 40];משיח;242857;(28, 9, 9, 3, 242857);ויחכם;3;(28, 9, 9, 9, 944469);תן לחכם ויחכם עוד הודע לצדיק ויוסף לקח
(1100359, -13, 4);[8, 10, 300, 40];משיח;282144;(38, 2, 29, 8, 282144);אחבן;2;(38, 2, 29, 28, 1100359);ושם אשת אבישור אביהיל ותלד לו את אחבן ואת מוליד
(48555, -12, 4);[8, 10, 300, 40];משיח;12930;(1, 33, 7, 10, 12930);וישתחוו;5;(1, 33, 7, 42, 48555);ותגש גם לאה וילדיה וישתחוו ואחר נגש יוסף ורחל וישתחוו
(99320, -12, 4);[8, 10, 300, 40];משיח;26200;(2, 14, 22, 9, 26200);חמה;1;(2, 14, 22, 34, 99320);ויבאו בני ישראל בתוך הים ביבשה והמים להם חמה מימינם ומשמאלם
(125918, -12, 4);[8, 10, 300, 40];משיח;33208;(2, 32, 4, 1, 33208);ויקח;4;(2, 32, 4, 4, 125918);ויקח מידם ויצר אתו בחרט ויעשהו עגל מסכה ויאמרו אלה אלהיך ישראל אשר העלוך מארץ מצרים
(132076, -12, 4);[8, 10, 300, 40];משיח;34874;(2, 35, 24, 5, 34874);ונחשת;3;(2, 35, 24, 17, 132076);כל מרים תרומת כסף ונחשת הביאו את תרומת יהוה וכל אשר נמצא אתו עצי שטים לכל מלאכת העבדה הביאו
(379834, -12, 4);[8, 10, 300, 40];משיח;98985;(7, 20, 13, 18, 98985);אחיהם;2;(7, 20, 13, 73, 379834);ועתה תנו את האנשים בני בליעל אשר בגבעה ונמיתם ונבערה רעה מישראל ולא אבו בנימן לשמע בקול אחיהם בני ישראל
(410588, -12, 4);[8, 10, 300, 40];משיח;106793;(8, 17, 25, 9, 106793);לחרף;2;(8, 17, 25, 34, 410588);ויאמר איש ישראל הראיתם האיש העלה הזה כי לחרף את ישראל עלה והיה האיש אשר יכנו יעשרנו המלך עשר גדול ואת בתו יתן לו ואת בית אביו יעשה חפשי בישראל
(456390, -12, 4);[8, 10, 300, 40];משיח;118782;(9, 14, 14, 14, 118782);וחשב;2;(9, 14, 14, 50, 456390);כי מות נמות וכמים הנגרים ארצה אשר לא יאספו ולא ישא אלהים נפש וחשב מחשבות לבלתי ידח ממנו נדח
(459397, -12, 4);[8, 10, 300, 40];משיח;119579;(9, 15, 25, 11, 119579);חן;1;(9, 15, 25, 40, 459397);ויאמר המלך לצדוק השב את ארון האלהים העיר אם אמצא חן בעיני יהוה והשבני והראני אתו ואת נוהו
(501356, -12, 4);[8, 10, 300, 40];משיח;130487;(10, 11, 6, 8, 130487);אחרי;2;(10, 11, 6, 28, 501356);ויעש שלמה הרע בעיני יהוה ולא מלא אחרי יהוה כדוד אביו
(521359, -12, 4);[8, 10, 300, 40];משיח;135711;(10, 20, 24, 10, 135711);פחות;2;(10, 20, 24, 36, 521359);ואת הדבר הזה עשה הסר המלכים איש ממקמו ושים פחות תחתיהם
(532967, -12, 4);[8, 10, 300, 40];משיח;138702;(11, 4, 7, 15, 138702);תחיי;2;(11, 4, 7, 58, 532967);ותבא ותגד לאיש האלהים ויאמר לכי מכרי את השמן ושלמי את נשיכי ואת בניכי תחיי בנותר
(535355, -12, 4);[8, 10, 300, 40];משיח;139324;(11, 5, 5, 12, 139324);ויקח;4;(11, 5, 5, 42, 535355);ויאמר מלך ארם לך בא ואשלחה ספר אל מלך ישראל וילך ויקח בידו עשר ככרי כסף וששת אלפים זהב ועשר חליפות בגדים
(550320, -12, 4);[8, 10, 300, 40];משיח;143157;(11, 13, 1, 11, 143157);יהואחז;5;(11, 13, 1, 45, 550320);בשנת עשרים ושלש שנה ליואש בן אחזיהו מלך יהודה מלך יהואחז בן יהוא על ישראל בשמרון שבע עשרה שנה
(879813, -12, 4);[8, 10, 300, 40];משיח;226815;(27, 42, 7, 4, 226815);תשתוחח;5;(27, 42, 7, 16, 879813);אלהי עלי נפשי תשתוחח על כן אזכרך מארץ ירדן וחרמונים מהר מצער
(882599, -12, 4);[8, 10, 300, 40];משיח;227506;(27, 48, 5, 6, 227506);יחדו;2;(27, 48, 5, 22, 882599);כי הנה המלכים נועדו עברו יחדו
(918068, -12, 4);[8, 10, 300, 40];משיח;236260;(27, 107, 41, 6, 236260);משפחות;4;(27, 107, 41, 27, 918068);וישגב אביון מעוני וישם כצאן משפחות
(1045714, -12, 4);[8, 10, 300, 40];משיח;269056;(35, 5, 12, 26, 269056);יהחוה;3;(35, 5, 12, 110, 1045714);כל קבל די רוח יתירה ומנדע ושכלתנו מפשר חלמין ואחוית אחידן ומשרא קטרין השתכחת בה בדניאל די מלכא שם שמה בלטשאצר כען דניאל יתקרי ופשרה יהחוה
(1093457, -12, 4);[8, 10, 300, 40];משיח;280525;(37, 12, 7, 3, 280525);חלקיה;1;(37, 12, 7, 8, 1093457);סלו עמוק חלקיה ידעיה אלה ראשי הכהנים ואחיהם בימי ישוע
(1154552, -12, 4);[8, 10, 300, 40];משיח;295276;(39, 9, 15, 15, 295276);האחת;3;(39, 9, 15, 53, 1154552);ויעש המלך שלמה מאתים צנה זהב שחוט שש מאות זהב שחוט יעלה על הצנה האחת
(1175840, -12, 4);[8, 10, 300, 40];משיח;300500;(39, 25, 5, 28, 300500);רמח;3;(39, 25, 5, 123, 1175840);ויקבץ אמציהו את יהודה ויעמידם לבית אבות לשרי האלפים ולשרי המאות לכל יהודה ובנימן ויפקדם למבן עשרים שנה ומעלה וימצאם שלש מאות אלף בחור יוצא צבא אחז רמח וצנה
(9917, -11, 4);[8, 10, 300, 40];משיח;2660;(1, 8, 17, 2, 2660);החיה;2;(1, 8, 17, 4, 9917);כל החיה אשר אתך מכל בשר בעוף ובבהמה ובכל הרמש הרמש על הארץ הוצא אתך ושרצו בארץ ופרו ורבו על הארץ
(265753, -11, 4);[8, 10, 300, 40];משיח;69746;(5, 9, 5, 27, 69746);ליצחק;4;(5, 9, 5, 110, 265753);לא בצדקתך ובישר לבבך אתה בא לרשת את ארצם כי ברשעת הגוים האלה יהוה אלהיך מורישם מפניך ולמען הקים את הדבר אשר נשבע יהוה לאבתיך לאברהם ליצחק וליעקב
(509479, -11, 4);[8, 10, 300, 40];משיח;132619;(10, 14, 20, 14, 132619);תחתיו;2;(10, 14, 20, 55, 509479);והימים אשר מלך ירבעם עשרים ושתים שנה וישכב עם אבתיו וימלך נדב בנו תחתיו
(581868, -11, 4);[8, 10, 300, 40];משיח;151188;(12, 7, 1, 24, 151188);להלחם;4;(12, 7, 1, 91, 581868);ויהי בימי אחז בן יותם בן עזיהו מלך יהודה עלה רצין מלך ארם ופקח בן רמליהו מלך ישראל ירושלם למלחמה עליה ולא יכל להלחם עליה
(701966, -11, 4);[8, 10, 300, 40];משיח;181890;(13, 38, 12, 10, 181890);הסחבות;3;(13, 38, 12, 37, 701966);ויאמר עבד מלך הכושי אל ירמיהו שים נא בלואי הסחבות והמלחים תחת אצלות ידיך מתחת לחבלים ויעש ירמיהו כן
(1120707, -11, 4);[8, 10, 300, 40];משיח;287073;(38, 15, 9, 2, 287073);חברון;1;(38, 15, 9, 5, 1120707);לבני חברון אליאל השר ואחיו שמונים
(1153848, -11, 4);[8, 10, 300, 40];משיח;295103;(39, 9, 5, 12, 295103);חכמתך;1;(39, 9, 5, 42, 1153848);ותאמר אל המלך אמת הדבר אשר שמעתי בארצי על דבריך ועל חכמתך
(13313, -10, 4);[8, 10, 300, 40];משיח;3569;(1, 11, 14, 1, 3569);ושלח;4;(1, 11, 14, 4, 13313);ושלח חי שלשים שנה ויולד את עבר
(112742, -10, 4);[8, 10, 300, 40];משיח;29844;(2, 24, 5, 1, 29844);וישלח;5;(2, 24, 5, 5, 112742);וישלח את נערי בני ישראל ויעלו עלת ויזבחו זבחים שלמים ליהוה פרים
(123703, -10, 4);[8, 10, 300, 40];משיח;32622;(2, 30, 13, 14, 32622);מחצית;2;(2, 30, 13, 51, 123703);זה יתנו כל העבר על הפקדים מחצית השקל בשקל הקדש עשרים גרה השקל מחצית השקל תרומה ליהוה
(161794, -10, 4);[8, 10, 300, 40];משיח;42744;(3, 14, 10, 8, 42744);אחת;2;(3, 14, 10, 35, 161794);וביום השמיני יקח שני כבשים תמימים וכבשה אחת בת שנתה תמימה ושלשה עשרנים סלת מנחה בלולה בשמן ולג אחד שמן
(267495, -10, 4);[8, 10, 300, 40];משיח;70191;(5, 10, 4, 3, 70191);הלחת;3;(5, 10, 4, 10, 267495);ויכתב על הלחת כמכתב הראשון את עשרת הדברים אשר דבר יהוה אליכם בהר מתוך האש ביום הקהל ויתנם יהוה אלי
(382471, -10, 4);[8, 10, 300, 40];משיח;99637;(7, 21, 7, 6, 99637);ואנחנו;4;(7, 21, 7, 25, 382471);מה נעשה להם לנותרים לנשים ואנחנו נשבענו ביהוה לבלתי תת להם מבנותינו לנשים
(399103, -10, 4);[8, 10, 300, 40];משיח;103852;(8, 11, 11, 11, 103852);המחנה;3;(8, 11, 11, 43, 399103);ויהי ממחרת וישם שאול את העם שלשה ראשים ויבאו בתוך המחנה באשמרת הבקר ויכו את עמון עד חם היום ויהי הנשארים ויפצו ולא נשארו בם שנים יחד
(402066, -10, 4);[8, 10, 300, 40];משיח;104612;(8, 13, 16, 11, 104612);חנו;1;(8, 13, 16, 48, 402066);ושאול ויונתן בנו והעם הנמצא עמם ישבים בגבע בנימן ופלשתים חנו במכמש
(453008, -10, 4);[8, 10, 300, 40];משיח;117896;(9, 12, 31, 8, 117896);ובחרצי;3;(9, 12, 31, 28, 453008);ואת העם אשר בה הוציא וישם במגרה ובחרצי הברזל ובמגזרת הברזל והעביר אותם במלכן וכן יעשה לכל ערי בני עמון וישב דוד וכל העם ירושלם
(531191, -10, 4);[8, 10, 300, 40];משיח;138241;(11, 3, 7, 16, 138241);למלחמה;4;(11, 3, 7, 58, 531191);וילך וישלח אל יהושפט מלך יהודה לאמר מלך מואב פשע בי התלך אתי אל מואב למלחמה ויאמר אעלה כמוני כמוך כעמי כעמך כסוסי כסוסיך
(560773, -10, 4);[8, 10, 300, 40];משיח;145843;(11, 18, 11, 9, 145843);ובחבור;3;(11, 18, 11, 35, 560773);ויגל מלך אשור את ישראל אשורה וינחם בחלח ובחבור נהר גוזן וערי מדי
(571275, -10, 4);[8, 10, 300, 40];משיח;148547;(11, 23, 23, 9, 148547);הפסח;4;(11, 23, 23, 34, 571275);כי אם בשמנה עשרה שנה למלך יאשיהו נעשה הפסח הזה ליהוה בירושלם
(630687, -10, 4);[8, 10, 300, 40];משיח;163623;(12, 54, 12, 6, 163623);אקדח;4;(12, 54, 12, 30, 630687);ושמתי כדכד שמשתיך ושעריך לאבני אקדח וכל גבולך לאבני חפץ
(642249, -10, 4);[8, 10, 300, 40];משיח;166513;(12, 66, 20, 25, 166513);המנחה;4;(12, 66, 20, 108, 642249);והביאו את כל אחיכם מכל הגוים מנחה ליהוה בסוסים וברכב ובצבים ובפרדים ובכרכרות על הר קדשי ירושלם אמר יהוה כאשר יביאו בני ישראל את המנחה בכלי טהור בית יהוה
(723173, -10, 4);[8, 10, 300, 40];משיח;187346;(13, 51, 29, 8, 187346);מחשבות;2;(13, 51, 29, 25, 723173);ותרעש הארץ ותחל כי קמה על בבל מחשבות יהוה לשום את ארץ בבל לשמה מאין יושב
(728425, -10, 4);[8, 10, 300, 40];משיח;188650;(14, 1, 20, 9, 188650);הרוח;4;(14, 1, 20, 30, 728425);על אשר יהיה שם הרוח ללכת ילכו שמה הרוח ללכת והאופנים ינשאו לעמתם כי רוח החיה באופנים
(811718, -10, 4);[8, 10, 300, 40];משיח;209628;(16, 1, 11, 6, 209628);חטה;1;(16, 1, 11, 24, 811718);הבישו אכרים הילילו כרמים על חטה ועל שערה כי אבד קציר שדה
(942209, -10, 4);[8, 10, 300, 40];משיח;242277;(28, 6, 27, 4, 242277);בחיקו;2;(28, 6, 27, 12, 942209);היחתה איש אש בחיקו ובגדיו לא תשרפנה
(954563, -10, 4);[8, 10, 300, 40];משיח;245504;(28, 21, 17, 2, 245504);מחסור;2;(28, 21, 17, 5, 954563);איש מחסור אהב שמחה אהב יין ושמן לא יעשיר
(970671, -10, 4);[8, 10, 300, 40];משיח;249757;(29, 9, 13, 6, 249757);שחחו;2;(29, 9, 13, 19, 970671);אלוה לא ישיב אפו תחתו שחחו עזרי רהב
(992390, -10, 4);[8, 10, 300, 40];משיח;255456;(29, 38, 37, 4, 255456);בחכמה;2;(29, 38, 37, 13, 992390);מי יספר שחקים בחכמה ונבלי שמים מי ישכיב
(1127780, -10, 4);[8, 10, 300, 40];משיח;288790;(38, 20, 3, 8, 288790);ובחריצי;3;(38, 20, 3, 28, 1127780);ואת העם אשר בה הוציא וישר במגרה ובחריצי הברזל ובמגרות וכן יעשה דויד לכל ערי בני עמון וישב דויד וכל העם ירושלם
(1143973, -10, 4);[8, 10, 300, 40];משיח;292645;(39, 2, 10, 2, 292645);חורם;1;(39, 2, 10, 6, 1143973);ויאמר חורם מלך צר בכתב וישלח אל שלמה באהבת יהוה את עמו נתנך עליהם מלך
(1154967, -10, 4);[8, 10, 300, 40];משיח;295381;(39, 9, 22, 8, 295381);וחכמה;2;(39, 9, 22, 30, 1154967);ויגדל המלך שלמה מכל מלכי הארץ לעשר וחכמה
(1166567, -10, 4);[8, 10, 300, 40];משיח;298240;(39, 18, 34, 10, 298240);נכח;3;(39, 18, 34, 44, 1166567);ותעל המלחמה ביום ההוא ומלך ישראל היה מעמיד במרכבה נכח ארם עד הערב וימת לעת בוא השמש
(7426, -9, 4);[8, 10, 300, 40];משיח;1987;(1, 6, 13, 12, 1987);חמס;1;(1, 6, 13, 37, 7426);ויאמר אלהים לנח קץ כל בשר בא לפני כי מלאה הארץ חמס מפניהם והנני משחיתם את הארץ
(38154, -9, 4);[8, 10, 300, 40];משיח;10141;(1, 27, 39, 2, 10141);יצחק;3;(1, 27, 39, 7, 38154);ויען יצחק אביו ויאמר אליו הנה משמני הארץ יהיה מושבך ומטל השמים מעל
(74826, -9, 4);[8, 10, 300, 40];משיח;19761;(1, 48, 16, 15, 19761);ויצחק;4;(1, 48, 16, 56, 74826);המלאך הגאל אתי מכל רע יברך את הנערים ויקרא בהם שמי ושם אבתי אברהם ויצחק וידגו לרב בקרב הארץ
(183833, -9, 4);[8, 10, 300, 40];משיח;48603;(3, 26, 31, 11, 48603);ניחחכם;4;(3, 26, 31, 47, 183833);ונתתי את עריכם חרבה והשמותי את מקדשיכם ולא אריח בריח ניחחכם
(186491, -9, 4);[8, 10, 300, 40];משיח;49300;(4, 1, 2, 8, 49300);למשפחתם;5;(4, 1, 2, 26, 186491);שאו את ראש כל עדת בני ישראל למשפחתם לבית אבתם במספר שמות כל זכר לגלגלתם
(221481, -9, 4);[8, 10, 300, 40];משיח;58390;(4, 19, 16, 8, 58390);חרב;1;(4, 19, 16, 23, 221481);וכל אשר יגע על פני השדה בחלל חרב או במת או בעצם אדם או בקבר יטמא שבעת ימים
(232794, -9, 4);[8, 10, 300, 40];משיח;61354;(4, 26, 39, 5, 61354);משפחת;4;(4, 26, 39, 26, 232794);לשפופם משפחת השופמי לחופם משפחת החופמי
(487129, -9, 4);[8, 10, 300, 40];משיח;126868;(10, 5, 22, 15, 126868);חפצך;1;(10, 5, 22, 48, 487129);וישלח חירם אל שלמה לאמר שמעתי את אשר שלחת אלי אני אעשה את כל חפצך בעצי ארזים ובעצי ברושים
(505744, -9, 4);[8, 10, 300, 40];משיח;131630;(10, 12, 32, 15, 131630);המזבח;5;(10, 12, 32, 59, 505744);ויעש ירבעם חג בחדש השמיני בחמשה עשר יום לחדש כחג אשר ביהודה ויעל על המזבח כן עשה בבית אל לזבח לעגלים אשר עשה והעמיד בבית אל את כהני הבמות אשר עשה
(561981, -9, 4);[8, 10, 300, 40];משיח;146157;(11, 18, 27, 8, 146157);שלחני;3;(11, 18, 27, 31, 561981);ויאמר אליהם רב שקה העל אדניך ואליך שלחני אדני לדבר את הדברים האלה הלא על האנשים הישבים על החמה לאכל את חריהם ולשתות את שיניהם עמכם
(564883, -9, 4);[8, 10, 300, 40];משיח;146901;(11, 19, 37, 3, 146901);משתחוה;4;(11, 19, 37, 11, 564883);ויהי הוא משתחוה בית נסרך אלהיו ואדרמלך ושראצר הכהו בחרב והמה נמלטו ארץ אררט וימלך אסר חדן בנו תחתיו
(609868, -9, 4);[8, 10, 300, 40];משיח;158370;(12, 36, 12, 7, 158370);שלחני;3;(12, 36, 12, 26, 609868);ויאמר רב שקה האל אדניך ואליך שלחני אדני לדבר את הדברים האלה הלא על האנשים הישבים על החומה לאכל את חראיהם ולשתות את שיניהם עמכם
(612713, -9, 4);[8, 10, 300, 40];משיח;159096;(12, 37, 38, 3, 159096);משתחוה;4;(12, 37, 38, 11, 612713);ויהי הוא משתחוה בית נסרך אלהיו ואדרמלך ושראצר בניו הכהו בחרב והמה נמלטו ארץ אררט וימלך אסר חדן בנו תחתיו
(628301, -9, 4);[8, 10, 300, 40];משיח;163016;(12, 51, 17, 11, 163016);חמתו;1;(12, 51, 17, 44, 628301);התעוררי התעוררי קומי ירושלם אשר שתית מיד יהוה את כוס חמתו את קבעת כוס התרעלה שתית מצית
(868233, -9, 4);[8, 10, 300, 40];משיח;223903;(27, 22, 16, 6, 223903);מלקוחי;5;(27, 22, 16, 25, 868233);יבש כחרש כחי ולשוני מדבק מלקוחי ולעפר מות תשפתני
(1015538, -9, 4);[8, 10, 300, 40];משיח;261405;(33, 4, 8, 22, 261405);ומחסר;3;(33, 4, 8, 66, 1015538);יש אחד ואין שני גם בן ואח אין לו ואין קץ לכל עמלו גם עיניו לא תשבע עשר ולמי אני עמל ומחסר את נפשי מטובה גם זה הבל וענין רע הוא
(1077671, -9, 4);[8, 10, 300, 40];משיח;276781;(37, 3, 6, 7, 276781);פסח;3;(37, 3, 6, 27, 1077671);ואת שער הישנה החזיקו יוידע בן פסח ומשלם בן בסודיה המה קרוהו ויעמידו דלתתיו ומנעליו ובריחיו
(1102479, -9, 4);[8, 10, 300, 40];משיח;282659;(38, 4, 7, 2, 282659);חלאה;1;(38, 4, 7, 5, 1102479);ובני חלאה צרת יצחר ואתנן
(1157796, -9, 4);[8, 10, 300, 40];משיח;296080;(39, 11, 22, 3, 296080);רחבעם;2;(39, 11, 22, 11, 1157796);ויעמד לראש רחבעם את אביה בן מעכה לנגיד באחיו כי להמליכו
(13960, -8, 4);[8, 10, 300, 40];משיח;3740;(1, 11, 29, 12, 3740);נחור;2;(1, 11, 29, 40, 13960);ויקח אברם ונחור להם נשים שם אשת אברם שרי ושם אשת נחור מלכה בת הרן אבי מלכה ואבי יסכה
(48594, -8, 4);[8, 10, 300, 40];משיח;12941;(1, 33, 8, 11, 12941);חן;1;(1, 33, 8, 37, 48594);ויאמר מי לך כל המחנה הזה אשר פגשתי ויאמר למצא חן בעיני אדני
(167860, -8, 4);[8, 10, 300, 40];משיח;44382;(3, 16, 32, 11, 44382);תחת;2;(3, 16, 32, 37, 167860);וכפר הכהן אשר ימשח אתו ואשר ימלא את ידו לכהן תחת אביו ולבש את בגדי הבד בגדי הקדש
(227584, -8, 4);[8, 10, 300, 40];משיח;60034;(4, 22, 41, 3, 60034);ויקח;4;(4, 22, 41, 12, 227584);ויהי בבקר ויקח בלק את בלעם ויעלהו במות בעל וירא משם קצה העם
(256657, -8, 4);[8, 10, 300, 40];משיח;67429;(5, 4, 6, 5, 67429);חכמתכם;1;(5, 4, 6, 18, 256657);ושמרתם ועשיתם כי הוא חכמתכם ובינתכם לעיני העמים אשר ישמעון את כל החקים האלה ואמרו רק עם חכם ונבון הגוי הגדול הזה
(377152, -8, 4);[8, 10, 300, 40];משיח;98309;(7, 19, 3, 4, 98309);אחריה;2;(7, 19, 3, 14, 377152);ויקם אישה וילך אחריה לדבר על לבה להשיבו ונערו עמו וצמד חמרים ותביאהו בית אביה ויראהו אבי הנערה וישמח לקראתו
(432903, -8, 4);[8, 10, 300, 40];משיח;112663;(8, 30, 12, 3, 112663);פלח;3;(8, 30, 12, 10, 432903);ויתנו לו פלח דבלה ושני צמקים ויאכל ותשב רוחו אליו כי לא אכל לחם ולא שתה מים שלשה ימים ושלשה לילות
(603035, -8, 4);[8, 10, 300, 40];משיח;156614;(12, 29, 18, 4, 156614);החרשים;2;(12, 29, 18, 15, 603035);ושמעו ביום ההוא החרשים דברי ספר ומאפל ומחשך עיני עורים תראינה
(616156, -8, 4);[8, 10, 300, 40];משיח;159984;(12, 41, 8, 6, 159984);בחרתיך;2;(12, 41, 8, 22, 616156);ואתה ישראל עבדי יעקב אשר בחרתיך זרע אברהם אהבי
(623158, -8, 4);[8, 10, 300, 40];משיח;161717;(12, 46, 10, 12, 161717);חפצי;1;(12, 46, 10, 44, 623158);מגיד מראשית אחרית ומקדם אשר לא נעשו אמר עצתי תקום וכל חפצי אעשה
(721436, -8, 4);[8, 10, 300, 40];משיח;186893;(13, 50, 43, 9, 186893);החזיקתהו;2;(13, 50, 43, 28, 721436);שמע מלך בבל את שמעם ורפו ידיו צרה החזיקתהו חיל כיולדה
(976303, -8, 4);[8, 10, 300, 40];משיח;251232;(29, 16, 22, 5, 251232);וארח;4;(29, 16, 22, 19, 976303);כי שנות מספר יאתיו וארח לא אשוב אהלך
