(75771, 81, 4);[8, 10, 300, 40];משיח;20006;(1, 49, 13, 6, 20006);לחוף;2;(1, 49, 13, 23, 75771);זבולן לחוף ימים ישכן והוא לחוף אנית וירכתו על צידן
(104692, 81, 4);[8, 10, 300, 40];משיח;27618;(2, 18, 12, 1, 27618);ויקח;4;(2, 18, 12, 4, 104692);ויקח יתרו חתן משה עלה וזבחים לאלהים ויבא אהרן וכל זקני ישראל לאכל לחם עם חתן משה לפני האלהים
(199523, 81, 4);[8, 10, 300, 40];משיח;52611;(4, 7, 26, 2, 52611);אחת;2;(4, 7, 26, 4, 199523);כף אחת עשרה זהב מלאה קטרת
(231652, 81, 4);[8, 10, 300, 40];משיח;61109;(4, 26, 13, 5, 61109);משפחת;4;(4, 26, 13, 23, 231652);לזרח משפחת הזרחי לשאול משפחת השאולי
(310253, 81, 4);[8, 10, 300, 40];משיח;81375;(6, 4, 24, 10, 81375);חזקה;1;(6, 4, 24, 27, 310253);למען דעת כל עמי הארץ את יד יהוה כי חזקה היא למען יראתם את יהוה אלהיכם כל הימים
(554173, 81, 4);[8, 10, 300, 40];משיח;144148;(11, 15, 10, 11, 144148);תחתיו;2;(11, 15, 10, 41, 554173);ויקשר עליו שלם בן יבש ויכהו קבל עם וימיתהו וימלך תחתיו
(865308, 81, 4);[8, 10, 300, 40];משיח;223163;(27, 18, 14, 8, 223163);וגחלי;3;(27, 18, 14, 32, 865308);וירעם בשמים יהוה ועליון יתן קלו ברד וגחלי אש
(927668, 81, 4);[8, 10, 300, 40];משיח;238616;(27, 123, 2, 18, 238616);שיחננו;3;(27, 123, 2, 67, 927668);הנה כעיני עבדים אל יד אדוניהם כעיני שפחה אל יד גברתה כן עינינו אל יהוה אלהינו עד שיחננו
(1015529, 81, 4);[8, 10, 300, 40];משיח;261395;(33, 4, 12, 7, 261395);והחוט;3;(33, 4, 12, 29, 1015529);ואם יתקפו האחד השנים יעמדו נגדו והחוט המשלש לא במהרה ינתק
(1112228, 81, 4);[8, 10, 300, 40];משיח;285016;(38, 9, 18, 5, 285016);מזרחה;4;(38, 9, 18, 18, 1112228);ועד הנה בשער המלך מזרחה המה השערים למחנות בני לוי
(1174790, 81, 4);[8, 10, 300, 40];משיח;300238;(39, 24, 21, 7, 300238);בחצר;2;(39, 24, 21, 31, 1174790);ויקשרו עליו וירגמהו אבן במצות המלך בחצר בית יהוה
(141170, 82, 4);[8, 10, 300, 40];משיח;37211;(2, 40, 29, 14, 37211);המנחה;4;(2, 40, 29, 48, 141170);ואת מזבח העלה שם פתח משכן אהל מועד ויעל עליו את העלה ואת המנחה כאשר צוה יהוה את משה
(187392, 82, 4);[8, 10, 300, 40];משיח;49516;(4, 1, 26, 4, 49516);למשפחתם;5;(4, 1, 26, 20, 187392);לבני יהודה תולדתם למשפחתם לבית אבתם במספר שמת מבן עשרים שנה ומעלה כל יצא צבא
(232585, 82, 4);[8, 10, 300, 40];משיח;61311;(4, 26, 35, 12, 61311);משפחת;4;(4, 26, 35, 57, 232585);אלה בני אפרים למשפחתם לשותלח משפחת השתלחי לבכר משפחת הבכרי לתחן משפחת התחני
(568467, 82, 4);[8, 10, 300, 40];משיח;147814;(11, 22, 12, 7, 147814);אחיקם;2;(11, 22, 12, 24, 568467);ויצו המלך את חלקיה הכהן ואת אחיקם בן שפן ואת עכבור בן מיכיה ואת שפן הספר ואת עשיה עבד המלך לאמר
(598853, 82, 4);[8, 10, 300, 40];משיח;155533;(12, 25, 12, 4, 155533);השח;3;(12, 25, 12, 18, 598853);ומבצר משגב חומתיך השח השפיל הגיע לארץ עד עפר
(612663, 82, 4);[8, 10, 300, 40];משיח;159070;(12, 38, 1, 4, 159070);חזקיהו;1;(12, 38, 1, 12, 612663);בימים ההם חלה חזקיהו למות ויבוא אליו ישעיהו בן אמוץ הנביא ויאמר אליו כה אמר יהוה צו לביתך כי מת אתה ולא תחיה
(662604, 82, 4);[8, 10, 300, 40];משיח;171752;(13, 14, 13, 11, 171752);חרב;1;(13, 14, 13, 39, 662604);ואמר אהה אדני יהוה הנה הנבאים אמרים להם לא תראו חרב ורעב לא יהיה לכם כי שלום אמת אתן לכם במקום הזה
(826358, 82, 4);[8, 10, 300, 40];משיח;213312;(19, 4, 3, 11, 213312);מחיי;2;(19, 4, 3, 33, 826358);ועתה יהוה קח נא את נפשי ממני כי טוב מותי מחיי
(1101167, 82, 4);[8, 10, 300, 40];משיח;282352;(38, 3, 1, 11, 282352);לאחינעם;3;(38, 3, 1, 41, 1101167);ואלה היו בני דויד אשר נולד לו בחברון הבכור אמנן לאחינעם היזרעאלית שני דניאל לאביגיל הכרמלית
(1108287, 82, 4);[8, 10, 300, 40];משיח;284085;(38, 6, 66, 2, 284085);חשבון;1;(38, 6, 66, 4, 1108287);ואת חשבון ואת מגרשיה ואת יעזיר ואת מגרשיה
(121597, 83, 4);[8, 10, 300, 40];משיח;32079;(2, 29, 21, 1, 32079);ולקחת;4;(2, 29, 21, 4, 121597);ולקחת מן הדם אשר על המזבח ומשמן המשחה והזית על אהרן ועל בגדיו ועל בניו ועל בגדי בניו אתו וקדש הוא ובגדיו ובניו ובגדי בניו אתו
(173857, 83, 4);[8, 10, 300, 40];משיח;46014;(3, 21, 9, 5, 46014);תחל;2;(3, 21, 9, 13, 173857);ובת איש כהן כי תחל לזנות את אביה היא מחללת באש תשרף
(174102, 83, 4);[8, 10, 300, 40];משיח;46082;(3, 21, 14, 8, 46082);יקח;3;(3, 21, 14, 29, 174102);אלמנה וגרושה וחללה זנה את אלה לא יקח כי אם בתולה מעמיו יקח אשה
(206555, 83, 4);[8, 10, 300, 40];משיח;54431;(4, 10, 33, 17, 54431);מנוחה;4;(4, 10, 33, 67, 206555);ויסעו מהר יהוה דרך שלשת ימים וארון ברית יהוה נסע לפניהם דרך שלשת ימים לתור להם מנוחה
(336364, 83, 4);[8, 10, 300, 40];משיח;87954;(6, 21, 5, 4, 87954);ממשפחת;5;(6, 21, 5, 20, 336364);ולבני קהת הנותרים ממשפחת מטה אפרים וממטה דן ומחצי מטה מנשה בגורל ערים עשר
(538281, 83, 4);[8, 10, 300, 40];משיח;140065;(11, 6, 24, 11, 140065);מחנהו;2;(11, 6, 24, 32, 538281);ויהי אחרי כן ויקבץ בן הדד מלך ארם את כל מחנהו ויעל ויצר על שמרון
(551595, 83, 4);[8, 10, 300, 40];משיח;143488;(11, 13, 23, 15, 143488);השחיתם;3;(11, 13, 23, 60, 551595);ויחן יהוה אתם וירחמם ויפן אליהם למען בריתו את אברהם יצחק ויעקב ולא אבה השחיתם ולא השליכם מעל פניו עד עתה
(555434, 83, 4);[8, 10, 300, 40];משיח;144480;(11, 15, 30, 13, 144480);תחתיו;2;(11, 15, 30, 49, 555434);ויקשר קשר הושע בן אלה על פקח בן רמליהו ויכהו וימיתהו וימלך תחתיו בשנת עשרים ליותם בן עזיה
(775280, 83, 4);[8, 10, 300, 40];משיח;200488;(14, 33, 24, 11, 200488);אחד;2;(14, 33, 24, 41, 775280);בן אדם ישבי החרבות האלה על אדמת ישראל אמרים לאמר אחד היה אברהם ויירש את הארץ ואנחנו רבים לנו נתנה הארץ למורשה
(1019743, 83, 4);[8, 10, 300, 40];משיח;262569;(33, 9, 3, 6, 262569);תחת;2;(33, 9, 3, 16, 1019743);זה רע בכל אשר נעשה תחת השמש כי מקרה אחד לכל וגם לב בני האדם מלא רע והוללות בלבבם בחייהם ואחריו אל המתים
(1179224, 83, 4);[8, 10, 300, 40];משיח;301315;(39, 27, 7, 5, 301315);מלחמתיו;3;(39, 27, 7, 18, 1179224);ויתר דברי יותם וכל מלחמתיו ודרכיו הנם כתובים על ספר מלכי ישראל ויהודה
(11347, 84, 4);[8, 10, 300, 40];משיח;3054;(1, 9, 23, 17, 3054);אחרנית;2;(1, 9, 23, 68, 11347);ויקח שם ויפת את השמלה וישימו על שכם שניהם וילכו אחרנית ויכסו את ערות אביהם ופניהם אחרנית וערות אביהם לא ראו
(142707, 84, 4);[8, 10, 300, 40];משיח;37618;(3, 2, 3, 3, 37618);המנחה;4;(3, 2, 3, 13, 142707);והנותרת מן המנחה לאהרן ולבניו קדש קדשים מאשי יהוה
(191324, 84, 4);[8, 10, 300, 40];משיח;50473;(4, 3, 25, 10, 50473);פתח;3;(4, 3, 25, 44, 191324);ומשמרת בני גרשון באהל מועד המשכן והאהל מכסהו ומסך פתח אהל מועד
(308794, 84, 4);[8, 10, 300, 40];משיח;81007;(6, 4, 2, 1, 81007);קחו;2;(6, 4, 2, 2, 308794);קחו לכם מן העם שנים עשר אנשים איש אחד איש אחד משבט
(315404, 84, 4);[8, 10, 300, 40];משיח;82690;(6, 8, 3, 5, 82690);המלחמה;4;(6, 8, 3, 18, 315404);ויקם יהושע וכל עם המלחמה לעלות העי ויבחר יהושע שלשים אלף איש גבורי החיל וישלחם לילה
(359843, 84, 4);[8, 10, 300, 40];משיח;93922;(7, 9, 3, 2, 93922);אחי;2;(7, 9, 3, 8, 359843);וידברו אחי אמו עליו באזני כל בעלי שכם את כל הדברים האלה ויט לבם אחרי אבימלך כי אמרו אחינו הוא
(386700, 84, 4);[8, 10, 300, 40];משיח;100742;(8, 2, 29, 15, 100742);מנחת;3;(8, 2, 29, 66, 386700);למה תבעטו בזבחי ובמנחתי אשר צויתי מעון ותכבד את בניך ממני להבריאכם מראשית כל מנחת ישראל לעמי
(543391, 84, 4);[8, 10, 300, 40];משיח;141393;(11, 9, 15, 11, 141393);בהלחמו;4;(11, 9, 15, 49, 543391);וישב יהורם המלך להתרפא ביזרעאל מן המכים אשר יכהו ארמים בהלחמו את חזאל מלך ארם ויאמר יהוא אם יש נפשכם אל יצא פליט מן העיר ללכת לגיד ביזרעאל
(592504, 84, 4);[8, 10, 300, 40];משיח;153906;(12, 18, 4, 10, 153906);צח;2;(12, 18, 4, 37, 592504);כי כה אמר יהוה אלי אשקוטה ואביטה במכוני כחם צח עלי אור כעב טל בחם קציר
(594546, 84, 4);[8, 10, 300, 40];משיח;154418;(12, 21, 2, 14, 154418);אנחתה;3;(12, 21, 2, 50, 594546);חזות קשה הגד לי הבוגד בוגד והשודד שודד עלי עילם צורי מדי כל אנחתה השבתי
(610636, 84, 4);[8, 10, 300, 40];משיח;158561;(12, 37, 4, 9, 158561);שלחו;3;(12, 37, 4, 34, 610636);אולי ישמע יהוה אלהיך את דברי רבשקה אשר שלחו מלך אשור אדניו לחרף אלהים חי והוכיח בדברים אשר שמע יהוה אלהיך ונשאת תפלה בעד השארית הנמצאה
(616359, 84, 4);[8, 10, 300, 40];משיח;160020;(12, 41, 15, 4, 160020);חרוץ;1;(12, 41, 15, 14, 616359);הנה שמתיך למורג חרוץ חדש בעל פיפיות תדוש הרים ותדק וגבעות כמץ תשים
(696203, 84, 4);[8, 10, 300, 40];משיח;180408;(13, 35, 7, 19, 180408);תחיו;2;(13, 35, 7, 66, 696203);ובית לא תבנו וזרע לא תזרעו וכרם לא תטעו ולא יהיה לכם כי באהלים תשבו כל ימיכם למען תחיו ימים רבים על פני האדמה אשר אתם גרים שם
(708052, 84, 4);[8, 10, 300, 40];משיח;183444;(13, 42, 16, 2, 183444);החרב;2;(13, 42, 16, 7, 708052);והיתה החרב אשר אתם יראים ממנה שם תשיג אתכם בארץ מצרים והרעב אשר אתם דאגים ממנו שם ידבק אחריכם מצרים ושם תמתו
(750988, 84, 4);[8, 10, 300, 40];משיח;194354;(14, 18, 21, 5, 194354);חטאתו;1;(14, 18, 21, 15, 750988);והרשע כי ישוב מכל חטאתו אשר עשה ושמר את כל חקותי ועשה משפט וצדקה חיה יחיה לא ימות
(787353, 84, 4);[8, 10, 300, 40];משיח;203514;(14, 40, 26, 8, 203514);אחד;2;(14, 40, 26, 36, 787353);ומעלות שבעה עלותו ואלמו לפניהם ותמרים לו אחד מפו ואחד מפו אל אילו
(970512, 84, 4);[8, 10, 300, 40];משיח;249701;(29, 9, 13, 5, 249701);תחתו;2;(29, 9, 13, 15, 970512);אלוה לא ישיב אפו תחתו שחחו עזרי רהב
(997182, 84, 4);[8, 10, 300, 40];משיח;256645;(30, 3, 4, 9, 256645);אחזתיו;2;(30, 3, 4, 34, 997182);כמעט שעברתי מהם עד שמצאתי את שאהבה נפשי אחזתיו ולא ארפנו עד שהביאתיו אל בית אמי ואל חדר הורתי
(1047044, 84, 4);[8, 10, 300, 40];משיח;269368;(35, 6, 5, 7, 269368);להשכחה;5;(35, 6, 5, 34, 1047044);אדין סרכיא ואחשדרפניא הוו בעין עלה להשכחה לדניאל מצד מלכותא וכל עלה ושחיתה לא יכלין להשכחה כל קבל די מהימן הוא וכל שלו ושחיתה לא השתכחת עלוהי
(203851, 85, 4);[8, 10, 300, 40];משיח;53742;(4, 9, 2, 5, 53742);הפסח;4;(4, 9, 2, 19, 203851);ויעשו בני ישראל את הפסח במועדו
(213749, 85, 4);[8, 10, 300, 40];משיח;56345;(4, 15, 10, 8, 56345);ניחח;4;(4, 15, 10, 30, 213749);ויין תקריב לנסך חצי ההין אשה ריח ניחח ליהוה
(236874, 85, 4);[8, 10, 300, 40];משיח;62372;(4, 29, 6, 10, 62372);לריח;4;(4, 29, 6, 49, 236874);מלבד עלת החדש ומנחתה ועלת התמיד ומנחתה ונסכיהם כמשפטם לריח ניחח אשה ליהוה
(320303, 85, 4);[8, 10, 300, 40];משיח;83919;(6, 10, 13, 17, 83919);בחצי;2;(6, 10, 13, 59, 320303);וידם השמש וירח עמד עד יקם גוי איביו הלא היא כתובה על ספר הישר ויעמד השמש בחצי השמים ולא אץ לבוא כיום תמים
(479704, 85, 4);[8, 10, 300, 40];משיח;124876;(10, 1, 45, 11, 124876);שמחים;3;(10, 1, 45, 46, 479704);וימשחו אתו צדוק הכהן ונתן הנביא למלך בגחון ויעלו משם שמחים ותהם הקריה הוא הקול אשר שמעתם
(499155, 85, 4);[8, 10, 300, 40];משיח;129911;(10, 10, 1, 11, 129911);בחידות;2;(10, 10, 1, 39, 499155);ומלכת שבא שמעת את שמע שלמה לשם יהוה ותבא לנסתו בחידות
(578261, 85, 4);[8, 10, 300, 40];משיח;150287;(12, 3, 7, 10, 150287);לחם;2;(12, 3, 7, 35, 578261);ישא ביום ההוא לאמר לא אהיה חבש ובביתי אין לחם ואין שמלה לא תשימני קצין עם
(701353, 85, 4);[8, 10, 300, 40];משיח;181724;(13, 38, 6, 14, 181724);וישלחו;5;(13, 38, 6, 57, 701353);ויקחו את ירמיהו וישלכו אתו אל הבור מלכיהו בן המלך אשר בחצר המטרה וישלחו את ירמיהו בחבלים ובבור אין מים כי אם טיט ויטבע ירמיהו בטיט
(998741, 85, 4);[8, 10, 300, 40];משיח;257026;(30, 5, 8, 12, 257026);שחולת;2;(30, 5, 8, 44, 998741);השבעתי אתכם בנות ירושלם אם תמצאו את דודי מה תגידו לו שחולת אהבה אני
(1108544, 85, 4);[8, 10, 300, 40];משיח;284140;(38, 7, 4, 7, 284140);מלחמה;3;(38, 7, 4, 33, 1108544);ועליהם לתלדותם לבית אבותם גדודי צבא מלחמה שלשים וששה אלף כי הרבו נשים ובנים
(1110112, 85, 4);[8, 10, 300, 40];משיח;284512;(38, 7, 40, 15, 284512);במלחמה;4;(38, 7, 40, 65, 1110112);כל אלה בני אשר ראשי בית האבות ברורים גבורי חילים ראשי הנשיאים והתיחשם בצבא במלחמה מספרם אנשים עשרים וששה אלף
(1134320, 85, 4);[8, 10, 300, 40];משיח;290368;(38, 25, 11, 4, 290368);ואחיו;3;(38, 25, 11, 18, 1134320);הרביעי ליצרי בניו ואחיו שנים עשר
(38320, 86, 4);[8, 10, 300, 40];משיח;10185;(1, 27, 41, 20, 10185);אחי;2;(1, 27, 41, 72, 38320);וישטם עשו את יעקב על הברכה אשר ברכו אביו ויאמר עשו בלבו יקרבו ימי אבל אבי ואהרגה את יעקב אחי
(201120, 86, 4);[8, 10, 300, 40];משיח;53027;(4, 7, 65, 1, 53027);ולזבח;5;(4, 7, 65, 5, 201120);ולזבח השלמים בקר שנים אילם חמשה עתדים חמשה כבשים בני שנה חמשה זה קרבן אבידן בן גדעני
(236580, 86, 4);[8, 10, 300, 40];משיח;62302;(4, 28, 31, 4, 62302);ומנחתו;4;(4, 28, 31, 16, 236580);מלבד עלת התמיד ומנחתו תעשו תמימם יהיו לכם ונסכיהם
(312585, 86, 4);[8, 10, 300, 40];משיח;81962;(6, 6, 18, 8, 81962);ולקחתם;4;(6, 6, 18, 28, 312585);ורק אתם שמרו מן החרם פן תחרימו ולקחתם מן החרם ושמתם את מחנה ישראל לחרם ועכרתם אותו
(342983, 86, 4);[8, 10, 300, 40];משיח;89613;(6, 24, 11, 10, 89613);יריחו;4;(6, 24, 11, 42, 342983);ותעברו את הירדן ותבאו אל יריחו וילחמו בכם בעלי יריחו האמרי והפרזי והכנעני והחתי והגרגשי החוי והיבוסי ואתן אותם בידכם
(422845, 86, 4);[8, 10, 300, 40];משיח;110021;(8, 24, 2, 5, 110021);מאחרי;3;(8, 24, 2, 17, 422845);ויהי כאשר שב שאול מאחרי פלשתים ויגדו לו לאמר הנה דוד במדבר עין גדי
(532005, 86, 4);[8, 10, 300, 40];משיח;138445;(11, 3, 22, 4, 138445);זרחה;3;(11, 3, 22, 19, 532005);וישכימו בבקר והשמש זרחה על המים ויראו מואב מנגד את המים אדמים כדם
(567071, 86, 4);[8, 10, 300, 40];משיח;147452;(11, 21, 13, 17, 147452);הצלחת;4;(11, 21, 13, 66, 567071);ונטיתי על ירושלם את קו שמרון ואת משקלת בית אחאב ומחיתי את ירושלם כאשר ימחה את הצלחת מחה והפך על פניה
(580920, 86, 4);[8, 10, 300, 40];משיח;150931;(12, 5, 30, 10, 150931);חשך;1;(12, 5, 30, 37, 580920);וינהם עליו ביום ההוא כנהמת ים ונבט לארץ והנה חשך צר ואור חשך בעריפיה
(600552, 86, 4);[8, 10, 300, 40];משיח;155974;(12, 28, 2, 13, 155974);הניח;4;(12, 28, 2, 50, 600552);הנה חזק ואמץ לאדני כזרם ברד שער קטב כזרם מים כבירים שטפים הניח לארץ ביד
(634911, 86, 4);[8, 10, 300, 40];משיח;164666;(12, 59, 14, 9, 164666);ברחוב;3;(12, 59, 14, 35, 634911);והסג אחור משפט וצדקה מרחוק תעמד כי כשלה ברחוב אמת ונכחה לא תוכל לבוא
(733507, 86, 4);[8, 10, 300, 40];משיח;189931;(14, 6, 7, 2, 189931);חלל;1;(14, 6, 7, 5, 733507);ונפל חלל בתוככם וידעתם כי אני יהוה
(950897, 86, 4);[8, 10, 300, 40];משיח;244504;(28, 17, 5, 5, 244504);שמח;3;(28, 17, 5, 16, 950897);לעג לרש חרף עשהו שמח לאיד לא ינקה
(960842, 86, 4);[8, 10, 300, 40];משיח;247154;(28, 28, 21, 7, 247154);לחם;2;(28, 28, 21, 19, 960842);הכר פנים לא טוב ועל פת לחם יפשע גבר
(1135205, 86, 4);[8, 10, 300, 40];משיח;290561;(38, 26, 6, 10, 290561);חיל;1;(38, 26, 6, 42, 1135205);ולשמעיה בנו נולד בנים הממשלים לבית אביהם כי גבורי חיל המה
(1184663, 86, 4);[8, 10, 300, 40];משיח;302601;(39, 30, 17, 10, 302601);הפסחים;4;(39, 30, 17, 37, 1184663);כי רבת בקהל אשר לא התקדשו והלוים על שחיטת הפסחים לכל לא טהור להקדיש ליהוה
(1187213, 86, 4);[8, 10, 300, 40];משיח;303159;(39, 32, 5, 1, 303159);ויתחזק;4;(39, 32, 5, 4, 1187213);ויתחזק ויבן את כל החומה הפרוצה ויעל על המגדלות ולחוצה החומה אחרת ויחזק את המלוא עיר דויד ויעש שלח לרב ומגנים
(67592, 87, 4);[8, 10, 300, 40];משיח;17888;(1, 44, 12, 1, 17888);ויחפש;3;(1, 44, 12, 3, 67592);ויחפש בגדול החל ובקטן כלה וימצא הגביע באמתחת בנימן
(99704, 87, 4);[8, 10, 300, 40];משיח;26300;(2, 14, 28, 18, 26300);אחד;2;(2, 14, 28, 66, 99704);וישבו המים ויכסו את הרכב ואת הפרשים לכל חיל פרעה הבאים אחריהם בים לא נשאר בהם עד אחד
(118812, 87, 4);[8, 10, 300, 40];משיח;31348;(2, 28, 11, 5, 31348);חתם;1;(2, 28, 11, 16, 118812);מעשה חרש אבן פתוחי חתם תפתח את שתי האבנים על שמת בני ישראל מסבת משבצות זהב תעשה אתם
(135871, 87, 4);[8, 10, 300, 40];משיח;35825;(2, 37, 23, 5, 35825);ומלקחיה;5;(2, 37, 23, 20, 135871);ויעש את נרתיה שבעה ומלקחיה ומחתתיה זהב טהור
(193995, 87, 4);[8, 10, 300, 40];משיח;51158;(4, 4, 26, 3, 51158);החצר;2;(4, 4, 26, 9, 193995);ואת קלעי החצר ואת מסך פתח שער החצר אשר על המשכן ועל המזבח סביב ואת מיתריהם ואת כל כלי עבדתם ואת כל אשר יעשה להם ועבדו
(235755, 87, 4);[8, 10, 300, 40];משיח;62101;(4, 28, 12, 16, 62101);האחד;3;(4, 28, 12, 67, 235755);ושלשה עשרנים סלת מנחה בלולה בשמן לפר האחד ושני עשרנים סלת מנחה בלולה בשמן לאיל האחד
(409660, 87, 4);[8, 10, 300, 40];משיח;106568;(8, 17, 10, 13, 106568);ונלחמה;4;(8, 17, 10, 51, 409660);ויאמר הפלשתי אני חרפתי את מערכות ישראל היום הזה תנו לי איש ונלחמה יחד
(441455, 87, 4);[8, 10, 300, 40];משיח;114877;(9, 4, 10, 12, 114877);ואחזה;3;(9, 4, 10, 43, 441455);כי המגיד לי לאמר הנה מת שאול והוא היה כמבשר בעיניו ואחזה בו ואהרגהו בצקלג אשר לתתי לו בשרה
(487254, 87, 4);[8, 10, 300, 40];משיח;126895;(10, 5, 26, 3, 126895);חכמה;1;(10, 5, 26, 9, 487254);ויהוה נתן חכמה לשלמה כאשר דבר לו ויהי שלם בין חירם ובין שלמה ויכרתו ברית שניהם
(536960, 87, 4);[8, 10, 300, 40];משיח;139728;(11, 6, 2, 5, 139728);ונקחה;4;(11, 6, 2, 17, 536960);נלכה נא עד הירדן ונקחה משם איש קורה אחת ונעשה לנו שם מקום לשבת שם ויאמר לכו
(636913, 87, 4);[8, 10, 300, 40];משיח;165156;(12, 61, 7, 1, 165156);תחת;2;(12, 61, 7, 2, 636913);תחת בשתכם משנה וכלמה ירנו חלקם לכן בארצם משנה יירשו שמחת עולם תהיה להם
(709228, 87, 4);[8, 10, 300, 40];משיח;183746;(13, 43, 9, 12, 183746);בתחפנחס;3;(13, 43, 9, 48, 709228);קח בידך אבנים גדלות וטמנתם במלט במלבן אשר בפתח בית פרעה בתחפנחס לעיני אנשים יהודים
(1007637, 87, 4);[8, 10, 300, 40];משיח;259317;(32, 2, 8, 4, 259317);חומת;1;(32, 2, 8, 14, 1007637);חשב יהוה להשחית חומת בת ציון נטה קו לא השיב ידו מבלע ויאבל חל וחומה יחדו אמללו
(1019056, 87, 4);[8, 10, 300, 40];משיח;262385;(33, 8, 12, 2, 262385);חטא;1;(33, 8, 12, 4, 1019056);אשר חטא עשה רע מאת ומאריך לו כי גם יודע אני אשר יהיה טוב ליראי האלהים אשר ייראו מלפניו
(151507, 88, 4);[8, 10, 300, 40];משיח;39971;(3, 8, 15, 1, 39971);וישחט;4;(3, 8, 15, 4, 151507);וישחט ויקח משה את הדם ויתן על קרנות המזבח סביב באצבעו ויחטא את המזבח ואת הדם יצק אל יסוד המזבח ויקדשהו לכפר עליו
(314745, 88, 4);[8, 10, 300, 40];משיח;82519;(6, 7, 21, 5, 82519);אחת;2;(6, 7, 21, 19, 314745);ואראה בשלל אדרת שנער אחת טובה ומאתים שקלים כסף ולשון זהב אחד חמשים שקלים משקלו ואחמדם ואקחם והנם טמונים בארץ בתוך האהלי והכסף תחתיה
(388991, 88, 4);[8, 10, 300, 40];משיח;101330;(8, 4, 10, 1, 101330);וילחמו;4;(8, 4, 10, 4, 388991);וילחמו פלשתים וינגף ישראל וינסו איש לאהליו ותהי המכה גדולה מאד ויפל מישראל שלשים אלף רגלי
(424123, 88, 4);[8, 10, 300, 40];משיח;110365;(8, 24, 22, 9, 110365);אחרי;2;(8, 24, 22, 31, 424123);ועתה השבעה לי ביהוה אם תכרית את זרעי אחרי ואם תשמיד את שמי מבית אבי
(491376, 88, 4);[8, 10, 300, 40];משיח;127906;(10, 7, 27, 10, 127906);האחת;3;(10, 7, 27, 39, 491376);ויעש את המכנות עשר נחשת ארבע באמה ארך המכונה האחת וארבע באמה רחבה ושלש באמה קומתה
(554810, 88, 4);[8, 10, 300, 40];משיח;144320;(11, 15, 21, 3, 144320);מנחם;3;(11, 15, 21, 11, 554810);ויתר דברי מנחם וכל אשר עשה הלוא הם כתובים על ספר דברי הימים למלכי ישראל
(640000, 88, 4);[8, 10, 300, 40];משיח;165930;(12, 65, 12, 5, 165930);לטבח;4;(12, 65, 12, 23, 640000);ומניתי אתכם לחרב וכלכם לטבח תכרעו יען קראתי ולא עניתם דברתי ולא שמעתם ותעשו הרע בעיני ובאשר לא חפצתי בחרתם
(766130, 88, 4);[8, 10, 300, 40];משיח;198171;(14, 27, 24, 10, 198171);חבשים;1;(14, 27, 24, 48, 766130);המה רכליך במכללים בגלומי תכלת ורקמה ובגנזי ברמים בחבלים חבשים וארזים במרכלתך
(852062, 88, 4);[8, 10, 300, 40];משיח;219811;(25, 11, 17, 6, 219811);חרב;1;(25, 11, 17, 20, 852062);הוי רעי האליל עזבי הצאן חרב על זרועו ועל עין ימינו זרעו יבוש תיבש ועין ימינו כהה תכהה
(933449, 88, 4);[8, 10, 300, 40];משיח;240081;(27, 141, 7, 2, 240081);פלח;3;(27, 141, 7, 6, 933449);כמו פלח ובקע בארץ נפזרו עצמינו לפי שאול
