(49912, 63, 5);[40, 300, 10, 8, 6];משיחו;12961;(10, 22, 40, 5, 12961);וימלך;3;(10, 22, 40, 19, 49912);וישכב אחאב עם אבתיו וימלך אחזיהו בנו תחתיו
(9432, 69, 5);[40, 300, 10, 8, 6];משיחו;2484;(10, 5, 14, 4, 2484);לשמע;3;(10, 5, 14, 16, 9432);ויבאו מכל העמים לשמע את חכמת שלמה מאת כל מלכי הארץ אשר שמעו את חכמתו
(19422, 76, 5);[40, 300, 10, 8, 6];משיחו;5015;(10, 8, 54, 14, 5015);מזבח;1;(10, 8, 54, 52, 19422);ויהי ככלות שלמה להתפלל אל יהוה את כל התפלה והתחנה הזאת קם מלפני מזבח יהוה מכרע על ברכיו וכפיו פרשות השמים
(52026, 77, 5);[40, 300, 10, 8, 6];משיחו;13498;(11, 1, 18, 13, 13498);למלכי;2;(11, 1, 18, 49, 52026);ויתר דברי אחזיהו אשר עשה הלוא המה כתובים על ספר דברי הימים למלכי ישראל
(19655, 82, 5);[40, 300, 10, 8, 6];משיחו;5075;(10, 8, 58, 10, 5075);ומשפטיו;2;(10, 8, 58, 44, 19655);להטות לבבנו אליו ללכת בכל דרכיו ולשמר מצותיו וחקיו ומשפטיו אשר צוה את אבתינו
(29975, 3, 6);[30, 40, 300, 10, 8, 6];למשיחו;7780;(10, 13, 18, 17, 7780);ויאכל;5;(10, 13, 18, 62, 29975);ויאמר לו גם אני נביא כמוך ומלאך דבר אלי בדבר יהוה לאמר השבהו אתך אל ביתך ויאכל לחם וישת מים כחש לו
(10163, 18, 6);[30, 40, 300, 10, 8, 6];למשיחו;2689;(10, 5, 25, 3, 2689);לחירם;1;(10, 5, 25, 9, 10163);ושלמה נתן לחירם עשרים אלף כר חטים מכלת לביתו ועשרים כר שמן כתית כה יתן שלמה לחירם שנה בשנה
(44195, 12, 5);[40, 300, 10, 8, 5];משיחה;11480;(10, 20, 23, 20, 11480);מהם;3;(10, 20, 23, 74, 44195);ועבדי מלך ארם אמרו אליו אלהי הרים אלהיהם על כן חזקו ממנו ואולם נלחם אתם במישור אם לא נחזק מהם
(55800, 12, 5);[40, 300, 10, 8, 5];משיחה;14471;(11, 4, 7, 5, 14471);ויאמר;4;(11, 4, 7, 22, 55800);ותבא ותגד לאיש האלהים ויאמר לכי מכרי את השמן ושלמי את נשיכי ואת בניכי תחיי בנותר
(15145, 18, 5);[40, 300, 10, 8, 5];משיחה;3900;(10, 7, 39, 19, 3900);הימנית;3;(10, 7, 39, 68, 15145);ויתן את המכנות חמש על כתף הבית מימין וחמש על כתף הבית משמאלו ואת הים נתן מכתף הבית הימנית קדמה ממול נגב
(20093, 20, 5);[40, 300, 10, 8, 5];משיחה;5189;(10, 8, 64, 33, 5189);המנחה;2;(10, 8, 64, 113, 20093);ביום ההוא קדש המלך את תוך החצר אשר לפני בית יהוה כי עשה שם את העלה ואת המנחה ואת חלבי השלמים כי מזבח הנחשת אשר לפני יהוה קטן מהכיל את העלה ואת המנחה ואת חלבי השלמים
(77813, 21, 5);[40, 300, 10, 8, 5];משיחה;20139;(11, 15, 21, 9, 20139);כתובים;6;(11, 15, 21, 33, 77813);ויתר דברי מנחם וכל אשר עשה הלוא הם כתובים על ספר דברי הימים למלכי ישראל
(27737, 45, 5);[40, 300, 10, 8, 5];משיחה;7180;(10, 12, 18, 14, 7180);וימת;3;(10, 12, 18, 49, 27737);וישלח המלך רחבעם את אדרם אשר על המס וירגמו כל ישראל בו אבן וימת והמלך רחבעם התאמץ לעלות במרכבה לנוס ירושלם
(73020, 47, 5);[40, 300, 10, 8, 5];משיחה;18897;(11, 12, 21, 1, 18897);ויקמו;4;(11, 12, 21, 4, 73020);ויקמו עבדיו ויקשרו קשר ויכו את יואש בית מלא הירד סלא
(97206, 56, 5);[40, 300, 10, 8, 5];משיחה;25100;(11, 25, 13, 19, 25100);נחשתם;5;(11, 25, 13, 74, 97206);ואת עמודי הנחשת אשר בית יהוה ואת המכנות ואת ים הנחשת אשר בבית יהוה שברו כשדים וישאו את נחשתם בבלה
(60363, 69, 5);[40, 300, 10, 8, 5];משיחה;15650;(11, 6, 10, 17, 15650);שתים;4;(11, 6, 10, 63, 60363);וישלח מלך ישראל אל המקום אשר אמר לו איש האלהים והזהירה ונשמר שם לא אחת ולא שתים
(74026, 70, 5);[40, 300, 10, 8, 5];משיחה;19159;(11, 13, 14, 16, 19159);ויאמר;4;(11, 13, 14, 58, 74026);ואלישע חלה את חליו אשר ימות בו וירד אליו יואש מלך ישראל ויבך על פניו ויאמר אבי אבי רכב ישראל ופרשיו
(80639, 72, 5);[40, 300, 10, 8, 5];משיחה;20873;(11, 17, 7, 8, 20873);המעלה;2;(11, 17, 7, 31, 80639);ויהי כי חטאו בני ישראל ליהוה אלהיהם המעלה אתם מארץ מצרים מתחת יד פרעה מלך מצרים וייראו אלהים אחרים
(80440, 85, 5);[40, 300, 10, 8, 5];משיחה;20824;(11, 17, 4, 15, 20824);מנחה;1;(11, 17, 4, 53, 80440);וימצא מלך אשור בהושע קשר אשר שלח מלאכים אל סוא מלך מצרים ולא העלה מנחה למלך אשור כשנה בשנה ויעצרהו מלך אשור ויאסרהו בית כלא
(77827, 88, 5);[40, 300, 10, 8, 5];משיחה;20143;(11, 15, 21, 13, 20143);הימים;5;(11, 15, 21, 47, 77827);ויתר דברי מנחם וכל אשר עשה הלוא הם כתובים על ספר דברי הימים למלכי ישראל
(27692, 45, 6);[30, 40, 300, 10, 8, 5];למשיחה;7167;(10, 12, 18, 1, 7167);וישלח;4;(10, 12, 18, 4, 27692);וישלח המלך רחבעם את אדרם אשר על המס וירגמו כל ישראל בו אבן וימת והמלך רחבעם התאמץ לעלות במרכבה לנוס ירושלם
(77792, 21, 6);[40, 40, 300, 10, 8, 5];ממשיחה;20133;(11, 15, 21, 3, 20133);מנחם;4;(11, 15, 21, 12, 77792);ויתר דברי מנחם וכל אשר עשה הלוא הם כתובים על ספר דברי הימים למלכי ישראל
(77739, 88, 6);[40, 40, 300, 10, 8, 5];ממשיחה;20119;(11, 15, 20, 14, 20119);חמשים;2;(11, 15, 20, 47, 77739);ויצא מנחם את הכסף על ישראל על כל גבורי החיל לתת למלך אשור חמשים שקלים כסף לאיש אחד וישב מלך אשור ולא עמד שם בארץ
(32317, 11, 6);[40, 300, 10, 8, 50, 6];משיחנו;8389;(10, 14, 20, 5, 8389);עשרים;5;(10, 14, 20, 22, 32317);והימים אשר מלך ירבעם עשרים ושתים שנה וישכב עם אבתיו וימלך נדב בנו תחתיו
(32306, 11, 7);[30, 40, 300, 10, 8, 50, 6];למשיחנו;8387;(10, 14, 20, 3, 8387);מלך;2;(10, 14, 20, 11, 32306);והימים אשר מלך ירבעם עשרים ושתים שנה וישכב עם אבתיו וימלך נדב בנו תחתיו
