(n, d, k);[Gematria of ELS];ELS Search Term;Found in WordNumber In Text;WordCoordinatesDWTK;Found in Word In Text;LetterPositionIndex In Word;LetterCoordinatesD5K of First Letter in ELS;Found In Verse
(46869, 2, 4);[40, 300, 10, 8];משיח;12491;(1, 32, 8, 15, 12491);והגמלים;7;(1, 32, 8, 54, 46869);ויירא יעקב מאד ויצר לו ויחץ את העם אשר אתו ואת הצאן ואת הבקר והגמלים לשני מחנות
(21138, 5, 4);[40, 300, 10, 8];משיח;5650;(1, 18, 14, 4, 5650);למועד;2;(1, 18, 14, 15, 21138);היפלא מיהוה דבר למועד אשוב אליך כעת חיה ולשרה בן
(28363, 5, 4);[40, 300, 10, 8];משיח;7569;(1, 23, 1, 6, 7569);ועשרים;6;(1, 23, 1, 23, 28363);ויהיו חיי שרה מאה שנה ועשרים שנה ושבע שנים שני חיי שרה
(61350, 5, 4);[40, 300, 10, 8];משיח;16282;(1, 41, 26, 8, 16282);השבלים;6;(1, 41, 26, 30, 61350);שבע פרת הטבת שבע שנים הנה ושבע השבלים הטבת שבע שנים הנה חלום אחד הוא
(61526, 5, 4);[40, 300, 10, 8];משיח;16328;(1, 41, 29, 9, 16328);מצרים;5;(1, 41, 29, 32, 61526);הנה שבע שנים באות שבע גדול בכל ארץ מצרים
(38513, 7, 4);[40, 300, 10, 8];משיח;10238;(1, 27, 45, 13, 10238);משם;1;(1, 27, 45, 43, 38513);עד שוב אף אחיך ממך ושכח את אשר עשית לו ושלחתי ולקחתיך משם למה אשכל גם שניכם יום אחד
(13936, 8, 4);[40, 300, 10, 8];משיח;3732;(1, 11, 29, 4, 3732);להם;3;(1, 11, 29, 16, 13936);ויקח אברם ונחור להם נשים שם אשת אברם שרי ושם אשת נחור מלכה בת הרן אבי מלכה ואבי יסכה
(48570, 8, 4);[40, 300, 10, 8];משיח;12935;(1, 33, 8, 5, 12935);המחנה;2;(1, 33, 8, 13, 48570);ויאמר מי לך כל המחנה הזה אשר פגשתי ויאמר למצא חן בעיני אדני
(7399, 9, 4);[40, 300, 10, 8];משיח;1977;(1, 6, 13, 2, 1977);אלהים;5;(1, 6, 13, 10, 7399);ויאמר אלהים לנח קץ כל בשר בא לפני כי מלאה הארץ חמס מפניהם והנני משחיתם את הארץ
(38127, 9, 4);[40, 300, 10, 8];משיח;10133;(1, 27, 38, 11, 10133);גם;2;(1, 27, 38, 37, 38127);ויאמר עשו אל אביו הברכה אחת הוא לך אבי ברכני גם אני אבי וישא עשו קלו ויבך
(74799, 9, 4);[40, 300, 10, 8];משיח;19754;(1, 48, 16, 8, 19754);הנערים;6;(1, 48, 16, 29, 74799);המלאך הגאל אתי מכל רע יברך את הנערים ויקרא בהם שמי ושם אבתי אברהם ויצחק וידגו לרב בקרב הארץ
(13283, 10, 4);[40, 300, 10, 8];משיח;3562;(1, 11, 13, 8, 3562);שנים;4;(1, 11, 13, 32, 13283);ויחי ארפכשד אחרי הולידו את שלח שלש שנים וארבע מאות שנה ויולד בנים ובנות
(9884, 11, 4);[40, 300, 10, 8];משיח;2651;(1, 8, 16, 2, 2651);מן;1;(1, 8, 16, 3, 9884);צא מן התבה אתה ואשתך ובניך ונשי בניך אתך
(48519, 12, 4);[40, 300, 10, 8];משיח;12922;(1, 33, 7, 2, 12922);גם;2;(1, 33, 7, 6, 48519);ותגש גם לאה וילדיה וישתחוו ואחר נגש יוסף ורחל וישתחוו
(7819, 13, 4);[40, 300, 10, 8];משיח;2091;(1, 6, 20, 7, 2091);רמש;2;(1, 6, 20, 29, 7819);מהעוף למינהו ומן הבהמה למינה מכל רמש האדמה למינהו שנים מכל יבאו אליך להחיות
(27093, 13, 4);[40, 300, 10, 8];משיח;7231;(1, 22, 2, 22, 7231);ההרים;5;(1, 22, 2, 71, 27093);ויאמר קח נא את בנך את יחידך אשר אהבת את יצחק ולך לך אל ארץ המריה והעלהו שם לעלה על אחד ההרים אשר אמר אליך
(6023, 14, 4);[40, 300, 10, 8];משיח;1609;(1, 5, 15, 2, 1609);מהללאל;1;(1, 5, 15, 5, 6023);ויחי מהללאל חמש שנים וששים שנה ויולד את ירד
(35363, 14, 4);[40, 300, 10, 8];משיח;9405;(1, 26, 18, 16, 9405);אברהם;5;(1, 26, 18, 68, 35363);וישב יצחק ויחפר את בארת המים אשר חפרו בימי אברהם אביו ויסתמום פלשתים אחרי מות אברהם ויקרא להן שמות כשמת אשר קרא להן אביו
(63804, 18, 4);[40, 300, 10, 8];משיח;16939;(1, 42, 18, 1, 16939);ויאמר;4;(1, 42, 18, 4, 63804);ויאמר אלהם יוסף ביום השלישי זאת עשו וחיו את האלהים אני ירא
(3257, 20, 4);[40, 300, 10, 8];משיח;855;(1, 3, 7, 6, 855);עירמם;4;(1, 3, 7, 27, 3257);ותפקחנה עיני שניהם וידעו כי עירמם הם ויתפרו עלה תאנה ויעשו להם חגרת
(30887, 23, 4);[40, 300, 10, 8];משיח;8252;(1, 24, 30, 15, 8252);לאמר;3;(1, 24, 30, 55, 30887);ויהי כראת את הנזם ואת הצמדים על ידי אחתו וכשמעו את דברי רבקה אחתו לאמר כה דבר אלי האיש ויבא אל האיש והנה עמד על הגמלים על העין
(50396, 23, 4);[40, 300, 10, 8];משיח;13431;(1, 34, 25, 2, 13431);ביום;4;(1, 34, 25, 8, 50396);ויהי ביום השלישי בהיותם כאבים ויקחו שני בני יעקב שמעון ולוי אחי דינה איש חרבו ויבאו על העיר בטח ויהרגו כל זכר
(14519, 24, 4);[40, 300, 10, 8];משיח;3891;(1, 12, 7, 13, 3891);מזבח;1;(1, 12, 7, 44, 14519);וירא יהוה אל אברם ויאמר לזרעך אתן את הארץ הזאת ויבן שם מזבח ליהוה הנראה אליו
(18822, 30, 4);[40, 300, 10, 8];משיח;5044;(1, 16, 11, 1, 5044);ויאמר;4;(1, 16, 11, 4, 18822);ויאמר לה מלאך יהוה הנך הרה וילדת בן וקראת שמו ישמעאל כי שמע יהוה אל עניך
(63041, 30, 4);[40, 300, 10, 8];משיח;16740;(1, 42, 2, 1, 16740);ויאמר;4;(1, 42, 2, 4, 63041);ויאמר הנה שמעתי כי יש שבר במצרים רדו שמה ושברו לנו משם ונחיה ולא נמות
(65686, 30, 4);[40, 300, 10, 8];משיח;17424;(1, 43, 12, 7, 17424);המושב;2;(1, 43, 12, 25, 65686);וכסף משנה קחו בידכם ואת הכסף המושב בפי אמתחתיכם תשיבו בידכם אולי משגה הוא
(39618, 32, 4);[40, 300, 10, 8];משיח;10535;(1, 28, 19, 3, 10535);שם;2;(1, 28, 19, 9, 39618);ויקרא את שם המקום ההוא בית אל ואולם לוז שם העיר לראשנה
(50349, 33, 4);[40, 300, 10, 8];משיח;13417;(1, 34, 24, 5, 13417);שכם;3;(1, 34, 24, 18, 50349);וישמעו אל חמור ואל שכם בנו כל יצאי שער עירו וימלו כל זכר כל יצאי שער עירו
(65974, 33, 4);[40, 300, 10, 8];משיח;17494;(1, 43, 16, 21, 17494);בצהרים;6;(1, 43, 16, 83, 65974);וירא יוסף אתם את בנימין ויאמר לאשר על ביתו הבא את האנשים הביתה וטבח טבח והכן כי אתי יאכלו האנשים בצהרים
(33090, 36, 4);[40, 300, 10, 8];משיח;8820;(1, 25, 6, 14, 8820);קדמה;3;(1, 25, 6, 61, 33090);ולבני הפילגשים אשר לאברהם נתן אברהם מתנת וישלחם מעל יצחק בנו בעודנו חי קדמה אל ארץ קדם
(9503, 37, 4);[40, 300, 10, 8];משיח;2546;(1, 8, 8, 7, 2546);המים;4;(1, 8, 8, 29, 9503);וישלח את היונה מאתו לראות הקלו המים מעל פני האדמה
(58935, 37, 4);[40, 300, 10, 8];משיח;15666;(1, 40, 3, 3, 15666);במשמר;4;(1, 40, 3, 11, 58935);ויתן אתם במשמר בית שר הטבחים אל בית הסהר מקום אשר יוסף אסור שם
(38420, 38, 4);[40, 300, 10, 8];משיח;10210;(1, 27, 43, 5, 10210);וקום;4;(1, 27, 43, 18, 38420);ועתה בני שמע בקלי וקום ברח לך אל לבן אחי חרנה
(66541, 38, 4);[40, 300, 10, 8];משיח;17630;(1, 43, 26, 7, 17630);המנחה;2;(1, 43, 26, 25, 66541);ויבא יוסף הביתה ויביאו לו את המנחה אשר בידם הביתה וישתחוו לו ארצה
(6672, 39, 4);[40, 300, 10, 8];משיח;1772;(1, 5, 29, 12, 1772);האדמה;4;(1, 5, 29, 48, 6672);ויקרא את שמו נח לאמר זה ינחמנו ממעשנו ומעצבון ידינו מן האדמה אשר אררה יהוה
(26416, 39, 4);[40, 300, 10, 8];משיח;7050;(1, 21, 22, 12, 7050);אלהים;5;(1, 21, 22, 49, 26416);ויהי בעת ההוא ויאמר אבימלך ופיכל שר צבאו אל אברהם לאמר אלהים עמך בכל אשר אתה עשה
(77651, 40, 4);[40, 300, 10, 8];משיח;20504;(1, 50, 18, 9, 20504);לעבדים;6;(1, 50, 18, 39, 77651);וילכו גם אחיו ויפלו לפניו ויאמרו הננו לך לעבדים
(69980, 43, 4);[40, 300, 10, 8];משיח;18517;(1, 45, 23, 7, 18517);מטוב;1;(1, 45, 23, 28, 69980);ולאביו שלח כזאת עשרה חמרים נשאים מטוב מצרים ועשר אתנת נשאת בר ולחם ומזון לאביו לדרך
(75619, 44, 4);[40, 300, 10, 8];משיח;19967;(1, 49, 9, 11, 19967);מי;1;(1, 49, 9, 41, 75619);גור אריה יהודה מטרף בני עלית כרע רבץ כאריה וכלביא מי יקימנו
(11470, 45, 4);[40, 300, 10, 8];משיח;3086;(1, 9, 27, 2, 3086);אלהים;5;(1, 9, 27, 8, 11470);יפת אלהים ליפת וישכן באהלי שם ויהי כנען עבד למו
(27386, 47, 4);[40, 300, 10, 8];משיח;7308;(1, 22, 7, 4, 7308);אברהם;5;(1, 22, 7, 16, 27386);ויאמר יצחק אל אברהם אביו ויאמר אבי ויאמר הנני בני ויאמר הנה האש והעצים ואיה השה לעלה
(8267, 51, 4);[40, 300, 10, 8];משיח;2215;(1, 7, 7, 11, 2215);מי;1;(1, 7, 7, 38, 8267);ויבא נח ובניו ואשתו ונשי בניו אתו אל התבה מפני מי המבול
(58883, 51, 4);[40, 300, 10, 8];משיח;15652;(1, 40, 1, 12, 15652);מצרים;5;(1, 40, 1, 54, 58883);ויהי אחר הדברים האלה חטאו משקה מלך מצרים והאפה לאדניהם למלך מצרים
(60429, 51, 4);[40, 300, 10, 8];משיח;16047;(1, 41, 8, 10, 16047);מצרים;5;(1, 41, 8, 41, 60429);ויהי בבקר ותפעם רוחו וישלח ויקרא את כל חרטמי מצרים ואת כל חכמיה ויספר פרעה להם את חלמו ואין פותר אותם לפרעה
(69808, 51, 4);[40, 300, 10, 8];משיח;18470;(1, 45, 19, 15, 18470);ובאתם;5;(1, 45, 19, 65, 69808);ואתה צויתה זאת עשו קחו לכם מארץ מצרים עגלות לטפכם ולנשיכם ונשאתם את אביכם ובאתם
(52599, 52, 4);[40, 300, 10, 8];משיח;14017;(1, 36, 9, 5, 14017);אדום;4;(1, 36, 9, 19, 52599);ואלה תלדות עשו אבי אדום בהר שעיר
(54325, 54, 4);[40, 300, 10, 8];משיח;14470;(1, 37, 6, 1, 14470);ויאמר;4;(1, 37, 6, 4, 54325);ויאמר אליהם שמעו נא החלום הזה אשר חלמתי
(9256, 55, 4);[40, 300, 10, 8];משיח;2483;(1, 8, 3, 2, 2483);המים;4;(1, 8, 3, 9, 9256);וישבו המים מעל הארץ הלוך ושוב ויחסרו המים מקצה חמשים ומאת יום
(66989, 60, 4);[40, 300, 10, 8];משיח;17735;(1, 43, 34, 9, 17735);ממשאת;2;(1, 43, 34, 34, 66989);וישא משאת מאת פניו אלהם ותרב משאת בנימן ממשאת כלם חמש ידות וישתו וישכרו עמו
(75025, 60, 4);[40, 300, 10, 8];משיח;19816;(1, 48, 19, 14, 19816);ואולם;5;(1, 48, 19, 54, 75025);וימאן אביו ויאמר ידעתי בני ידעתי גם הוא יהיה לעם וגם הוא יגדל ואולם אחיו הקטן יגדל ממנו וזרעו יהיה מלא הגוים
(45351, 61, 4);[40, 300, 10, 8];משיח;12092;(1, 31, 34, 16, 12092);מצא;1;(1, 31, 34, 57, 45351);ורחל לקחה את התרפים ותשמם בכר הגמל ותשב עליהם וימשש לבן את כל האהל ולא מצא
(33512, 67, 4);[40, 300, 10, 8];משיח;8929;(1, 25, 16, 6, 8929);שמתם;4;(1, 25, 16, 22, 33512);אלה הם בני ישמעאל ואלה שמתם בחצריהם ובטירתם שנים עשר נשיאם לאמתם
(58995, 68, 4);[40, 300, 10, 8];משיח;15683;(1, 40, 4, 6, 15683);אתם;3;(1, 40, 4, 22, 58995);ויפקד שר הטבחים את יוסף אתם וישרת אתם ויהיו ימים במשמר
(37350, 70, 4);[40, 300, 10, 8];משיח;9927;(1, 27, 25, 7, 9927);למען;2;(1, 27, 25, 25, 37350);ויאמר הגשה לי ואכלה מציד בני למען תברכך נפשי ויגש לו ויאכל ויבא לו יין וישת
(12276, 71, 4);[40, 300, 10, 8];משיח;3292;(1, 10, 20, 3, 3292);חם;2;(1, 10, 20, 8, 12276);אלה בני חם למשפחתם ללשנתם בארצתם בגויהם
(65483, 71, 4);[40, 300, 10, 8];משיח;17374;(1, 43, 9, 3, 17374);מידי;1;(1, 43, 9, 11, 65483);אנכי אערבנו מידי תבקשנו אם לא הביאתיו אליך והצגתיו לפניך וחטאתי לך כל הימים
(48017, 72, 4);[40, 300, 10, 8];משיח;12790;(1, 32, 30, 11, 12790);לשמי;3;(1, 32, 30, 41, 48017);וישאל יעקב ויאמר הגידה נא שמך ויאמר למה זה תשאל לשמי ויברך אתו שם
(13283, 73, 4);[40, 300, 10, 8];משיח;3562;(1, 11, 13, 8, 3562);שנים;4;(1, 11, 13, 32, 13283);ויחי ארפכשד אחרי הולידו את שלח שלש שנים וארבע מאות שנה ויולד בנים ובנות
(2129, 74, 4);[40, 300, 10, 8];משיח;553;(1, 2, 9, 13, 553);החיים;5;(1, 2, 9, 51, 2129);ויצמח יהוה אלהים מן האדמה כל עץ נחמד למראה וטוב למאכל ועץ החיים בתוך הגן ועץ הדעת טוב ורע
(13283, 75, 4);[40, 300, 10, 8];משיח;3562;(1, 11, 13, 8, 3562);שנים;4;(1, 11, 13, 32, 13283);ויחי ארפכשד אחרי הולידו את שלח שלש שנים וארבע מאות שנה ויולד בנים ובנות
(22318, 75, 4);[40, 300, 10, 8];משיח;5947;(1, 19, 2, 16, 5947);ויאמרו;4;(1, 19, 2, 69, 22318);ויאמר הנה נא אדני סורו נא אל בית עבדכם ולינו ורחצו רגליכם והשכמתם והלכתם לדרככם ויאמרו לא כי ברחוב נלין
(5962, 76, 4);[40, 300, 10, 8];משיח;1593;(1, 5, 13, 10, 1593);מאות;1;(1, 5, 13, 41, 5962);ויחי קינן אחרי הולידו את מהללאל ארבעים שנה ושמנה מאות שנה ויולד בנים ובנות
(65545, 81, 4);[40, 300, 10, 8];משיח;17388;(1, 43, 10, 3, 17388);התמהמהנו;5;(1, 43, 10, 11, 65545);כי לולא התמהמהנו כי עתה שבנו זה פעמים
(20316, 86, 4);[40, 300, 10, 8];משיח;5435;(1, 17, 23, 23, 5435);בעצם;4;(1, 17, 23, 83, 20316);ויקח אברהם את ישמעאל בנו ואת כל ילידי ביתו ואת כל מקנת כספו כל זכר באנשי בית אברהם וימל את בשר ערלתם בעצם היום הזה כאשר דבר אתו אלהים
(28503, 86, 4);[40, 300, 10, 8];משיח;7607;(1, 23, 4, 9, 7607);עמכם;4;(1, 23, 4, 31, 28503);גר ותושב אנכי עמכם תנו לי אחזת קבר עמכם ואקברה מתי מלפני
(6445, 87, 4);[40, 300, 10, 8];משיח;1715;(1, 5, 24, 9, 1715);אלהים;5;(1, 5, 24, 37, 6445);ויתהלך חנוך את האלהים ואיננו כי לקח אתו אלהים
(16520, 88, 4);[40, 300, 10, 8];משיח;4428;(1, 14, 9, 8, 4428);ואמרפל;3;(1, 14, 9, 31, 16520);את כדרלעמר מלך עילם ותדעל מלך גוים ואמרפל מלך שנער ואריוך מלך אלסר ארבעה מלכים את החמשה
(726, 89, 4);[40, 300, 10, 8];משיח;186;(1, 1, 16, 2, 186);אלהים;5;(1, 1, 16, 9, 726);ויעש אלהים את שני המארת הגדלים את המאור הגדל לממשלת היום ואת המאור הקטן לממשלת הלילה ואת הכוכבים
(5496, 92, 4);[40, 300, 10, 8];משיח;1470;(1, 5, 2, 8, 1470);שמם;3;(1, 5, 2, 30, 5496);זכר ונקבה בראם ויברך אתם ויקרא את שמם אדם ביום הבראם
(6633, 92, 4);[40, 300, 10, 8];משיח;1763;(1, 5, 29, 3, 1763);שמו;2;(1, 5, 29, 9, 6633);ויקרא את שמו נח לאמר זה ינחמנו ממעשנו ומעצבון ידינו מן האדמה אשר אררה יהוה
(31133, 92, 4);[40, 300, 10, 8];משיח;8314;(1, 24, 35, 5, 8314);מאד;1;(1, 24, 35, 15, 31133);ויהוה ברך את אדני מאד ויגדל ויתן לו צאן ובקר וכסף וזהב ועבדם ושפחת וגמלים וחמרים
(66480, 92, 4);[40, 300, 10, 8];משיח;17613;(1, 43, 25, 3, 17613);המנחה;2;(1, 43, 25, 10, 66480);ויכינו את המנחה עד בוא יוסף בצהרים כי שמעו כי שם יאכלו לחם
(7024, 93, 4);[40, 300, 10, 8];משיח;1871;(1, 6, 4, 15, 1871);האדם;4;(1, 6, 4, 56, 7024);הנפלים היו בארץ בימים ההם וגם אחרי כן אשר יבאו בני האלהים אל בנות האדם וילדו להם המה הגברים אשר מעולם אנשי השם
(29542, 94, 4);[40, 300, 10, 8];משיח;7890;(1, 24, 5, 1, 7890);ויאמר;4;(1, 24, 5, 4, 29542);ויאמר אליו העבד אולי לא תאבה האשה ללכת אחרי אל הארץ הזאת ההשב אשיב את בנך אל הארץ אשר יצאת משם
(48039, 95, 4);[40, 300, 10, 8];משיח;12796;(1, 32, 31, 3, 12796);שם;2;(1, 32, 31, 11, 48039);ויקרא יעקב שם המקום פניאל כי ראיתי אלהים פנים אל פנים ותנצל נפשי
(16124, 96, 4);[40, 300, 10, 8];משיח;4325;(1, 14, 2, 10, 4325);עמרה;2;(1, 14, 2, 31, 16124);עשו מלחמה את ברע מלך סדם ואת ברשע מלך עמרה שנאב מלך אדמה ושמאבר מלך צביים ומלך בלע היא צער
(26826, 98, 4);[40, 300, 10, 8];משיח;7160;(1, 21, 31, 4, 7160);למקום;5;(1, 21, 31, 12, 26826);על כן קרא למקום ההוא באר שבע כי שם נשבעו שניהם
(19743, 99, 4);[40, 300, 10, 8];משיח;5286;(1, 17, 13, 11, 5286);עולם;4;(1, 17, 13, 50, 19743);המול ימול יליד ביתך ומקנת כספך והיתה בריתי בבשרכם לברית עולם
(38191, 99, 4);[40, 300, 10, 8];משיח;10150;(1, 27, 39, 11, 10150);ומטל;2;(1, 27, 39, 44, 38191);ויען יצחק אביו ויאמר אליו הנה משמני הארץ יהיה מושבך ומטל השמים מעל
(14661, 100, 4);[40, 300, 10, 8];משיח;3927;(1, 12, 10, 8, 3927);שם;2;(1, 12, 10, 31, 14661);ויהי רעב בארץ וירד אברם מצרימה לגור שם כי כבד הרעב בארץ
(21762, 100, 4);[40, 300, 10, 8];משיח;5811;(1, 18, 26, 13, 5811);בעבורם;6;(1, 18, 26, 57, 21762);ויאמר יהוה אם אמצא בסדם חמשים צדיקם בתוך העיר ונשאתי לכל המקום בעבורם
(35335, 14, 6);[1, 400, 40, 300, 10, 8];את משיח;9400;(1, 26, 18, 11, 9400);אביו;1;(1, 26, 18, 40, 35335);וישב יצחק ויחפר את בארת המים אשר חפרו בימי אברהם אביו ויסתמום פלשתים אחרי מות אברהם ויקרא להן שמות כשמת אשר קרא להן אביו
(46867, 2, 5);[30, 40, 300, 10, 8];למשיח;12491;(1, 32, 8, 15, 12491);והגמלים;5;(1, 32, 8, 52, 46867);ויירא יעקב מאד ויצר לו ויחץ את העם אשר אתו ואת הצאן ואת הבקר והגמלים לשני מחנות
(27080, 13, 5);[30, 40, 300, 10, 8];למשיח;7228;(1, 22, 2, 19, 7228);לעלה;1;(1, 22, 2, 58, 27080);ויאמר קח נא את בנך את יחידך אשר אהבת את יצחק ולך לך אל ארץ המריה והעלהו שם לעלה על אחד ההרים אשר אמר אליך
(14495, 24, 5);[30, 40, 300, 10, 8];למשיח;3884;(1, 12, 7, 6, 3884);לזרעך;1;(1, 12, 7, 20, 14495);וירא יהוה אל אברם ויאמר לזרעך אתן את הארץ הזאת ויבן שם מזבח ליהוה הנראה אליו
(11425, 45, 5);[30, 40, 300, 10, 8];למשיח;3075;(1, 9, 25, 7, 3075);לאחיו;1;(1, 9, 25, 26, 11425);ויאמר ארור כנען עבד עבדים יהיה לאחיו
(54271, 54, 5);[30, 40, 300, 10, 8];למשיח;14457;(1, 37, 4, 11, 14457);ולא;2;(1, 37, 4, 40, 54271);ויראו אחיו כי אתו אהב אביהם מכל אחיו וישנאו אתו ולא יכלו דברו לשלם
(13210, 73, 5);[30, 40, 300, 10, 8];למשיח;3544;(1, 11, 11, 10, 3544);ויולד;4;(1, 11, 11, 38, 13210);ויחי שם אחרי הולידו את ארפכשד חמש מאות שנה ויולד בנים ובנות
(637, 89, 5);[30, 40, 300, 10, 8];למשיח;166;(1, 1, 14, 7, 166);להבדיל;6;(1, 1, 14, 33, 637);ויאמר אלהים יהי מארת ברקיע השמים להבדיל בין היום ובין הלילה והיו לאתת ולמועדים ולימים ושנים
(13928, 8, 5);[40, 40, 300, 10, 8];ממשיח;3730;(1, 11, 29, 2, 3730);אברם;4;(1, 11, 29, 8, 13928);ויקח אברם ונחור להם נשים שם אשת אברם שרי ושם אשת נחור מלכה בת הרן אבי מלכה ואבי יסכה
(9873, 11, 5);[40, 40, 300, 10, 8];ממשיח;2646;(1, 8, 15, 2, 2646);אלהים;5;(1, 8, 15, 10, 9873);וידבר אלהים אל נח לאמר
(63786, 18, 5);[40, 40, 300, 10, 8];ממשיח;16934;(1, 42, 17, 2, 16934);אתם;3;(1, 42, 17, 8, 63786);ויאסף אתם אל משמר שלשת ימים
(63011, 30, 5);[40, 40, 300, 10, 8];ממשיח;16734;(1, 42, 1, 6, 16734);במצרים;2;(1, 42, 1, 17, 63011);וירא יעקב כי יש שבר במצרים ויאמר יעקב לבניו למה תתראו
(6633, 39, 5);[40, 40, 300, 10, 8];ממשיח;1763;(1, 5, 29, 3, 1763);שמו;2;(1, 5, 29, 9, 6633);ויקרא את שמו נח לאמר זה ינחמנו ממעשנו ומעצבון ידינו מן האדמה אשר אררה יהוה
(52547, 52, 5);[40, 40, 300, 10, 8];ממשיח;14004;(1, 36, 7, 13, 14004);מפני;1;(1, 36, 7, 45, 52547);כי היה רכושם רב משבת יחדו ולא יכלה ארץ מגוריהם לשאת אתם מפני מקניהם
(47945, 72, 5);[40, 40, 300, 10, 8];ממשיח;12771;(1, 32, 29, 8, 12771);אם;2;(1, 32, 29, 25, 47945);ויאמר לא יעקב יאמר עוד שמך כי אם ישראל כי שרית עם אלהים ועם אנשים ותוכל
(29448, 94, 5);[40, 40, 300, 10, 8];ממשיח;7866;(1, 24, 3, 4, 7866);השמים;3;(1, 24, 3, 19, 29448);ואשביעך ביהוה אלהי השמים ואלהי הארץ אשר לא תקח אשה לבני מבנות הכנעני אשר אנכי יושב בקרבו
(37993, 99, 6);[40, 10, 40, 300, 10, 8];מי משיח;10096;(1, 27, 36, 16, 10096);ויאמר;4;(1, 27, 36, 61, 37993);ויאמר הכי קרא שמו יעקב ויעקבני זה פעמים את בכרתי לקח והנה עתה לקח ברכתי ויאמר הלא אצלת לי ברכה
(21133, 5, 5);[5, 40, 300, 10, 8];המשיח;5648;(1, 18, 14, 2, 5648);מיהוה;5;(1, 18, 14, 10, 21133);היפלא מיהוה דבר למועד אשוב אליך כעת חיה ולשרה בן
(61345, 5, 5);[5, 40, 300, 10, 8];המשיח;16282;(1, 41, 26, 8, 16282);השבלים;1;(1, 41, 26, 25, 61345);שבע פרת הטבת שבע שנים הנה ושבע השבלים הטבת שבע שנים הנה חלום אחד הוא
(3237, 20, 5);[5, 40, 300, 10, 8];המשיח;850;(1, 3, 7, 1, 850);ותפקחנה;7;(1, 3, 7, 7, 3237);ותפקחנה עיני שניהם וידעו כי עירמם הם ויתפרו עלה תאנה ויעשו להם חגרת
(18792, 30, 5);[5, 40, 300, 10, 8];המשיח;5036;(1, 16, 10, 4, 5036);יהוה;2;(1, 16, 10, 13, 18792);ויאמר לה מלאך יהוה הרבה ארבה את זרעך ולא יספר מרב
(65941, 33, 5);[5, 40, 300, 10, 8];המשיח;17486;(1, 43, 16, 13, 17486);הביתה;5;(1, 43, 16, 50, 65941);וירא יוסף אתם את בנימין ויאמר לאשר על ביתו הבא את האנשים הביתה וטבח טבח והכן כי אתי יאכלו האנשים בצהרים
(58832, 51, 5);[5, 40, 300, 10, 8];המשיח;15641;(1, 40, 1, 1, 15641);ויהי;3;(1, 40, 1, 3, 58832);ויהי אחר הדברים האלה חטאו משקה מלך מצרים והאפה לאדניהם למלך מצרים
(45290, 61, 5);[5, 40, 300, 10, 8];המשיח;12075;(1, 31, 33, 16, 12075);באהל;3;(1, 31, 33, 60, 45290);ויבא לבן באהל יעקב ובאהל לאה ובאהל שתי האמהת ולא מצא ויצא מאהל לאה ויבא באהל רחל
(3217, 20, 6);[40, 5, 40, 300, 10, 8];מהמשיח;846;(1, 3, 6, 18, 846);גם;2;(1, 3, 6, 71, 3217);ותרא האשה כי טוב העץ למאכל וכי תאוה הוא לעינים ונחמד העץ להשכיל ותקח מפריו ותאכל ותתן גם לאישה עמה ויאכל
(65908, 33, 6);[40, 5, 40, 300, 10, 8];מהמשיח;17478;(1, 43, 16, 5, 17478);בנימין;4;(1, 43, 16, 17, 65908);וירא יוסף אתם את בנימין ויאמר לאשר על ביתו הבא את האנשים הביתה וטבח טבח והכן כי אתי יאכלו האנשים בצהרים
(7819, 13, 5);[40, 300, 10, 8, 10];משיחי;2091;(1, 6, 20, 7, 2091);רמש;2;(1, 6, 20, 29, 7819);מהעוף למינהו ומן הבהמה למינה מכל רמש האדמה למינהו שנים מכל יבאו אליך להחיות
(11470, 45, 5);[40, 300, 10, 8, 10];משיחי;3086;(1, 9, 27, 2, 3086);אלהים;5;(1, 9, 27, 8, 11470);יפת אלהים ליפת וישכן באהלי שם ויהי כנען עבד למו
(60429, 51, 5);[40, 300, 10, 8, 10];משיחי;16047;(1, 41, 8, 10, 16047);מצרים;5;(1, 41, 8, 41, 60429);ויהי בבקר ותפעם רוחו וישלח ויקרא את כל חרטמי מצרים ואת כל חכמיה ויספר פרעה להם את חלמו ואין פותר אותם לפרעה
