(300440, -59, 5);[8, 10, 300, 40, 5];המשיח;78833;(5, 31, 29, 17, 78833);באחרית;3;(5, 31, 29, 66, 300440);כי ידעתי אחרי מותי כי השחת תשחתון וסרתם מן הדרך אשר צויתי אתכם וקראת אתכם הרעה באחרית הימים כי תעשו את הרע בעיני יהוה להכעיסו במעשה ידיכם
(116100, -54, 5);[8, 10, 300, 40, 5];המשיח;30684;(2, 26, 16, 10, 30684);האחד;3;(2, 26, 16, 36, 116100);עשר אמות ארך הקרש ואמה וחצי האמה רחב הקרש האחד
(59036, -51, 5);[8, 10, 300, 40, 5];המשיח;15693;(1, 40, 5, 5, 15693);חלמו;1;(1, 40, 5, 19, 59036);ויחלמו חלום שניהם איש חלמו בלילה אחד איש כפתרון חלמו המשקה והאפה אשר למלך מצרים אשר אסורים בבית הסהר
(134466, -42, 5);[8, 10, 300, 40, 5];המשיח;35467;(2, 36, 33, 5, 35467);לברח;4;(2, 36, 33, 20, 134466);ויעש את הבריח התיכן לברח בתוך הקרשים מן הקצה אל הקצה
(177898, -42, 5);[8, 10, 300, 40, 5];המשיח;47090;(3, 23, 34, 9, 47090);לחדש;2;(3, 23, 34, 30, 177898);דבר אל בני ישראל לאמר בחמשה עשר יום לחדש השביעי הזה חג הסכות שבעת ימים ליהוה
(78718, -41, 5);[8, 10, 300, 40, 5];המשיח;20779;(2, 1, 16, 16, 20779);וחיה;2;(2, 1, 16, 59, 78718);ויאמר בילדכן את העבריות וראיתן על האבנים אם בן הוא והמתן אתו ואם בת היא וחיה
(244624, -38, 5);[8, 10, 300, 40, 5];המשיח;64336;(4, 33, 9, 12, 64336);ויחנו;3;(4, 33, 9, 54, 244624);ויסעו ממרה ויבאו אילמה ובאילם שתים עשרה עינת מים ושבעים תמרים ויחנו שם
(66073, -33, 5);[8, 10, 300, 40, 5];המשיח;17518;(1, 43, 18, 13, 17518);בתחלה;3;(1, 43, 18, 56, 66073);וייראו האנשים כי הובאו בית יוסף ויאמרו על דבר הכסף השב באמתחתינו בתחלה אנחנו מובאים להתגלל עלינו ולהתנפל עלינו ולקחת אתנו לעבדים ואת חמרינו
(18912, -30, 5);[8, 10, 300, 40, 5];המשיח;5072;(1, 16, 12, 13, 5072);אחיו;2;(1, 16, 12, 37, 18912);והוא יהיה פרא אדם ידו בכל ויד כל בו ועל פני כל אחיו ישכן
(101029, -28, 5);[8, 10, 300, 40, 5];המשיח;26640;(2, 15, 26, 15, 26640);חקיו;1;(2, 15, 26, 64, 101029);ויאמר אם שמוע תשמע לקול יהוה אלהיך והישר בעיניו תעשה והאזנת למצותיו ושמרת כל חקיו כל המחלה אשר שמתי במצרים לא אשים עליך כי אני יהוה רפאך
(213769, -27, 5);[8, 10, 300, 40, 5];המשיח;56350;(4, 15, 10, 8, 56350);ניחח;4;(4, 15, 10, 30, 213769);ויין תקריב לנסך חצי ההין אשה ריח ניחח ליהוה
(3317, -20, 5);[8, 10, 300, 40, 5];המשיח;870;(1, 3, 8, 8, 870);לרוח;4;(1, 3, 8, 32, 3317);וישמעו את קול יהוה אלהים מתהלך בגן לרוח היום ויתחבא האדם ואשתו מפני יהוה אלהים בתוך עץ הגן
(252076, -14, 5);[8, 10, 300, 40, 5];המשיח;66228;(5, 1, 38, 10, 66228);חזק;1;(5, 1, 38, 32, 252076);יהושע בן נון העמד לפניך הוא יבא שמה אתו חזק כי הוא ינחלנה את ישראל
(98079, -13, 5);[8, 10, 300, 40, 5];המשיח;25881;(2, 14, 2, 6, 25881);ויחנו;3;(2, 14, 2, 21, 98079);דבר אל בני ישראל וישבו ויחנו לפני פי החירת בין מגדל ובין הים לפני בעל צפן נכחו תחנו על הים
(197701, -13, 5);[8, 10, 300, 40, 5];המשיח;52130;(4, 6, 14, 18, 52130);אחד;2;(4, 6, 14, 68, 197701);והקריב את קרבנו ליהוה כבש בן שנתו תמים אחד לעלה וכבשה אחת בת שנתה תמימה לחטאת ואיל אחד תמים לשלמים
(167860, -8, 5);[8, 10, 300, 40, 5];המשיח;44382;(3, 16, 32, 11, 44382);תחת;2;(3, 16, 32, 37, 167860);וכפר הכהן אשר ימשח אתו ואשר ימלא את ידו לכהן תחת אביו ולבש את בגדי הבד בגדי הקדש
(21153, -5, 5);[8, 10, 300, 40, 5];המשיח;5654;(1, 18, 14, 8, 5654);חיה;1;(1, 18, 14, 30, 21153);היפלא מיהוה דבר למועד אשוב אליך כעת חיה ולשרה בן
(61365, -5, 5);[8, 10, 300, 40, 5];המשיח;16287;(1, 41, 26, 13, 16287);חלום;1;(1, 41, 26, 45, 61365);שבע פרת הטבת שבע שנים הנה ושבע השבלים הטבת שבע שנים הנה חלום אחד הוא
(144381, -1, 5);[8, 10, 300, 40, 5];המשיח;38052;(3, 4, 3, 3, 38052);המשיח;5;(3, 4, 3, 11, 144381);אם הכהן המשיח יחטא לאשמת העם והקריב על חטאתו אשר חטא פר בן בקר תמים ליהוה לחטאת
(144510, -1, 5);[8, 10, 300, 40, 5];המשיח;38089;(3, 4, 5, 3, 38089);המשיח;5;(3, 4, 5, 13, 144510);ולקח הכהן המשיח מדם הפר והביא אתו אל אהל מועד
(145161, -1, 5);[8, 10, 300, 40, 5];המשיח;38270;(3, 4, 16, 3, 38270);המשיח;5;(3, 4, 16, 14, 145161);והביא הכהן המשיח מדם הפר אל אהל מועד
(148600, -1, 5);[8, 10, 300, 40, 5];המשיח;39199;(3, 6, 15, 2, 39199);המשיח;5;(3, 6, 15, 10, 148600);והכהן המשיח תחתיו מבניו יעשה אתה חק עולם ליהוה כליל תקטר
(66073, -33, 6);[8, 10, 300, 40, 5, 40];מהמשיח;17518;(1, 43, 18, 13, 17518);בתחלה;3;(1, 43, 18, 56, 66073);וייראו האנשים כי הובאו בית יוסף ויאמרו על דבר הכסף השב באמתחתינו בתחלה אנחנו מובאים להתגלל עלינו ולהתנפל עלינו ולקחת אתנו לעבדים ואת חמרינו
(101029, -28, 6);[8, 10, 300, 40, 5, 40];מהמשיח;26640;(2, 15, 26, 15, 26640);חקיו;1;(2, 15, 26, 64, 101029);ויאמר אם שמוע תשמע לקול יהוה אלהיך והישר בעיניו תעשה והאזנת למצותיו ושמרת כל חקיו כל המחלה אשר שמתי במצרים לא אשים עליך כי אני יהוה רפאך
(3317, -20, 6);[8, 10, 300, 40, 5, 40];מהמשיח;870;(1, 3, 8, 8, 870);לרוח;4;(1, 3, 8, 32, 3317);וישמעו את קול יהוה אלהים מתהלך בגן לרוח היום ויתחבא האדם ואשתו מפני יהוה אלהים בתוך עץ הגן
(177982, -42, 7);[10, 40, 8, 10, 300, 40, 5];המשיח מי;47111;(3, 23, 36, 5, 47111);ליהוה;2;(3, 23, 36, 19, 177982);שבעת ימים תקריבו אשה ליהוה ביום השמיני מקרא קדש יהיה לכם והקרבתם אשה ליהוה עצרת הוא כל מלאכת עבדה לא תעשו
(15061, -100, 5);[10, 8, 10, 300, 40];משיחי;4032;(1, 12, 18, 12, 4032);לי;2;(1, 12, 18, 41, 15061);ויקרא פרעה לאברם ויאמר מה זאת עשית לי למה לא הגדת לי כי אשתך הוא
(27218, -98, 5);[10, 8, 10, 300, 40];משיחי;7265;(1, 22, 4, 6, 7265);עיניו;2;(1, 22, 4, 23, 27218);ביום השלישי וישא אברהם את עיניו וירא את המקום מרחק
(99232, -94, 5);[10, 8, 10, 300, 40];משיחי;26177;(2, 14, 21, 7, 26177);ויולך;2;(2, 14, 21, 18, 99232);ויט משה את ידו על הים ויולך יהוה את הים ברוח קדים עזה כל הלילה וישם את הים לחרבה ויבקעו המים
(5864, -92, 5);[10, 8, 10, 300, 40];משיחי;1569;(1, 5, 11, 3, 1569);ימי;1;(1, 5, 11, 8, 5864);ויהיו כל ימי אנוש חמש שנים ותשע מאות שנה וימת
(245598, -92, 5);[10, 8, 10, 300, 40];משיחי;64556;(4, 33, 47, 1, 64556);ויסעו;2;(4, 33, 47, 2, 245598);ויסעו מעלמן דבלתימה ויחנו בהרי העברים לפני נבו
(1082, -89, 5);[10, 8, 10, 300, 40];משיחי;275;(1, 1, 22, 9, 275);המים;3;(1, 1, 22, 34, 1082);ויברך אתם אלהים לאמר פרו ורבו ומלאו את המים בימים והעוף ירב בארץ
(180877, -88, 5);[10, 8, 10, 300, 40];משיחי;47856;(3, 25, 27, 5, 47856);והשיב;4;(3, 25, 27, 18, 180877);וחשב את שני ממכרו והשיב את העדף לאיש אשר מכר לו ושב לאחזתו
(65869, -81, 5);[10, 8, 10, 300, 40];משיחי;17469;(1, 43, 15, 13, 17469);וירדו;2;(1, 43, 15, 53, 65869);ויקחו האנשים את המנחה הזאת ומשנה כסף לקחו בידם ואת בנימן ויקמו וירדו מצרים ויעמדו לפני יוסף
(97089, -81, 5);[10, 8, 10, 300, 40];משיחי;25622;(2, 13, 6, 5, 25622);וביום;3;(2, 13, 6, 18, 97089);שבעת ימים תאכל מצת וביום השביעי חג ליהוה
(230439, -81, 5);[10, 8, 10, 300, 40];משיחי;60800;(4, 25, 6, 6, 60800);ויקרב;2;(4, 25, 6, 20, 230439);והנה איש מבני ישראל בא ויקרב אל אחיו את המדינית לעיני משה ולעיני כל עדת בני ישראל והמה בכים פתח אהל מועד
(281839, -78, 5);[10, 8, 10, 300, 40];משיחי;73960;(5, 20, 6, 12, 73960);ימות;1;(5, 20, 6, 38, 281839);ומי האיש אשר נטע כרם ולא חללו ילך וישב לביתו פן ימות במלחמה ואיש אחר יחללנו
(100122, -75, 5);[10, 8, 10, 300, 40];משיחי;26402;(2, 15, 6, 5, 26402);ימינך;3;(2, 15, 6, 20, 100122);ימינך יהוה נאדרי בכח ימינך יהוה תרעץ אויב
(232255, -74, 5);[10, 8, 10, 300, 40];משיחי;61236;(4, 26, 27, 5, 61236);ששים;3;(4, 26, 27, 25, 232255);אלה משפחת הזבולני לפקדיהם ששים אלף וחמש מאות
(201466, -59, 5);[10, 8, 10, 300, 40];משיחי;53116;(4, 7, 72, 4, 53116);יום;1;(4, 7, 72, 12, 201466);ביום עשתי עשר יום נשיא לבני אשר פגעיאל בן עכרן
(126745, -56, 5);[10, 8, 10, 300, 40];משיחי;33419;(2, 32, 18, 1, 33419);ויאמר;2;(2, 32, 18, 2, 126745);ויאמר אין קול ענות גבורה ואין קול ענות חלושה קול ענות אנכי שמע
(9476, -55, 5);[10, 8, 10, 300, 40];משיחי;2540;(1, 8, 8, 1, 2540);וישלח;2;(1, 8, 8, 2, 9476);וישלח את היונה מאתו לראות הקלו המים מעל פני האדמה
(54541, -54, 5);[10, 8, 10, 300, 40];משיחי;14521;(1, 37, 9, 10, 14521);חלמתי;5;(1, 37, 9, 41, 54541);ויחלם עוד חלום אחר ויספר אתו לאחיו ויאמר הנה חלמתי חלום עוד והנה השמש והירח ואחד עשר כוכבים משתחוים לי
(60633, -51, 5);[10, 8, 10, 300, 40];משיחי;16101;(1, 41, 12, 7, 16101);הטבחים;5;(1, 41, 12, 25, 60633);ושם אתנו נער עברי עבד לשר הטבחים ונספר לו ויפתר לנו את חלמתינו איש כחלמו פתר
(112686, -51, 5);[10, 8, 10, 300, 40];משיחי;29831;(2, 24, 4, 7, 29831);וישכם;2;(2, 24, 4, 22, 112686);ויכתב משה את כל דברי יהוה וישכם בבקר ויבן מזבח תחת ההר ושתים עשרה מצבה לשנים עשר שבטי ישראל
(242914, -50, 5);[10, 8, 10, 300, 40];משיחי;63904;(4, 32, 17, 15, 63904);בערי;4;(4, 32, 17, 58, 242914);ואנחנו נחלץ חשים לפני בני ישראל עד אשר אם הביאנם אל מקומם וישב טפנו בערי המבצר מפני ישבי הארץ
(133322, -48, 5);[10, 8, 10, 300, 40];משיחי;35190;(2, 36, 10, 4, 35190);היריעת;4;(2, 36, 10, 14, 133322);ויחבר את חמש היריעת אחת אל אחת וחמש יריעת חבר אחת אל אחת
(250753, -47, 5);[10, 8, 10, 300, 40];משיחי;65892;(5, 1, 15, 16, 65892);ושרי;4;(5, 1, 15, 69, 250753);ואקח את ראשי שבטיכם אנשים חכמים וידעים ואתן אתם ראשים עליכם שרי אלפים ושרי מאות ושרי חמשים ושרי עשרת ושטרים לשבטיכם
(11650, -45, 5);[10, 8, 10, 300, 40];משיחי;3135;(1, 10, 3, 1, 3135);ובני;4;(1, 10, 3, 4, 11650);ובני גמר אשכנז וריפת ותגרמה
(105565, -40, 5);[10, 8, 10, 300, 40];משיחי;27862;(2, 18, 26, 9, 27862);יביאון;3;(2, 18, 26, 28, 105565);ושפטו את העם בכל עת את הדבר הקשה יביאון אל משה וכל הדבר הקטן ישפוטו הם
(101057, -28, 5);[10, 8, 10, 300, 40];משיחי;26647;(2, 15, 26, 22, 26647);אשים;3;(2, 15, 26, 92, 101057);ויאמר אם שמוע תשמע לקול יהוה אלהיך והישר בעיניו תעשה והאזנת למצותיו ושמרת כל חקיו כל המחלה אשר שמתי במצרים לא אשים עליך כי אני יהוה רפאך
(197108, -26, 5);[10, 8, 10, 300, 40];משיחי;51968;(4, 6, 3, 14, 51968);ישתה;1;(4, 6, 3, 46, 197108);מיין ושכר יזיר חמץ יין וחמץ שכר לא ישתה וכל משרת ענבים לא ישתה וענבים לחים ויבשים לא יאכל
(82959, -18, 5);[10, 8, 10, 300, 40];משיחי;21887;(2, 4, 20, 7, 21887);וירכבם;2;(2, 4, 20, 22, 82959);ויקח משה את אשתו ואת בניו וירכבם על החמר וישב ארצה מצרים ויקח משה את מטה האלהים בידו
(177926, -16, 5);[10, 8, 10, 300, 40];משיחי;47097;(3, 23, 34, 16, 47097);ליהוה;2;(3, 23, 34, 58, 177926);דבר אל בני ישראל לאמר בחמשה עשר יום לחדש השביעי הזה חג הסכות שבעת ימים ליהוה
(194391, -15, 5);[10, 8, 10, 300, 40];משיחי;51255;(4, 4, 32, 5, 51255);ויתדתם;2;(4, 4, 32, 23, 194391);ועמודי החצר סביב ואדניהם ויתדתם ומיתריהם לכל כליהם ולכל עבדתם ובשמת תפקדו את כלי משמרת משאם
(149571, -14, 5);[10, 8, 10, 300, 40];משיחי;39456;(3, 7, 14, 1, 39456);והקריב;5;(3, 7, 14, 5, 149571);והקריב ממנו אחד מכל קרבן תרומה ליהוה לכהן הזרק את דם השלמים לו יהיה
(7871, -13, 5);[10, 8, 10, 300, 40];משיחי;2105;(1, 6, 21, 7, 2105);יאכל;1;(1, 6, 21, 19, 7871);ואתה קח לך מכל מאכל אשר יאכל ואספת אליך והיה לך ולהם לאכלה
(112752, -10, 5);[10, 8, 10, 300, 40];משיחי;29848;(2, 24, 5, 5, 29848);ישראל;1;(2, 24, 5, 15, 112752);וישלח את נערי בני ישראל ויעלו עלת ויזבחו זבחים שלמים ליהוה פרים
(161804, -10, 5);[10, 8, 10, 300, 40];משיחי;42747;(3, 14, 10, 11, 42747);תמימה;3;(3, 14, 10, 45, 161804);וביום השמיני יקח שני כבשים תמימים וכבשה אחת בת שנתה תמימה ושלשה עשרנים סלת מנחה בלולה בשמן ולג אחד שמן
(232803, -9, 5);[10, 8, 10, 300, 40];משיחי;61356;(4, 26, 40, 1, 61356);ויהיו;2;(4, 26, 40, 2, 232803);ויהיו בני בלע ארד ונעמן משפחת הארדי לנעמן משפחת הנעמי
(256665, -8, 5);[10, 8, 10, 300, 40];משיחי;67430;(5, 4, 6, 6, 67430);ובינתכם;3;(5, 4, 6, 26, 256665);ושמרתם ועשיתם כי הוא חכמתכם ובינתכם לעיני העמים אשר ישמעון את כל החקים האלה ואמרו רק עם חכם ונבון הגוי הגדול הזה
(102795, -2, 5);[10, 8, 10, 300, 40];משיחי;27110;(2, 16, 29, 15, 27110);יומים;1;(2, 16, 29, 44, 102795);ראו כי יהוה נתן לכם השבת על כן הוא נתן לכם ביום הששי לחם יומים שבו איש תחתיו אל יצא איש ממקמו ביום השביעי
(270845, -2, 5);[10, 8, 10, 300, 40];משיחי;71049;(5, 12, 5, 7, 71049);יהוה;1;(5, 12, 5, 19, 270845);כי אם אל המקום אשר יבחר יהוה אלהיכם מכל שבטיכם לשום את שמו שם לשכנו תדרשו ובאת שמה
(271213, -2, 5);[10, 8, 10, 300, 40];משיחי;71137;(5, 12, 11, 5, 71137);יהוה;1;(5, 12, 11, 17, 271213);והיה המקום אשר יבחר יהוה אלהיכם בו לשכן שמו שם שמה תביאו את כל אשר אנכי מצוה אתכם עולתיכם וזבחיכם מעשרתיכם ותרמת ידכם וכל מבחר נדריכם אשר תדרו ליהוה
(271449, -2, 5);[10, 8, 10, 300, 40];משיחי;71194;(5, 12, 14, 6, 71194);יהוה;1;(5, 12, 14, 17, 271449);כי אם במקום אשר יבחר יהוה באחד שבטיך שם תעלה עלתיך ושם תעשה כל אשר אנכי מצוך
(271715, -2, 5);[10, 8, 10, 300, 40];משיחי;71261;(5, 12, 18, 10, 71261);יהוה;1;(5, 12, 18, 36, 271715);כי אם לפני יהוה אלהיך תאכלנו במקום אשר יבחר יהוה אלהיך בו אתה ובנך ובתך ועבדך ואמתך והלוי אשר בשעריך ושמחת לפני יהוה אלהיך בכל משלח ידך
(271919, -2, 5);[10, 8, 10, 300, 40];משיחי;71317;(5, 12, 21, 7, 71317);יהוה;1;(5, 12, 21, 22, 271919);כי ירחק ממך המקום אשר יבחר יהוה אלהיך לשום שמו שם וזבחת מבקרך ומצאנך אשר נתן יהוה לך כאשר צויתך ואכלת בשעריך בכל אות נפשך
(272206, -2, 5);[10, 8, 10, 300, 40];משיחי;71393;(5, 12, 26, 13, 71393);יהוה;1;(5, 12, 26, 44, 272206);רק קדשיך אשר יהיו לך ונדריך תשא ובאת אל המקום אשר יבחר יהוה
(274855, -2, 5);[10, 8, 10, 300, 40];משיחי;72083;(5, 14, 24, 15, 72083);יהוה;1;(5, 14, 24, 48, 274855);וכי ירבה ממך הדרך כי לא תוכל שאתו כי ירחק ממך המקום אשר יבחר יהוה אלהיך לשום שמו שם כי יברכך יהוה אלהיך
(274929, -2, 5);[10, 8, 10, 300, 40];משיחי;72102;(5, 14, 25, 11, 72102);יהוה;1;(5, 14, 25, 41, 274929);ונתתה בכסף וצרת הכסף בידך והלכת אל המקום אשר יבחר יהוה אלהיך בו
(276389, -2, 5);[10, 8, 10, 300, 40];משיחי;72495;(5, 15, 20, 10, 72495);יהוה;1;(5, 15, 20, 39, 276389);לפני יהוה אלהיך תאכלנו שנה בשנה במקום אשר יבחר יהוה אתה וביתך
(276615, -2, 5);[10, 8, 10, 300, 40];משיחי;72553;(5, 16, 2, 10, 72553);יהוה;1;(5, 16, 2, 38, 276615);וזבחת פסח ליהוה אלהיך צאן ובקר במקום אשר יבחר יהוה לשכן שמו שם
(276848, -2, 5);[10, 8, 10, 300, 40];משיחי;72619;(5, 16, 6, 7, 72619);יהוה;1;(5, 16, 6, 19, 276848);כי אם אל המקום אשר יבחר יהוה אלהיך לשכן שמו שם תזבח את הפסח בערב כבוא השמש מועד צאתך ממצרים
(276924, -2, 5);[10, 8, 10, 300, 40];משיחי;72638;(5, 16, 7, 6, 72638);יהוה;1;(5, 16, 7, 23, 276924);ובשלת ואכלת במקום אשר יבחר יהוה אלהיך בו ופנית בבקר והלכת לאהליך
(277194, -2, 5);[10, 8, 10, 300, 40];משיחי;72702;(5, 16, 11, 21, 72702);יהוה;1;(5, 16, 11, 91, 277194);ושמחת לפני יהוה אלהיך אתה ובנך ובתך ועבדך ואמתך והלוי אשר בשעריך והגר והיתום והאלמנה אשר בקרבך במקום אשר יבחר יהוה אלהיך לשכן שמו שם
(277383, -2, 5);[10, 8, 10, 300, 40];משיחי;72747;(5, 16, 15, 9, 72747);יהוה;1;(5, 16, 15, 34, 277383);שבעת ימים תחג ליהוה אלהיך במקום אשר יבחר יהוה כי יברכך יהוה אלהיך בכל תבואתך ובכל מעשה ידיך והיית אך שמח
(278323, -2, 5);[10, 8, 10, 300, 40];משיחי;73006;(5, 17, 8, 24, 73006);יהוה;1;(5, 17, 8, 84, 278323);כי יפלא ממך דבר למשפט בין דם לדם בין דין לדין ובין נגע לנגע דברי ריבת בשעריך וקמת ועלית אל המקום אשר יבחר יהוה אלהיך בו
(279474, -2, 5);[10, 8, 10, 300, 40];משיחי;73318;(5, 18, 6, 20, 73318);יהוה;1;(5, 18, 6, 65, 279474);וכי יבא הלוי מאחד שעריך מכל ישראל אשר הוא גר שם ובא בכל אות נפשו אל המקום אשר יבחר יהוה
(289141, -2, 5);[10, 8, 10, 300, 40];משיחי;75933;(5, 26, 2, 21, 75933);יהוה;1;(5, 26, 2, 78, 289141);ולקחת מראשית כל פרי האדמה אשר תביא מארצך אשר יהוה אלהיך נתן לך ושמת בטנא והלכת אל המקום אשר יבחר יהוה אלהיך לשכן שמו שם
(302234, -2, 5);[10, 8, 10, 300, 40];משיחי;79294;(5, 32, 42, 2, 79294);חצי;3;(5, 32, 42, 8, 302234);אשכיר חצי מדם וחרבי תאכל בשר מדם חלל ושביה מראש פרעות אויב
(144382, -1, 5);[10, 8, 10, 300, 40];משיחי;38053;(3, 4, 3, 4, 38053);יחטא;1;(3, 4, 3, 12, 144382);אם הכהן המשיח יחטא לאשמת העם והקריב על חטאתו אשר חטא פר בן בקר תמים ליהוה לחטאת
(1082, -89, 6);[10, 8, 10, 300, 40, 30];למשיחי;275;(1, 1, 22, 9, 275);המים;3;(1, 1, 22, 34, 1082);ויברך אתם אלהים לאמר פרו ורבו ומלאו את המים בימים והעוף ירב בארץ
(54541, -54, 6);[10, 8, 10, 300, 40, 30];למשיחי;14521;(1, 37, 9, 10, 14521);חלמתי;5;(1, 37, 9, 41, 54541);ויחלם עוד חלום אחר ויספר אתו לאחיו ויאמר הנה חלמתי חלום עוד והנה השמש והירח ואחד עשר כוכבים משתחוים לי
(11650, -45, 6);[10, 8, 10, 300, 40, 30];למשיחי;3135;(1, 10, 3, 1, 3135);ובני;4;(1, 10, 3, 4, 11650);ובני גמר אשכנז וריפת ותגרמה
(133322, -48, 6);[10, 8, 10, 300, 40, 40];ממשיחי;35190;(2, 36, 10, 4, 35190);היריעת;4;(2, 36, 10, 14, 133322);ויחבר את חמש היריעת אחת אל אחת וחמש יריעת חבר אחת אל אחת
(250753, -47, 6);[10, 8, 10, 300, 40, 40];ממשיחי;65892;(5, 1, 15, 16, 65892);ושרי;4;(5, 1, 15, 69, 250753);ואקח את ראשי שבטיכם אנשים חכמים וידעים ואתן אתם ראשים עליכם שרי אלפים ושרי מאות ושרי חמשים ושרי עשרת ושטרים לשבטיכם
(102795, -2, 7);[10, 8, 10, 300, 40, 10, 40];מי משיחי;27110;(2, 16, 29, 15, 27110);יומים;1;(2, 16, 29, 44, 102795);ראו כי יהוה נתן לכם השבת על כן הוא נתן לכם ביום הששי לחם יומים שבו איש תחתיו אל יצא איש ממקמו ביום השביעי
(108439, -98, 5);[20, 8, 10, 300, 40];משיחך;28649;(2, 21, 7, 9, 28649);כצאת;1;(2, 21, 7, 25, 108439);וכי ימכר איש את בתו לאמה לא תצא כצאת העבדים
(232301, -95, 5);[20, 8, 10, 300, 40];משיחך;61247;(4, 26, 29, 3, 61247);למכיר;3;(4, 26, 29, 10, 232301);בני מנשה למכיר משפחת המכירי ומכיר הוליד את גלעד לגלעד משפחת הגלעדי
(237666, -94, 5);[20, 8, 10, 300, 40];משיחך;62559;(4, 29, 21, 2, 62559);ונסכיהם;4;(4, 29, 21, 10, 237666);ומנחתם ונסכיהם לפרים לאילם ולכבשים במספרם כמשפט
(253919, -91, 5);[20, 8, 10, 300, 40];משיחך;66706;(5, 2, 26, 7, 66706);מלך;3;(5, 2, 26, 31, 253919);ואשלח מלאכים ממדבר קדמות אל סיחון מלך חשבון דברי שלום לאמר
(264299, -74, 5);[20, 8, 10, 300, 40];משיחך;69377;(5, 8, 2, 8, 69377);אלהיך;5;(5, 8, 2, 30, 264299);וזכרת את כל הדרך אשר הליכך יהוה אלהיך זה ארבעים שנה במדבר למען ענתך לנסתך לדעת את אשר בלבבך התשמר מצותו אם לא
(137616, -66, 5);[20, 8, 10, 300, 40];משיחך;36258;(2, 38, 27, 15, 36258);הככר;2;(2, 38, 27, 54, 137616);ויהי מאת ככר הכסף לצקת את אדני הקדש ואת אדני הפרכת מאת אדנים למאת הככר ככר לאדן
(109559, -64, 5);[20, 8, 10, 300, 40];משיחך;28968;(2, 21, 35, 9, 28968);ומכרו;3;(2, 21, 35, 27, 109559);וכי יגף שור איש את שור רעהו ומת ומכרו את השור החי וחצו את כספו וגם את המת יחצון
(300499, -59, 5);[20, 8, 10, 300, 40];משיחך;78847;(5, 31, 30, 4, 78847);כל;1;(5, 31, 30, 14, 300499);וידבר משה באזני כל קהל ישראל את דברי השירה הזאת עד תמם
(203926, -58, 5);[20, 8, 10, 300, 40];משיחך;53759;(4, 9, 3, 13, 53759);וככל;3;(4, 9, 3, 52, 203926);בארבעה עשר יום בחדש הזה בין הערבים תעשו אתו במועדו ככל חקתיו וככל משפטיו תעשו אתו
(288009, -57, 5);[20, 8, 10, 300, 40];משיחך;75634;(5, 24, 22, 10, 75634);מצוך;4;(5, 24, 22, 35, 288009);וזכרת כי עבד היית בארץ מצרים על כן אנכי מצוך לעשות את הדבר הזה
(278010, -44, 5);[20, 8, 10, 300, 40];משיחך;72919;(5, 17, 4, 2, 72919);לך;2;(5, 17, 4, 6, 278010);והגד לך ושמעת ודרשת היטב והנה אמת נכון הדבר נעשתה התועבה הזאת בישראל
(167619, -40, 5);[20, 8, 10, 300, 40];משיחך;44321;(3, 16, 28, 3, 44321);יכבס;2;(3, 16, 28, 10, 167619);והשרף אתם יכבס בגדיו ורחץ את בשרו במים ואחרי כן יבוא אל המחנה
(50488, -23, 5);[20, 8, 10, 300, 40];משיחך;13455;(1, 34, 26, 4, 13455);שכם;2;(1, 34, 26, 12, 50488);ואת חמור ואת שכם בנו הרגו לפי חרב ויקחו את דינה מבית שכם ויצאו
(48567, -12, 5);[20, 8, 10, 300, 40];משיחך;12934;(1, 33, 8, 4, 12934);כל;1;(1, 33, 8, 10, 48567);ויאמר מי לך כל המחנה הזה אשר פגשתי ויאמר למצא חן בעיני אדני
