(1131955, -57, 4);[8, 10, 300, 40];משיח;289847;(38, 23, 19, 7, 289847);יחזיאל;2;(38, 23, 19, 28, 1131955);בני חברון יריהו הראש אמריה השני יחזיאל השלישי ויקמעם הרביעי
(1171175, -57, 4);[8, 10, 300, 40];משיח;299358;(39, 22, 2, 8, 299358);אחת;2;(39, 22, 2, 33, 1171175);בן ארבעים ושתים שנה אחזיהו במלכו ושנה אחת מלך בירושלם ושם אמו עתליהו בת עמרי
(126689, -56, 4);[8, 10, 300, 40];משיח;33404;(2, 32, 16, 9, 33404);חרות;1;(2, 32, 16, 36, 126689);והלחת מעשה אלהים המה והמכתב מכתב אלהים הוא חרות על הלחת
(192148, -56, 4);[8, 10, 300, 40];משיח;50666;(4, 3, 41, 1, 50666);ולקחת;4;(4, 3, 41, 4, 192148);ולקחת את הלוים לי אני יהוה תחת כל בכר בבני ישראל ואת בהמת הלוים תחת כל בכור בבהמת בני ישראל
(248770, -56, 4);[8, 10, 300, 40];משיח;65383;(4, 35, 28, 14, 65383);הרצח;4;(4, 35, 28, 51, 248770);כי בעיר מקלטו ישב עד מות הכהן הגדל ואחרי מות הכהן הגדל ישוב הרצח אל ארץ אחזתו
(301863, -56, 4);[8, 10, 300, 40];משיח;79196;(5, 32, 33, 1, 79196);חמת;1;(5, 32, 33, 1, 301863);חמת תנינם יינם וראש פתנים אכזר
(388630, -56, 4);[8, 10, 300, 40];משיח;101240;(8, 4, 3, 14, 101240);נקחה;3;(8, 4, 3, 58, 388630);ויבא העם אל המחנה ויאמרו זקני ישראל למה נגפנו יהוה היום לפני פלשתים נקחה אלינו משלה את ארון ברית יהוה ויבא בקרבנו וישענו מכף איבינו
(495431, -56, 4);[8, 10, 300, 40];משיח;128944;(10, 8, 37, 23, 128944);מחלה;2;(10, 8, 37, 75, 495431);רעב כי יהיה בארץ דבר כי יהיה שדפון ירקון ארבה חסיל כי יהיה כי יצר לו איבו בארץ שעריו כל נגע כל מחלה
(502732, -56, 4);[8, 10, 300, 40];משיח;130852;(10, 11, 29, 16, 130852);חדשה;1;(10, 11, 29, 69, 502732);ויהי בעת ההיא וירבעם יצא מירושלם וימצא אתו אחיה השילני הנביא בדרך והוא מתכסה בשלמה חדשה ושניהם לבדם בשדה
(540038, -56, 4);[8, 10, 300, 40];משיח;140524;(11, 7, 12, 22, 140524);להחבה;3;(11, 7, 12, 79, 540038);ויקם המלך לילה ויאמר אל עבדיו אגידה נא לכם את אשר עשו לנו ארם ידעו כי רעבים אנחנו ויצאו מן המחנה להחבה בהשדה לאמר כי יצאו מן העיר ונתפשם חיים ואל העיר נבא
(563465, -56, 4);[8, 10, 300, 40];משיח;146548;(11, 19, 13, 3, 146548);חמת;1;(11, 19, 13, 7, 563465);איו מלך חמת ומלך ארפד ומלך לעיר ספרוים הנע ועוה
(574520, -56, 4);[8, 10, 300, 40];משיח;149372;(11, 25, 16, 14, 149372);לנחשת;3;(11, 25, 16, 55, 574520);העמודים שנים הים האחד והמכנות אשר עשה שלמה לבית יהוה לא היה משקל לנחשת כל הכלים האלה
(593258, -56, 4);[8, 10, 300, 40];משיח;154103;(12, 19, 8, 7, 154103);חכה;1;(12, 19, 8, 29, 593258);ואנו הדיגים ואבלו כל משליכי ביאור חכה ופרשי מכמרת על פני מים אמללו
(649603, -56, 4);[8, 10, 300, 40];משיח;168406;(13, 5, 16, 3, 168406);פתוח;4;(13, 5, 16, 13, 649603);אשפתו כקבר פתוח כלם גבורים
(1027131, -56, 4);[8, 10, 300, 40];משיח;264484;(34, 3, 13, 24, 264484);לחדש;2;(34, 3, 13, 94, 1027131);ונשלוח ספרים ביד הרצים אל כל מדינות המלך להשמיד להרג ולאבד את כל היהודים מנער ועד זקן טף ונשים ביום אחד בשלושה עשר לחדש שנים עשר הוא חדש אדר ושללם לבוז
(1089996, -56, 4);[8, 10, 300, 40];משיח;279733;(37, 9, 35, 9, 279733);הרחבה;3;(37, 9, 35, 36, 1089996);והם במלכותם ובטובך הרב אשר נתת להם ובארץ הרחבה והשמנה אשר נתת לפניהם לא עבדוך ולא שבו ממעלליהם הרעים
(1134831, -56, 4);[8, 10, 300, 40];משיח;290496;(38, 25, 22, 5, 290496);ואחיו;3;(38, 25, 22, 21, 1134831);לחמשה עשר לירמות בניו ואחיו שנים עשר
(1144449, -56, 4);[8, 10, 300, 40];משיח;292764;(39, 2, 16, 9, 292764);אחרי;2;(39, 2, 16, 37, 1144449);ויספר שלמה כל האנשים הגירים אשר בארץ ישראל אחרי הספר אשר ספרם דויד אביו וימצאו מאה וחמשים אלף ושלשת אלפים ושש מאות
(1177746, -56, 4);[8, 10, 300, 40];משיח;300968;(39, 26, 5, 13, 300968);הצליחו;5;(39, 26, 5, 58, 1177746);ויהי לדרש אלהים בימי זכריהו המבין בראת האלהים ובימי דרשו את יהוה הצליחו האלהים
(1189649, -56, 4);[8, 10, 300, 40];משיח;303748;(39, 33, 4, 2, 303748);מזבחות;4;(39, 33, 4, 8, 1189649);ובנה מזבחות בבית יהוה אשר אמר יהוה בירושלם יהיה שמי לעולם
(9421, -55, 4);[8, 10, 300, 40];משיח;2525;(1, 8, 6, 8, 2525);חלון;1;(1, 8, 6, 26, 9421);ויהי מקץ ארבעים יום ויפתח נח את חלון התבה אשר עשה
(134584, -55, 4);[8, 10, 300, 40];משיח;35498;(2, 36, 35, 11, 35498);חשב;1;(2, 36, 35, 42, 134584);ויעש את הפרכת תכלת וארגמן ותולעת שני ושש משזר מעשה חשב עשה אתה כרבים
(399958, -55, 4);[8, 10, 300, 40];משיח;104070;(8, 12, 9, 1, 104070);וישכחו;5;(8, 12, 9, 5, 399958);וישכחו את יהוה אלהיהם וימכר אתם ביד סיסרא שר צבא חצור וביד פלשתים וביד מלך מואב וילחמו בם
(628076, -55, 4);[8, 10, 300, 40];משיח;162960;(12, 51, 13, 8, 162960);ותפחד;4;(12, 51, 13, 31, 628076);ותשכח יהוה עשך נוטה שמים ויסד ארץ ותפחד תמיד כל היום מפני חמת המציק כאשר כונן להשחית ואיה חמת המציק
(701495, -55, 4);[8, 10, 300, 40];משיח;181769;(13, 38, 6, 12, 181769);בחצר;2;(13, 38, 6, 45, 701495);ויקחו את ירמיהו וישלכו אתו אל הבור מלכיהו בן המלך אשר בחצר המטרה וישלחו את ירמיהו בחבלים ובבור אין מים כי אם טיט ויטבע ירמיהו בטיט
(729982, -55, 4);[8, 10, 300, 40];משיח;189063;(14, 3, 8, 10, 189063);חזק;1;(14, 3, 8, 35, 729982);הנה נתתי את פניך חזקים לעמת פניהם ואת מצחך חזק לעמת מצחם
(779849, -55, 4);[8, 10, 300, 40];משיח;201653;(14, 36, 20, 7, 201653);ויחללו;3;(14, 36, 20, 23, 779849);ויבוא אל הגוים אשר באו שם ויחללו את שם קדשי באמר להם עם יהוה אלה ומארצו יצאו
(890198, -55, 4);[8, 10, 300, 40];משיח;229422;(27, 64, 7, 4, 229422);חפש;1;(27, 64, 7, 14, 890198);יחפשו עולת תמנו חפש מחפש וקרב איש ולב עמק
(899520, -55, 4);[8, 10, 300, 40];משיח;231707;(27, 78, 25, 1, 231707);לחם;2;(27, 78, 25, 2, 899520);לחם אבירים אכל איש צידה שלח להם לשבע
(54487, -54, 4);[8, 10, 300, 40];משיח;14509;(1, 37, 8, 16, 14509);חלמתיו;1;(1, 37, 8, 56, 54487);ויאמרו לו אחיו המלך תמלך עלינו אם משול תמשל בנו ויוספו עוד שנא אתו על חלמתיו ועל דבריו
(116100, -54, 4);[8, 10, 300, 40];משיח;30684;(2, 26, 16, 10, 30684);האחד;3;(2, 26, 16, 36, 116100);עשר אמות ארך הקרש ואמה וחצי האמה רחב הקרש האחד
(132460, -54, 4);[8, 10, 300, 40];משיח;34974;(2, 35, 31, 3, 34974);רוח;3;(2, 35, 31, 11, 132460);וימלא אתו רוח אלהים בחכמה בתבונה ובדעת ובכל מלאכה
(312652, -54, 4);[8, 10, 300, 40];משיח;81972;(6, 6, 18, 13, 81972);מחנה;2;(6, 6, 18, 45, 312652);ורק אתם שמרו מן החרם פן תחרימו ולקחתם מן החרם ושמתם את מחנה ישראל לחרם ועכרתם אותו
(330820, -54, 4);[8, 10, 300, 40];משיח;86580;(6, 17, 4, 20, 86580);אחינו;2;(6, 17, 4, 79, 330820);ותקרבנה לפני אלעזר הכהן ולפני יהושע בן נון ולפני הנשיאים לאמר יהוה צוה את משה לתת לנו נחלה בתוך אחינו ויתן להם אל פי יהוה נחלה בתוך אחי אביהן
(509655, -54, 4);[8, 10, 300, 40];משיח;132664;(10, 14, 22, 14, 132664);חטאו;1;(10, 14, 22, 53, 509655);ויעש יהודה הרע בעיני יהוה ויקנאו אתו מכל אשר עשו אבתם בחטאתם אשר חטאו
(594252, -54, 4);[8, 10, 300, 40];משיח;154347;(12, 20, 1, 10, 154347);וילחם;4;(12, 20, 1, 39, 594252);בשנת בא תרתן אשדודה בשלח אתו סרגון מלך אשור וילחם באשדוד וילכדה
(893326, -54, 4);[8, 10, 300, 40];משיח;230173;(27, 69, 11, 5, 230173);לחרפות;2;(27, 69, 11, 19, 893326);ואבכה בצום נפשי ותהי לחרפות לי
(956661, -54, 4);[8, 10, 300, 40];משיח;246064;(28, 23, 30, 1, 246064);למאחרים;4;(28, 23, 30, 4, 956661);למאחרים על היין לבאים לחקר ממסך
(981238, -54, 4);[8, 10, 300, 40];משיח;252497;(29, 24, 3, 4, 252497);יחבלו;2;(29, 24, 3, 17, 981238);חמור יתומים ינהגו יחבלו שור אלמנה
(994846, -54, 4);[8, 10, 300, 40];משיח;256076;(29, 41, 24, 4, 256076);יחשב;2;(29, 41, 24, 15, 994846);אחריו יאיר נתיב יחשב תהום לשיבה
(1061075, -54, 4);[8, 10, 300, 40];משיח;272805;(36, 2, 38, 2, 272805);פשחור;3;(36, 2, 38, 6, 1061075);בני פשחור אלף מאתים ארבעים ושבעה
(237524, -53, 4);[8, 10, 300, 40];משיח;62529;(4, 29, 18, 1, 62529);ומנחתם;4;(4, 29, 18, 4, 237524);ומנחתם ונסכיהם לפרים לאילם ולכבשים במספרם כמשפט
(320615, -53, 4);[8, 10, 300, 40];משיח;83985;(6, 10, 19, 5, 83985);אחרי;2;(6, 10, 19, 17, 320615);ואתם אל תעמדו רדפו אחרי איביכם וזנבתם אותם אל תתנום לבוא אל עריהם כי נתנם יהוה אלהיכם בידכם
(433364, -53, 4);[8, 10, 300, 40];משיח;112783;(8, 30, 18, 6, 112783);לקחו;3;(8, 30, 18, 17, 433364);ויצל דוד את כל אשר לקחו עמלק ואת שתי נשיו הציל דוד
(697397, -53, 4);[8, 10, 300, 40];משיח;180720;(13, 36, 2, 1, 180720);קח;2;(13, 36, 2, 2, 697397);קח לך מגלת ספר וכתבת אליה את כל הדברים אשר דברתי אליך על ישראל ועל יהודה ועל כל הגוים מיום דברתי אליך מימי יאשיהו ועד היום הזה
(766414, -53, 4);[8, 10, 300, 40];משיח;198249;(14, 27, 27, 6, 198249);מחזיקי;2;(14, 27, 27, 30, 766414);הונך ועזבוניך מערבך מלחיך וחבליך מחזיקי בדקך וערבי מערבך וכל אנשי מלחמתך אשר בך ובכל קהלך אשר בתוכך יפלו בלב ימים ביום מפלתך
(801481, -53, 4);[8, 10, 300, 40];משיח;207032;(14, 48, 28, 14, 207032);נחלה;2;(14, 48, 28, 46, 801481);ועל גבול גד אל פאת נגב תימנה והיה גבול מתמר מי מריבת קדש נחלה על הים הגדול
(896929, -53, 4);[8, 10, 300, 40];משיח;231064;(27, 74, 10, 9, 231064);לנצח;4;(27, 74, 10, 31, 896929);עד מתי אלהים יחרף צר ינאץ אויב שמך לנצח
(907778, -53, 4);[8, 10, 300, 40];משיח;233731;(27, 91, 4, 8, 233731);וסחרה;3;(27, 91, 4, 30, 907778);באברתו יסך לך ותחת כנפיו תחסה צנה וסחרה אמתו
(946996, -53, 4);[8, 10, 300, 40];משיח;243499;(28, 12, 17, 1, 243499);יפיח;4;(28, 12, 17, 4, 946996);יפיח אמונה יגיד צדק ועד שקרים מרמה
(1054595, -53, 4);[8, 10, 300, 40];משיח;271221;(35, 9, 26, 19, 271221);מלחמה;3;(35, 9, 26, 74, 1054595);ואחרי השבעים ששים ושנים יכרת משיח ואין לו והעיר והקדש ישחית עם נגיד הבא וקצו בשטף ועד קץ מלחמה נחרצת שממות
(1079725, -53, 4);[8, 10, 300, 40];משיח;277278;(37, 4, 2, 5, 277278);להלחם;4;(37, 4, 2, 21, 1079725);ויקשרו כלם יחדו לבוא להלחם בירושלם ולעשות לו תועה
(52755, -52, 4);[8, 10, 300, 40];משיח;14060;(1, 36, 13, 4, 14060);נחת;2;(1, 36, 13, 14, 52755);ואלה בני רעואל נחת וזרח שמה ומזה אלה היו בני בשמת אשת עשו
(85791, -52, 4);[8, 10, 300, 40];משיח;22617;(2, 6, 19, 6, 22617);משפחת;4;(2, 6, 19, 24, 85791);ובני מררי מחלי ומושי אלה משפחת הלוי לתלדתם
(191796, -52, 4);[8, 10, 300, 40];משיח;50581;(4, 3, 35, 4, 50581);למשפחת;5;(4, 3, 35, 15, 191796);ונשיא בית אב למשפחת מררי צוריאל בן אביחיל על ירך המשכן יחנו צפנה
(270993, -52, 4);[8, 10, 300, 40];משיח;71080;(5, 12, 7, 6, 71080);ושמחתם;4;(5, 12, 7, 26, 270993);ואכלתם שם לפני יהוה אלהיכם ושמחתם בכל משלח ידכם אתם ובתיכם אשר ברכך יהוה אלהיך
(296282, -52, 4);[8, 10, 300, 40];משיח;77762;(5, 29, 17, 8, 77762);משפחה;4;(5, 29, 17, 21, 296282);פן יש בכם איש או אשה או משפחה או שבט אשר לבבו פנה היום מעם יהוה אלהינו ללכת לעבד את אלהי הגוים ההם פן יש בכם שרש פרה ראש ולענה
(382471, -52, 4);[8, 10, 300, 40];משיח;99637;(7, 21, 7, 6, 99637);ואנחנו;4;(7, 21, 7, 25, 382471);מה נעשה להם לנותרים לנשים ואנחנו נשבענו ביהוה לבלתי תת להם מבנותינו לנשים
(536417, -52, 4);[8, 10, 300, 40];משיח;139598;(11, 5, 20, 2, 139598);גיחזי;3;(11, 5, 20, 8, 536417);ויאמר גיחזי נער אלישע איש האלהים הנה חשך אדני את נעמן הארמי הזה מקחת מידו את אשר הביא חי יהוה כי אם רצתי אחריו ולקחתי מאתו מאומה
(831449, -52, 4);[8, 10, 300, 40];משיח;214608;(20, 6, 14, 5, 214608);וישחך;4;(20, 6, 14, 18, 831449);אתה תאכל ולא תשבע וישחך בקרבך ותסג ולא תפליט ואשר תפלט לחרב אתן
(8420, -51, 4);[8, 10, 300, 40];משיח;2258;(1, 7, 11, 5, 2258);לחיי;2;(1, 7, 11, 15, 8420);בשנת שש מאות שנה לחיי נח בחדש השני בשבעה עשר יום לחדש ביום הזה נבקעו כל מעינת תהום רבה וארבת השמים נפתחו
(59036, -51, 4);[8, 10, 300, 40];משיח;15693;(1, 40, 5, 5, 15693);חלמו;1;(1, 40, 5, 19, 59036);ויחלמו חלום שניהם איש חלמו בלילה אחד איש כפתרון חלמו המשקה והאפה אשר למלך מצרים אשר אסורים בבית הסהר
(60582, -51, 4);[8, 10, 300, 40];משיח;16088;(1, 41, 11, 4, 16088);אחד;2;(1, 41, 11, 17, 60582);ונחלמה חלום בלילה אחד אני והוא איש כפתרון חלמו חלמנו
(69961, -51, 4);[8, 10, 300, 40];משיח;18512;(1, 45, 23, 2, 18512);שלח;3;(1, 45, 23, 9, 69961);ולאביו שלח כזאת עשרה חמרים נשאים מטוב מצרים ועשר אתנת נשאת בר ולחם ומזון לאביו לדרך
(100361, -51, 4);[8, 10, 300, 40];משיח;26462;(2, 15, 13, 1, 26462);נחית;2;(2, 15, 13, 2, 100361);נחית בחסדך עם זו גאלת נהלת בעזך אל נוה קדשך
(112635, -51, 4);[8, 10, 300, 40];משיח;29817;(2, 24, 3, 16, 29817);אחד;2;(2, 24, 3, 53, 112635);ויבא משה ויספר לעם את כל דברי יהוה ואת כל המשפטים ויען כל העם קול אחד ויאמרו כל הדברים אשר דבר יהוה נעשה
(405298, -51, 4);[8, 10, 300, 40];משיח;105441;(8, 14, 45, 13, 105441);חלילה;1;(8, 14, 45, 53, 405298);ויאמר העם אל שאול היונתן ימות אשר עשה הישועה הגדולה הזאת בישראל חלילה חי יהוה אם יפל משערת ראשו ארצה כי עם אלהים עשה היום הזה ויפדו העם את יונתן ולא מת
(461968, -51, 4);[8, 10, 300, 40];משיח;120249;(9, 17, 8, 2, 120249);חושי;1;(9, 17, 8, 6, 461968);ויאמר חושי אתה ידעת את אביך ואת אנשיו כי גברים המה ומרי נפש המה כדב שכול בשדה ואביך איש מלחמה ולא ילין את העם
(558774, -51, 4);[8, 10, 300, 40];משיח;145336;(11, 17, 21, 18, 145336);והחטיאם;3;(11, 17, 21, 66, 558774);כי קרע ישראל מעל בית דוד וימליכו את ירבעם בן נבט וידא ירבעם את ישראל מאחרי יהוה והחטיאם חטאה גדולה
(724536, -51, 4);[8, 10, 300, 40];משיח;187696;(13, 51, 56, 9, 187696);חתתה;1;(13, 51, 56, 30, 724536);כי בא עליה על בבל שודד ונלכדו גבוריה חתתה קשתותם כי אל גמלות יהוה שלם ישלם
(839194, -51, 4);[8, 10, 300, 40];משיח;216576;(23, 2, 14, 5, 216576);חיתו;1;(23, 2, 14, 18, 839194);ורבצו בתוכה עדרים כל חיתו גוי גם קאת גם קפד בכפתריה ילינו קול ישורר בחלון חרב בסף כי ארזה ערה
(847952, -51, 4);[8, 10, 300, 40];משיח;218802;(25, 7, 9, 9, 218802);וחסד;2;(25, 7, 9, 31, 847952);כה אמר יהוה צבאות לאמר משפט אמת שפטו וחסד ורחמים עשו איש את אחיו
(944342, -51, 4);[8, 10, 300, 40];משיח;242823;(28, 9, 4, 5, 242823);חסר;1;(28, 9, 4, 12, 944342);מי פתי יסר הנה חסר לב אמרה לו
(1118321, -51, 4);[8, 10, 300, 40];משיח;286485;(38, 12, 35, 6, 286485);וחנית;2;(38, 12, 35, 25, 1118321);ומנפתלי שרים אלף ועמהם בצנה וחנית שלשים ושבעה אלף
(1186539, -51, 4);[8, 10, 300, 40];משיח;303023;(39, 31, 13, 9, 303023);ומחת;3;(39, 31, 13, 53, 1186539);ויחיאל ועזזיהו ונחת ועשהאל וירימות ויוזבד ואליאל ויסמכיהו ומחת ובניהו פקידים מיד כונניהו ושמעי אחיו במפקד יחזקיהו המלך ועזריהו נגיד בית האלהים
(242864, -50, 4);[8, 10, 300, 40];משיח;63891;(4, 32, 17, 2, 63891);נחלץ;2;(4, 32, 17, 8, 242864);ואנחנו נחלץ חשים לפני בני ישראל עד אשר אם הביאנם אל מקומם וישב טפנו בערי המבצר מפני ישבי הארץ
(266595, -50, 4);[8, 10, 300, 40];משיח;69966;(5, 9, 18, 19, 69966);חטאתם;1;(5, 9, 18, 75, 266595);ואתנפל לפני יהוה כראשנה ארבעים יום וארבעים לילה לחם לא אכלתי ומים לא שתיתי על כל חטאתכם אשר חטאתם לעשות הרע בעיני יהוה להכעיסו
(432052, -50, 4);[8, 10, 300, 40];משיח;112444;(8, 29, 8, 21, 112444);ונלחמתי;4;(8, 29, 8, 73, 432052);ויאמר דוד אל אכיש כי מה עשיתי ומה מצאת בעבדך מיום אשר הייתי לפניך עד היום הזה כי לא אבוא ונלחמתי באיבי אדני המלך
(448000, -50, 4);[8, 10, 300, 40];משיח;116576;(9, 9, 10, 19, 116576);לחם;2;(9, 9, 10, 77, 448000);ועבדת לו את האדמה אתה ובניך ועבדיך והבאת והיה לבן אדניך לחם ואכלו ומפיבשת בן אדניך יאכל תמיד לחם על שלחני ולציבא חמשה עשר בנים ועשרים עבדים
(601306, -50, 4);[8, 10, 300, 40];משיח;156179;(12, 28, 15, 10, 156179);חזה;1;(12, 28, 15, 34, 601306);כי אמרתם כרתנו ברית את מות ועם שאול עשינו חזה שיט שוטף כי עבר לא יבואנו כי שמנו כזב מחסנו ובשקר נסתרנו
(696046, -50, 4);[8, 10, 300, 40];משיח;180371;(13, 35, 3, 7, 180371);חבצניה;1;(13, 35, 3, 23, 696046);ואקח את יאזניה בן ירמיהו בן חבצניה ואת אחיו ואת כל בניו ואת כל בית הרכבים
(886410, -50, 4);[8, 10, 300, 40];משיח;228463;(27, 55, 21, 1, 228463);שלח;3;(27, 55, 21, 3, 886410);שלח ידיו בשלמיו חלל בריתו
(1089704, -50, 4);[8, 10, 300, 40];משיח;279666;(37, 9, 31, 11, 279666);ורחום;3;(37, 9, 31, 41, 1089704);וברחמיך הרבים לא עשיתם כלה ולא עזבתם כי אל חנון ורחום אתה
(1103424, -50, 4);[8, 10, 300, 40];משיח;282899;(38, 4, 27, 12, 282899);משפחתם;4;(38, 4, 27, 47, 1103424);ולשמעי בנים ששה עשר ובנות שש ולאחיו אין בנים רבים וכל משפחתם לא הרבו עד בני יהודה
(1178344, -50, 4);[8, 10, 300, 40];משיח;301106;(39, 26, 15, 3, 301106);חשבנות;1;(39, 26, 15, 12, 1178344);ויעש בירושלם חשבנות מחשבת חושב להיות על המגדלים ועל הפנות לירוא בחצים ובאבנים גדלות ויצא שמו עד למרחוק כי הפליא להעזר עד כי חזק
(1191166, -50, 4);[8, 10, 300, 40];משיח;304113;(39, 34, 3, 7, 304113);החל;2;(39, 34, 3, 30, 1191166);ובשמונה שנים למלכו והוא עודנו נער החל לדרוש לאלהי דויד אביו ובשתים עשרה שנה החל לטהר את יהודה וירושלם מן הבמות והאשרים והפסלים והמסכות
(257636, -49, 4);[8, 10, 300, 40];משיח;67679;(5, 4, 20, 12, 67679);נחלה;2;(5, 4, 20, 48, 257636);ואתכם לקח יהוה ויוצא אתכם מכור הברזל ממצרים להיות לו לעם נחלה כיום הזה
(302253, -49, 4);[8, 10, 300, 40];משיח;79300;(5, 32, 42, 8, 79300);חלל;1;(5, 32, 42, 27, 302253);אשכיר חצי מדם וחרבי תאכל בשר מדם חלל ושביה מראש פרעות אויב
(374389, -49, 4);[8, 10, 300, 40];משיח;97583;(7, 17, 4, 5, 97583);ותקח;4;(7, 17, 4, 18, 374389);וישב את הכסף לאמו ותקח אמו מאתים כסף ותתנהו לצורף ויעשהו פסל ומסכה ויהי בבית מיכיהו
(394776, -49, 4);[8, 10, 300, 40];משיח;102748;(8, 9, 1, 14, 102748);אפיח;4;(8, 9, 1, 47, 394776);ויהי איש מבן ימין ושמו קיש בן אביאל בן צרור בן בכורת בן אפיח בן איש ימיני גבור חיל
(589321, -49, 4);[8, 10, 300, 40];משיח;153093;(12, 14, 6, 12, 153093);חשך;1;(12, 14, 6, 40, 589321);מכה עמים בעברה מכת בלתי סרה רדה באף גוים מרדף בלי חשך
(617252, -49, 4);[8, 10, 300, 40];משיח;160246;(12, 41, 29, 6, 160246);רוח;3;(12, 41, 29, 20, 617252);הן כלם און אפס מעשיהם רוח ותהו נסכיהם
(709756, -49, 4);[8, 10, 300, 40];משיח;183888;(13, 44, 1, 14, 183888);ובתחפנחס;7;(13, 44, 1, 62, 709756);הדבר אשר היה אל ירמיהו אל כל היהודים הישבים בארץ מצרים הישבים במגדל ובתחפנחס ובנף ובארץ פתרוס לאמר
(883081, -49, 4);[8, 10, 300, 40];משיח;227626;(27, 49, 7, 3, 227626);חילם;1;(27, 49, 7, 9, 883081);הבטחים על חילם וברב עשרם יתהללו
(925744, -49, 4);[8, 10, 300, 40];משיח;238164;(27, 119, 124, 5, 238164);וחקיך;2;(27, 119, 124, 16, 925744);עשה עם עבדך כחסדך וחקיך למדני
(950534, -49, 4);[8, 10, 300, 40];משיח;244421;(28, 16, 21, 1, 244421);לחכם;2;(28, 16, 21, 2, 950534);לחכם לב יקרא נבון ומתק שפתים יסיף לקח
(1191963, -49, 4);[8, 10, 300, 40];משיח;304291;(39, 34, 12, 18, 304291);לנצח;4;(39, 34, 12, 85, 1191963);והאנשים עשים באמונה במלאכה ועליהם מפקדים יחת ועבדיהו הלוים מן בני מררי וזכריה ומשלם מן בני הקהתים לנצח והלוים כל מבין בכלי שיר
(133274, -48, 4);[8, 10, 300, 40];משיח;35178;(2, 36, 9, 7, 35178);ורחב;3;(2, 36, 9, 30, 133274);ארך היריעה האחת שמנה ועשרים באמה ורחב ארבע באמה היריעה האחת מדה אחת לכל היריעת
(174133, -48, 4);[8, 10, 300, 40];משיח;46087;(3, 21, 14, 13, 46087);יקח;3;(3, 21, 14, 46, 174133);אלמנה וגרושה וחללה זנה את אלה לא יקח כי אם בתולה מעמיו יקח אשה
(241023, -48, 4);[8, 10, 300, 40];משיח;63421;(4, 31, 32, 15, 63421);וחמשת;2;(4, 31, 32, 52, 241023);ויהי המלקוח יתר הבז אשר בזזו עם הצבא צאן שש מאות אלף ושבעים אלף וחמשת אלפים
(282773, -48, 4);[8, 10, 300, 40];משיח;74211;(5, 21, 3, 5, 74211);החלל;2;(5, 21, 3, 17, 282773);והיה העיר הקרבה אל החלל ולקחו זקני העיר ההוא עגלת בקר אשר לא עבד בה אשר לא משכה בעל
(381370, -48, 4);[8, 10, 300, 40];משיח;99364;(7, 20, 37, 2, 99364);החישו;2;(7, 20, 37, 7, 381370);והארב החישו ויפשטו אל הגבעה וימשך הארב ויך את כל העיר לפי חרב
(469281, -48, 4);[8, 10, 300, 40];משיח;122191;(9, 20, 6, 19, 122191);אחריו;2;(9, 20, 6, 63, 469281);ויאמר דוד אל אבישי עתה ירע לנו שבע בן בכרי מן אבשלום אתה קח את עבדי אדניך ורדף אחריו פן מצא לו ערים בצרות והציל עיננו
