(n, d, k);[Gematria of ELS];ELS Search Term;Found in WordNumber In Text;WordCoordinatesDWTK;Found in Word In Text;LetterPositionIndex In Word;LetterCoordinatesD5K of First Letter in ELS;Found In Verse
(9739, -92, 4);[8, 10, 300, 40];משיח;2451;(25, 12, 4, 14, 2451);אפקח;4;(25, 12, 4, 55, 9739);ביום ההוא נאם יהוה אכה כל סוס בתמהון ורכבו בשגעון ועל בית יהודה אפקח את עיני וכל סוס העמים אכה בעורון
(11953, -78, 4);[8, 10, 300, 40];משיח;3006;(25, 14, 15, 7, 3006);והחמור;3;(25, 14, 15, 26, 11953);וכן תהיה מגפת הסוס הפרד הגמל והחמור וכל הבהמה אשר יהיה במחנות ההמה כמגפה הזאת
(1073, -67, 4);[8, 10, 300, 40];משיח;266;(25, 1, 17, 12, 266);ונחם;3;(25, 1, 17, 43, 1073);עוד קרא לאמר כה אמר יהוה צבאות עוד תפוצנה ערי מטוב ונחם יהוה עוד את ציון ובחר עוד בירושלם
(5200, -51, 4);[8, 10, 300, 40];משיח;1313;(25, 7, 9, 9, 1313);וחסד;2;(25, 7, 9, 31, 5200);כה אמר יהוה צבאות לאמר משפט אמת שפטו וחסד ורחמים עשו איש את אחיו
(10195, -38, 4);[8, 10, 300, 40];משיח;2562;(25, 12, 10, 20, 2562);היחיד;3;(25, 12, 10, 78, 10195);ושפכתי על בית דויד ועל יושב ירושלם רוח חן ותחנונים והביטו אלי את אשר דקרו וספדו עליו כמספד על היחיד והמר עליו כהמר על הבכור
(9739, -92, 5);[8, 10, 300, 40, 30];למשיח;2451;(25, 12, 4, 14, 2451);אפקח;4;(25, 12, 4, 55, 9739);ביום ההוא נאם יהוה אכה כל סוס בתמהון ורכבו בשגעון ועל בית יהודה אפקח את עיני וכל סוס העמים אכה בעורון
(1140, -67, 5);[5, 8, 10, 300, 40];משיחה;284;(25, 2, 2, 4, 284);הדבר;1;(25, 2, 2, 12, 1140);ואמר אל המלאך הדבר בי מה אלה ויאמר אלי אלה הקרנות אשר זרו את יהודה את ישראל וירושלם
(12109, -78, 6);[6, 50, 8, 10, 300, 40];משיחנו;3044;(25, 14, 17, 10, 3044);להשתחות;6;(25, 14, 17, 40, 12109);והיה אשר לא יעלה מאת משפחות הארץ אל ירושלם להשתחות למלך יהוה צבאות ולא עליהם יהיה הגשם
