(230439, -81, 5);[10, 8, 10, 300, 40];משיחי;60800;(4, 25, 6, 6, 60800);ויקרב;2;(4, 25, 6, 20, 230439);והנה איש מבני ישראל בא ויקרב אל אחיו את המדינית לעיני משה ולעיני כל עדת בני ישראל והמה בכים פתח אהל מועד
(643471, -80, 5);[10, 8, 10, 300, 40];משיחי;166825;(13, 1, 18, 17, 166825);לכהניה;5;(13, 1, 18, 72, 643471);ואני הנה נתתיך היום לעיר מבצר ולעמוד ברזל ולחמות נחשת על כל הארץ למלכי יהודה לשריה לכהניה ולעם הארץ
(808138, -80, 5);[10, 8, 10, 300, 40];משיחי;208733;(15, 9, 15, 17, 208733);סררים;4;(15, 9, 15, 64, 808138);כל רעתם בגלגל כי שם שנאתים על רע מעלליהם מביתי אגרשם לא אוסף אהבתם כל שריהם סררים
(885168, -80, 5);[10, 8, 10, 300, 40];משיחי;228152;(27, 52, 10, 1, 228152);ואני;4;(27, 52, 10, 4, 885168);ואני כזית רענן בבית אלהים בטחתי בחסד אלהים עולם ועד
(703724, -79, 5);[10, 8, 10, 300, 40];משיחי;182340;(13, 39, 9, 4, 182340);הנשארים;6;(13, 39, 9, 15, 703724);ואת יתר העם הנשארים בעיר ואת הנפלים אשר נפלו עליו ואת יתר העם הנשארים הגלה נבוזר אדן רב טבחים בבל
(281839, -78, 5);[10, 8, 10, 300, 40];משיחי;73960;(5, 20, 6, 12, 73960);ימות;1;(5, 20, 6, 38, 281839);ומי האיש אשר נטע כרם ולא חללו ילך וישב לביתו פן ימות במלחמה ואיש אחר יחללנו
(357503, -78, 5);[10, 8, 10, 300, 40];משיחי;93314;(7, 7, 23, 11, 93314);אחרי;4;(7, 7, 23, 44, 357503);ויצעק איש ישראל מנפתלי ומן אשר ומן כל מנשה וירדפו אחרי מדין
(485677, -78, 5);[10, 8, 10, 300, 40];משיחי;126478;(10, 4, 17, 1, 126478);יהושפט;1;(10, 4, 17, 1, 485677);יהושפט בן פרוח ביששכר
(580567, -78, 5);[10, 8, 10, 300, 40];משיחי;150848;(12, 5, 22, 4, 150848);יין;2;(12, 5, 22, 16, 580567);הוי גבורים לשתות יין ואנשי חיל למסך שכר
(1196754, -78, 5);[10, 8, 10, 300, 40];משיחי;305419;(39, 36, 20, 9, 305419);ולבניו;5;(39, 36, 20, 33, 1196754);ויגל השארית מן החרב אל בבל ויהיו לו ולבניו לעבדים עד מלך מלכות פרס
(407587, -77, 5);[10, 8, 10, 300, 40];משיחי;106035;(8, 15, 33, 1, 106035);ויאמר;2;(8, 15, 33, 2, 407587);ויאמר שמואל כאשר שכלה נשים חרבך כן תשכל מנשים אמך וישסף שמואל את אגג לפני יהוה בגלגל
(526251, -77, 5);[10, 8, 10, 300, 40];משיחי;136978;(10, 22, 27, 5, 136978);שימו;2;(10, 22, 27, 16, 526251);ואמרת כה אמר המלך שימו את זה בית הכלא והאכילהו לחם לחץ ומים לחץ עד באי בשלום
(820274, -77, 5);[10, 8, 10, 300, 40];משיחי;211766;(17, 6, 10, 18, 211766);כי;2;(17, 6, 10, 72, 820274);ונשאו דודו ומסרפו להוציא עצמים מן הבית ואמר לאשר בירכתי הבית העוד עמך ואמר אפס ואמר הס כי לא להזכיר בשם יהוה
(100122, -75, 5);[10, 8, 10, 300, 40];משיחי;26402;(2, 15, 6, 5, 26402);ימינך;3;(2, 15, 6, 20, 100122);ימינך יהוה נאדרי בכח ימינך יהוה תרעץ אויב
(232255, -74, 5);[10, 8, 10, 300, 40];משיחי;61236;(4, 26, 27, 5, 61236);ששים;3;(4, 26, 27, 25, 232255);אלה משפחת הזבולני לפקדיהם ששים אלף וחמש מאות
(486438, -74, 5);[10, 8, 10, 300, 40];משיחי;126673;(10, 5, 12, 1, 126673);וידבר;2;(10, 5, 12, 2, 486438);וידבר שלשת אלפים משל ויהי שירו חמשה ואלף
(595500, -73, 5);[10, 8, 10, 300, 40];משיחי;154677;(12, 22, 4, 7, 154677);בבכי;4;(12, 22, 4, 23, 595500);על כן אמרתי שעו מני אמרר בבכי אל תאיצו לנחמני על שד בת עמי
(1081895, -73, 5);[10, 8, 10, 300, 40];משיחי;277782;(37, 5, 17, 5, 277782);איש;2;(37, 5, 17, 26, 1081895);והיהודים והסגנים מאה וחמשים איש והבאים אלינו מן הגוים אשר סביבתינו על שלחני
(1134565, -71, 5);[10, 8, 10, 300, 40];משיחי;290435;(38, 25, 13, 2, 290435);בקיהו;3;(38, 25, 13, 7, 1134565);הששי בקיהו בניו ואחיו שנים עשר
(706875, -69, 5);[10, 8, 10, 300, 40];משיחי;183147;(13, 41, 14, 10, 183147);וילכו;2;(13, 41, 14, 36, 706875);ויסבו כל העם אשר שבה ישמעאל מן המצפה וישבו וילכו אל יוחנן בן קרח
(884167, -69, 5);[10, 8, 10, 300, 40];משיחי;227907;(27, 50, 21, 6, 227907);אהיה;3;(27, 50, 21, 25, 884167);אלה עשית והחרשתי דמית היות אהיה כמוך אוכיחך ואערכה לעיניך
(913039, -69, 5);[10, 8, 10, 300, 40];משיחי;235061;(27, 103, 17, 10, 235061);בנים;3;(27, 103, 17, 40, 913039);וחסד יהוה מעולם ועד עולם על יראיו וצדקתו לבני בנים
(1061327, -68, 5);[10, 8, 10, 300, 40];משיחי;272868;(36, 2, 46, 3, 272868);בני;3;(36, 2, 46, 9, 1061327);בני חגב בני שמלי בני חנן
(810698, -66, 5);[10, 8, 10, 300, 40];משיחי;209373;(15, 13, 14, 6, 209373);אהי;3;(15, 13, 14, 23, 810698);מיד שאול אפדם ממות אגאלם אהי דבריך מות אהי קטבך שאול נחם יסתר מעיני
(1034636, -66, 5);[10, 8, 10, 300, 40];משיחי;266368;(34, 9, 30, 5, 266368);היהודים;6;(34, 9, 30, 20, 1034636);וישלח ספרים אל כל היהודים אל שבע ועשרים ומאה מדינה מלכות אחשורוש דברי שלום ואמת
(411003, -65, 5);[10, 8, 10, 300, 40];משיחי;106905;(8, 17, 30, 9, 106905);וישבהו;2;(8, 17, 30, 31, 411003);ויסב מאצלו אל מול אחר ויאמר כדבר הזה וישבהו העם דבר כדבר הראשון
(510395, -64, 5);[10, 8, 10, 300, 40];משיחי;132859;(10, 15, 5, 15, 132859);חייו;2;(10, 15, 5, 46, 510395);אשר עשה דוד את הישר בעיני יהוה ולא סר מכל אשר צוהו כל ימי חייו רק בדבר אוריה החתי
(555756, -63, 5);[10, 8, 10, 300, 40];משיחי;144564;(11, 15, 34, 3, 144564);בעיני;5;(11, 15, 34, 13, 555756);ויעש הישר בעיני יהוה ככל אשר עשה עזיהו אביו עשה
(1084266, -63, 5);[10, 8, 10, 300, 40];משיחי;278357;(37, 7, 25, 1, 278357);בני;3;(37, 7, 25, 3, 1084266);בני גבעון תשעים וחמשה
(622028, -61, 5);[10, 8, 10, 300, 40];משיחי;161427;(12, 45, 14, 9, 161427);אנשי;4;(12, 45, 14, 35, 622028);כה אמר יהוה יגיע מצרים וסחר כוש וסבאים אנשי מדה עליך יעברו ולך יהיו אחריך ילכו בזקים יעברו ואליך ישתחוו אליך יתפללו אך בך אל ואין עוד אפס אלהים
(701281, -61, 5);[10, 8, 10, 300, 40];משיחי;181710;(13, 38, 4, 5, 181710);יומת;1;(13, 38, 4, 18, 701281);ויאמרו השרים אל המלך יומת נא את האיש הזה כי על כן הוא מרפא את ידי אנשי המלחמה הנשארים בעיר הזאת ואת ידי כל העם לדבר אליהם כדברים האלה כי האיש הזה איננו דרש לשלום לעם הזה כי אם לרעה
(532224, -60, 5);[10, 8, 10, 300, 40];משיחי;138507;(11, 3, 24, 6, 138507);ישראל;1;(11, 3, 24, 22, 532224);ויבאו אל מחנה ישראל ויקמו ישראל ויכו את מואב וינסו מפניהם ויבו בה והכות את מואב
(201466, -59, 5);[10, 8, 10, 300, 40];משיחי;53116;(4, 7, 72, 4, 53116);יום;1;(4, 7, 72, 12, 201466);ביום עשתי עשר יום נשיא לבני אשר פגעיאל בן עכרן
(126745, -56, 5);[10, 8, 10, 300, 40];משיחי;33419;(2, 32, 18, 1, 33419);ויאמר;2;(2, 32, 18, 2, 126745);ויאמר אין קול ענות גבורה ואין קול ענות חלושה קול ענות אנכי שמע
(1090052, -56, 5);[10, 8, 10, 300, 40];משיחי;279746;(37, 9, 36, 3, 279746);היום;2;(37, 9, 36, 10, 1090052);הנה אנחנו היום עבדים והארץ אשר נתתה לאבתינו לאכל את פריה ואת טובה הנה אנחנו עבדים עליה
(9476, -55, 5);[10, 8, 10, 300, 40];משיחי;2540;(1, 8, 8, 1, 2540);וישלח;2;(1, 8, 8, 2, 9476);וישלח את היונה מאתו לראות הקלו המים מעל פני האדמה
(730037, -55, 5);[10, 8, 10, 300, 40];משיחי;189078;(14, 3, 9, 13, 189078);בית;2;(14, 3, 9, 45, 730037);כשמיר חזק מצר נתתי מצחך לא תירא אותם ולא תחת מפניהם כי בית מרי המה
(890253, -55, 5);[10, 8, 10, 300, 40];משיחי;229435;(27, 64, 9, 2, 229435);עלימו;3;(27, 64, 9, 12, 890253);ויכשילוהו עלימו לשונם יתנדדו כל ראה בם
(54541, -54, 5);[10, 8, 10, 300, 40];משיחי;14521;(1, 37, 9, 10, 14521);חלמתי;5;(1, 37, 9, 41, 54541);ויחלם עוד חלום אחר ויספר אתו לאחיו ויאמר הנה חלמתי חלום עוד והנה השמש והירח ואחד עשר כוכבים משתחוים לי
(893380, -54, 5);[10, 8, 10, 300, 40];משיחי;230186;(27, 69, 13, 6, 230186);שותי;4;(27, 69, 13, 25, 893380);ישיחו בי ישבי שער ונגינות שותי שכר
(766467, -53, 5);[10, 8, 10, 300, 40];משיחי;198262;(14, 27, 27, 19, 198262);יפלו;1;(14, 27, 27, 83, 766467);הונך ועזבוניך מערבך מלחיך וחבליך מחזיקי בדקך וערבי מערבך וכל אנשי מלחמתך אשר בך ובכל קהלך אשר בתוכך יפלו בלב ימים ביום מפלתך
(382523, -52, 5);[10, 8, 10, 300, 40];משיחי;99648;(7, 21, 8, 4, 99648);משבטי;5;(7, 21, 8, 16, 382523);ויאמרו מי אחד משבטי ישראל אשר לא עלה אל יהוה המצפה והנה לא בא איש אל המחנה מיביש גלעד אל הקהל
(60633, -51, 5);[10, 8, 10, 300, 40];משיחי;16101;(1, 41, 12, 7, 16101);הטבחים;5;(1, 41, 12, 25, 60633);ושם אתנו נער עברי עבד לשר הטבחים ונספר לו ויפתר לנו את חלמתינו איש כחלמו פתר
(112686, -51, 5);[10, 8, 10, 300, 40];משיחי;29831;(2, 24, 4, 7, 29831);וישכם;2;(2, 24, 4, 22, 112686);ויכתב משה את כל דברי יהוה וישכם בבקר ויבן מזבח תחת ההר ושתים עשרה מצבה לשנים עשר שבטי ישראל
(724587, -51, 5);[10, 8, 10, 300, 40];משיחי;187707;(13, 51, 57, 4, 187707);פחותיה;5;(13, 51, 57, 22, 724587);והשכרתי שריה וחכמיה פחותיה וסגניה וגבוריה וישנו שנת עולם ולא יקיצו נאם המלך יהוה צבאות שמו
(242914, -50, 5);[10, 8, 10, 300, 40];משיחי;63904;(4, 32, 17, 15, 63904);בערי;4;(4, 32, 17, 58, 242914);ואנחנו נחלץ חשים לפני בני ישראל עד אשר אם הביאנם אל מקומם וישב טפנו בערי המבצר מפני ישבי הארץ
(432102, -50, 5);[10, 8, 10, 300, 40];משיחי;112457;(8, 29, 9, 10, 112457);בעיני;3;(8, 29, 9, 34, 432102);ויען אכיש ויאמר אל דוד ידעתי כי טוב אתה בעיני כמלאך אלהים אך שרי פלשתים אמרו לא יעלה עמנו במלחמה
(133322, -48, 5);[10, 8, 10, 300, 40];משיחי;35190;(2, 36, 10, 4, 35190);היריעת;4;(2, 36, 10, 14, 133322);ויחבר את חמש היריעת אחת אל אחת וחמש יריעת חבר אחת אל אחת
(1074257, -48, 5);[10, 8, 10, 300, 40];משיחי;275954;(36, 10, 18, 8, 275954);מבני;4;(36, 10, 18, 37, 1074257);וימצא מבני הכהנים אשר השיבו נשים נכריות מבני ישוע בן יוצדק ואחיו מעשיה ואליעזר ויריב וגדליה
(250753, -47, 5);[10, 8, 10, 300, 40];משיחי;65892;(5, 1, 15, 16, 65892);ושרי;4;(5, 1, 15, 69, 250753);ואקח את ראשי שבטיכם אנשים חכמים וידעים ואתן אתם ראשים עליכם שרי אלפים ושרי מאות ושרי חמשים ושרי עשרת ושטרים לשבטיכם
(463687, -47, 5);[10, 8, 10, 300, 40];משיחי;120697;(9, 18, 2, 14, 120697);יואב;1;(9, 18, 2, 52, 463687);וישלח דוד את העם השלשית ביד יואב והשלשית ביד אבישי בן צרויה אחי יואב והשלשת ביד אתי הגתי ויאמר המלך אל העם יצא אצא גם אני עמכם
(595272, -47, 5);[10, 8, 10, 300, 40];משיחי;154615;(12, 21, 16, 5, 154615);אלי;3;(12, 21, 16, 14, 595272);כי כה אמר אדני אלי בעוד שנה כשני שכיר וכלה כל כבוד קדר
(1084986, -47, 5);[10, 8, 10, 300, 40];משיחי;278537;(37, 7, 52, 2, 278537);בסי;3;(37, 7, 52, 6, 1084986);בני בסי בני מעונים בני נפושסים
(753862, -46, 5);[10, 8, 10, 300, 40];משיחי;195091;(14, 20, 23, 5, 195091);ידי;3;(14, 20, 23, 15, 753862);גם אני נשאתי את ידי להם במדבר להפיץ אתם בגוים ולזרות אותם בארצות
(11650, -45, 5);[10, 8, 10, 300, 40];משיחי;3135;(1, 10, 3, 1, 3135);ובני;4;(1, 10, 3, 4, 11650);ובני גמר אשכנז וריפת ותגרמה
(702201, -45, 5);[10, 8, 10, 300, 40];משיחי;181947;(13, 38, 15, 10, 181947);תמיתני;3;(13, 38, 15, 37, 702201);ויאמר ירמיהו אל צדקיהו כי אגיד לך הלוא המת תמיתני וכי איעצך לא תשמע אלי
(912176, -45, 5);[10, 8, 10, 300, 40];משיחי;234846;(27, 102, 17, 3, 234846);יהוה;1;(27, 102, 17, 6, 912176);כי בנה יהוה ציון נראה בכבודו
(370585, -44, 5);[10, 8, 10, 300, 40];משיחי;96645;(7, 14, 19, 21, 96645);בית;2;(7, 14, 19, 88, 370585);ותצלח עליו רוח יהוה וירד אשקלון ויך מהם שלשים איש ויקח את חליצותם ויתן החליפות למגידי החידה ויחר אפו ויעל בית אביהו
(919611, -44, 5);[10, 8, 10, 300, 40];משיחי;236640;(27, 110, 4, 9, 236640);דברתי;5;(27, 110, 4, 33, 919611);נשבע יהוה ולא ינחם אתה כהן לעולם על דברתי מלכי צדק
(1179236, -44, 5);[10, 8, 10, 300, 40];משיחי;301324;(39, 27, 4, 7, 301324);בירניות;5;(39, 27, 4, 31, 1179236);וערים בנה בהר יהודה ובחרשים בנה בירניות ומגדלים
(451590, -43, 5);[10, 8, 10, 300, 40];משיחי;117511;(9, 12, 8, 4, 117511);בית;2;(9, 12, 8, 11, 451590);ואתנה לך את בית אדניך ואת נשי אדניך בחיקך ואתנה לך את בית ישראל ויהודה ואם מעט ואספה לך כהנה וכהנה
(828400, -43, 5);[10, 8, 10, 300, 40];משיחי;213857;(20, 2, 12, 3, 213857);יעקב;1;(20, 2, 12, 8, 828400);אסף אאסף יעקב כלך קבץ אקבץ שארית ישראל יחד אשימנו כצאן בצרה כעדר בתוך הדברו תהימנה מאדם
(977509, -42, 5);[10, 8, 10, 300, 40];משיחי;251542;(29, 19, 8, 6, 251542);נתיבותי;3;(29, 19, 8, 21, 977509);ארחי גדר ולא אעבור ועל נתיבותי חשך ישים
(1180729, -42, 5);[10, 8, 10, 300, 40];משיחי;301686;(39, 28, 17, 6, 301686);וישבו;2;(39, 28, 17, 25, 1180729);ועוד אדומים באו ויכו ביהודה וישבו שבי
(105565, -40, 5);[10, 8, 10, 300, 40];משיחי;27862;(2, 18, 26, 9, 27862);יביאון;3;(2, 18, 26, 28, 105565);ושפטו את העם בכל עת את הדבר הקשה יביאון אל משה וכל הדבר הקטן ישפוטו הם
(530773, -40, 5);[10, 8, 10, 300, 40];משיחי;138132;(11, 2, 24, 9, 138132);דבים;3;(11, 2, 24, 40, 530773);ויפן אחריו ויראם ויקללם בשם יהוה ותצאנה שתים דבים מן היער ותבקענה מהם ארבעים ושני ילדים
(930670, -40, 5);[10, 8, 10, 300, 40];משיחי;239389;(27, 135, 14, 2, 239389);ידין;1;(27, 135, 14, 3, 930670);כי ידין יהוה עמו ועל עבדיו יתנחם
(1133706, -39, 5);[10, 8, 10, 300, 40];משיחי;290243;(38, 24, 30, 1, 290243);ובני;4;(38, 24, 30, 4, 1133706);ובני מושי מחלי ועדר וירימות אלה בני הלוים לבית אבתיהם
(701963, -38, 5);[10, 8, 10, 300, 40];משיחי;181889;(13, 38, 12, 9, 181889);בלואי;5;(13, 38, 12, 34, 701963);ויאמר עבד מלך הכושי אל ירמיהו שים נא בלואי הסחבות והמלחים תחת אצלות ידיך מתחת לחבלים ויעש ירמיהו כן
(373934, -36, 5);[10, 8, 10, 300, 40];משיחי;97468;(7, 16, 29, 5, 97468);עמודי;5;(7, 16, 29, 20, 373934);וילפת שמשון את שני עמודי התוך אשר הבית נכון עליהם ויסמך עליהם אחד בימינו ואחד בשמאלו
(1160334, -34, 5);[10, 8, 10, 300, 40];משיחי;296691;(39, 13, 21, 9, 296691);עשרים;4;(39, 13, 21, 38, 1160334);ויתחזק אביהו וישא לו נשים ארבע עשרה ויולד עשרים ושנים בנים ושש עשרה בנות
(704708, -33, 5);[10, 8, 10, 300, 40];משיחי;182596;(13, 40, 4, 36, 182596);בעיניך;5;(13, 40, 4, 126, 704708);ועתה הנה פתחתיך היום מן האזקים אשר על ידך אם טוב בעיניך לבוא אתי בבל בא ואשים את עיני עליך ואם רע בעיניך לבוא אתי בבל חדל ראה כל הארץ לפניך אל טוב ואל הישר בעיניך ללכת שמה לך
(1121923, -33, 5);[10, 8, 10, 300, 40];משיחי;287329;(38, 15, 29, 1, 287329);ויהי;2;(38, 15, 29, 2, 1121923);ויהי ארון ברית יהוה בא עד עיר דויד ומיכל בת שאול נשקפה בעד החלון ותרא את המלך דויד מרקד ומשחק ותבז לו בלבה
(861090, -32, 5);[10, 8, 10, 300, 40];משיחי;222114;(27, 7, 15, 6, 222114);וילד;2;(27, 7, 15, 19, 861090);הנה יחבל און והרה עמל וילד שקר
(1081987, -32, 5);[10, 8, 10, 300, 40];משיחי;277806;(37, 5, 18, 16, 277806);ימים;1;(37, 5, 18, 55, 1081987);ואשר היה נעשה ליום אחד שור אחד צאן שש בררות וצפרים נעשו לי ובין עשרת ימים בכל יין להרבה ועם זה לחם הפחה לא בקשתי כי כבדה העבדה על העם הזה
(626506, -30, 5);[10, 8, 10, 300, 40];משיחי;162560;(12, 49, 25, 6, 162560);שבי;3;(12, 49, 25, 16, 626506);כי כה אמר יהוה גם שבי גבור יקח ומלקוח עריץ ימלט ואת יריבך אנכי אריב ואת בניך אנכי אושיע
(1062396, -30, 5);[10, 8, 10, 300, 40];משיחי;273124;(36, 3, 2, 11, 273124);ויבנו;2;(36, 3, 2, 48, 1062396);ויקם ישוע בן יוצדק ואחיו הכהנים וזרבבל בן שאלתיאל ואחיו ויבנו את מזבח אלהי ישראל להעלות עליו עלות ככתוב בתורת משה איש האלהים
(101057, -28, 5);[10, 8, 10, 300, 40];משיחי;26647;(2, 15, 26, 22, 26647);אשים;3;(2, 15, 26, 92, 101057);ויאמר אם שמוע תשמע לקול יהוה אלהיך והישר בעיניו תעשה והאזנת למצותיו ושמרת כל חקיו כל המחלה אשר שמתי במצרים לא אשים עליך כי אני יהוה רפאך
(796847, -28, 5);[10, 8, 10, 300, 40];משיחי;205867;(14, 46, 1, 4, 205867);יהוה;1;(14, 46, 1, 10, 796847);כה אמר אדני יהוה שער החצר הפנימית הפנה קדים יהיה סגור ששת ימי המעשה וביום השבת יפתח וביום החדש יפתח
(197108, -26, 5);[10, 8, 10, 300, 40];משיחי;51968;(4, 6, 3, 14, 51968);ישתה;1;(4, 6, 3, 46, 197108);מיין ושכר יזיר חמץ יין וחמץ שכר לא ישתה וכל משרת ענבים לא ישתה וענבים לחים ויבשים לא יאכל
(873005, -26, 5);[10, 8, 10, 300, 40];משיחי;225104;(27, 32, 3, 5, 225104);בשאגתי;6;(27, 32, 3, 21, 873005);כי החרשתי בלו עצמי בשאגתי כל היום
(1009526, -26, 5);[10, 8, 10, 300, 40];משיחי;259821;(32, 3, 33, 6, 259821);בני;3;(32, 3, 33, 18, 1009526);כי לא ענה מלבו ויגה בני איש
(330013, -25, 5);[10, 8, 10, 300, 40];משיחי;86383;(6, 16, 2, 1, 86383);ויצא;2;(6, 16, 2, 2, 330013);ויצא מבית אל לוזה ועבר אל גבול הארכי עטרות
(668870, -25, 5);[10, 8, 10, 300, 40];משיחי;173356;(13, 18, 22, 6, 173356);עליהם;3;(13, 18, 22, 23, 668870);תשמע זעקה מבתיהם כי תביא עליהם גדוד פתאם כי כרו שיחה ללכדני ופחים טמנו לרגלי
(716022, -25, 5);[10, 8, 10, 300, 40];משיחי;185482;(13, 48, 33, 8, 185482);מיקבים;2;(13, 48, 33, 34, 716022);ונאספה שמחה וגיל מכרמל ומארץ מואב ויין מיקבים השבתי לא ידרך הידד הידד לא הידד
(567415, -24, 5);[10, 8, 10, 300, 40];משיחי;147551;(11, 21, 16, 24, 147551);יהוה;1;(11, 21, 16, 81, 567415);וגם דם נקי שפך מנשה הרבה מאד עד אשר מלא את ירושלם פה לפה לבד מחטאתו אשר החטיא את יהודה לעשות הרע בעיני יהוה
(1093896, -24, 5);[10, 8, 10, 300, 40];משיחי;280615;(37, 12, 22, 1, 280615);הלוים;4;(37, 12, 22, 4, 1093896);הלוים בימי אלישיב יוידע ויוחנן וידוע כתובים ראשי אבות והכהנים על מלכות דריוש הפרסי
(530601, -22, 5);[10, 8, 10, 300, 40];משיחי;138087;(11, 2, 21, 13, 138087);למים;3;(11, 2, 21, 46, 530601);ויצא אל מוצא המים וישלך שם מלח ויאמר כה אמר יהוה רפאתי למים האלה לא יהיה משם עוד מות ומשכלת
(939908, -22, 5);[10, 8, 10, 300, 40];משיחי;241684;(28, 3, 31, 3, 241684);באיש;3;(28, 3, 31, 9, 939908);אל תקנא באיש חמס ואל תבחר בכל דרכיו
(965291, -21, 5);[10, 8, 10, 300, 40];משיחי;248338;(29, 1, 22, 9, 248338);לאלהים;5;(29, 1, 22, 30, 965291);בכל זאת לא חטא איוב ולא נתן תפלה לאלהים
(1034497, -21, 5);[10, 8, 10, 300, 40];משיחי;266335;(34, 9, 28, 12, 266335);ועיר;3;(34, 9, 28, 57, 1034497);והימים האלה נזכרים ונעשים בכל דור ודור משפחה ומשפחה מדינה ומדינה ועיר ועיר וימי הפורים האלה לא יעברו מתוך היהודים וזכרם לא יסוף מזרעם
(320837, -20, 5);[10, 8, 10, 300, 40];משיחי;84040;(6, 10, 22, 8, 84040);אלי;3;(6, 10, 22, 33, 320837);ויאמר יהושע פתחו את פי המערה והוציאו אלי את חמשת המלכים האלה מן המערה
(373886, -20, 5);[10, 8, 10, 300, 40];משיחי;97457;(7, 16, 28, 15, 97457);האלהים;5;(7, 16, 28, 58, 373886);ויקרא שמשון אל יהוה ויאמר אדני יהוה זכרני נא וחזקני נא אך הפעם הזה האלהים ואנקמה נקם אחת משתי עיני מפלשתים
(760918, -20, 5);[10, 8, 10, 300, 40];משיחי;196879;(14, 23, 39, 15, 196879);ביתי;4;(14, 23, 39, 63, 760918);ובשחטם את בניהם לגלוליהם ויבאו אל מקדשי ביום ההוא לחללו והנה כה עשו בתוך ביתי
(839143, -20, 5);[10, 8, 10, 300, 40];משיחי;216563;(23, 2, 13, 5, 216563);ויאבד;2;(23, 2, 13, 14, 839143);ויט ידו על צפון ויאבד את אשור וישם את נינוה לשממה ציה כמדבר
(1032408, -20, 5);[10, 8, 10, 300, 40];משיחי;265825;(34, 8, 15, 12, 265825);ותכריך;5;(34, 8, 15, 54, 1032408);ומרדכי יצא מלפני המלך בלבוש מלכות תכלת וחור ועטרת זהב גדולה ותכריך בוץ וארגמן והעיר שושן צהלה ושמחה
(1059088, -20, 5);[10, 8, 10, 300, 40];משיחי;272328;(35, 12, 9, 4, 272328);כי;2;(35, 12, 9, 14, 1059088);ויאמר לך דניאל כי סתמים וחתמים הדברים עד עת קץ
(345118, -19, 5);[10, 8, 10, 300, 40];משיחי;90141;(7, 1, 8, 5, 90141);וילכדו;2;(7, 1, 8, 23, 345118);וילחמו בני יהודה בירושלם וילכדו אותה ויכוה לפי חרב ואת העיר שלחו באש
(82959, -18, 5);[10, 8, 10, 300, 40];משיחי;21887;(2, 4, 20, 7, 21887);וירכבם;2;(2, 4, 20, 22, 82959);ויקח משה את אשתו ואת בניו וירכבם על החמר וישב ארצה מצרים ויקח משה את מטה האלהים בידו
(524179, -18, 5);[10, 8, 10, 300, 40];משיחי;136437;(10, 21, 21, 9, 136437);משתין;4;(10, 21, 21, 40, 524179);הנני מבי אליך רעה ובערתי אחריך והכרתי לאחאב משתין בקיר ועצור ועזוב בישראל
(794530, -18, 5);[10, 8, 10, 300, 40];משיחי;205292;(14, 44, 19, 7, 205292);החיצונה;3;(14, 44, 19, 28, 794530);ובצאתם אל החצר החיצונה אל החצר החיצונה אל העם יפשטו את בגדיהם אשר המה משרתם בם והניחו אותם בלשכת הקדש ולבשו בגדים אחרים ולא יקדשו את העם בבגדיהם
(177926, -16, 5);[10, 8, 10, 300, 40];משיחי;47097;(3, 23, 34, 16, 47097);ליהוה;2;(3, 23, 34, 58, 177926);דבר אל בני ישראל לאמר בחמשה עשר יום לחדש השביעי הזה חג הסכות שבעת ימים ליהוה
(829233, -16, 5);[10, 8, 10, 300, 40];משיחי;214056;(20, 4, 1, 6, 214056);בית;2;(20, 4, 1, 23, 829233);והיה באחרית הימים יהיה הר בית יהוה נכון בראש ההרים ונשא הוא מגבעות ונהרו עליו עמים
