(1030468, 41, 4);[8, 10, 300, 40];משיח;265334;(34, 7, 4, 12, 265334);החרשתי;2;(34, 7, 4, 56, 1030468);כי נמכרנו אני ועמי להשמיד להרוג ולאבד ואלו לעבדים ולשפחות נמכרנו החרשתי כי אין הצר שוה בנזק המלך
(1093498, 41, 4);[8, 10, 300, 40];משיח;280524;(37, 12, 12, 10, 280524);חנניה;1;(37, 12, 12, 44, 1093498);ובימי יויקים היו כהנים ראשי האבות לשריה מריה לירמיה חנניה
(1103813, 41, 4);[8, 10, 300, 40];משיח;282980;(38, 4, 41, 22, 282980);תחתיהם;2;(38, 4, 41, 95, 1103813);ויבאו אלה הכתובים בשמות בימי יחזקיהו מלך יהודה ויכו את אהליהם ואת המעינים אשר נמצאו שמה ויחרימם עד היום הזה וישבו תחתיהם כי מרעה לצאנם שם
(1115573, 41, 4);[8, 10, 300, 40];משיח;285831;(38, 11, 22, 6, 285831);חיל;1;(38, 11, 22, 18, 1115573);בניה בן יהוידע בן איש חיל רב פעלים מן קבצאל הוא הכה את שני אריאל מואב והוא ירד והכה את הארי בתוך הבור ביום השלג
(1119397, 41, 4);[8, 10, 300, 40];משיח;286745;(38, 14, 1, 10, 286745);וחרשי;2;(38, 14, 1, 37, 1119397);וישלח חירם מלך צר מלאכים אל דויד ועצי ארזים וחרשי קיר וחרשי עצים לבנות לו בית
(1146656, 41, 4);[8, 10, 300, 40];משיח;293276;(39, 4, 22, 7, 293276);ופתח;4;(39, 4, 22, 40, 1146656);והמזמרות והמזרקות והכפות והמחתות זהב סגור ופתח הבית דלתותיו הפנימיות לקדש הקדשים ודלתי הבית להיכל זהב
(133412, 42, 4);[8, 10, 300, 40];משיח;35216;(2, 36, 12, 1, 35216);חמשים;1;(2, 36, 12, 1, 133412);חמשים ללאת עשה ביריעה האחת וחמשים ללאת עשה בקצה היריעה אשר במחברת השנית מקבילת הללאת אחת אל אחת
(173747, 42, 4);[8, 10, 300, 40];משיח;45983;(3, 21, 7, 3, 45983);וחללה;2;(3, 21, 7, 8, 173747);אשה זנה וחללה לא יקחו ואשה גרושה מאישה לא יקחו כי קדש הוא לאלהיו
(194814, 42, 4);[8, 10, 300, 40];משיח;51360;(4, 4, 41, 3, 51360);משפחת;4;(4, 4, 41, 12, 194814);אלה פקודי משפחת בני גרשון כל העבד באהל מועד אשר פקד משה ואהרן על פי יהוה
(200095, 42, 4);[8, 10, 300, 40];משיח;52762;(4, 7, 40, 4, 52762);לחטאת;2;(4, 7, 40, 13, 200095);שעיר עזים אחד לחטאת
(315483, 42, 4);[8, 10, 300, 40];משיח;82709;(6, 8, 4, 8, 82709);מאחרי;3;(6, 8, 4, 29, 315483);ויצו אתם לאמר ראו אתם ארבים לעיר מאחרי העיר אל תרחיקו מן העיר מאד והייתם כלכם נכנים
(326875, 42, 4);[8, 10, 300, 40];משיח;85607;(6, 14, 5, 10, 85607);ויחלקו;3;(6, 14, 5, 32, 326875);כאשר צוה יהוה את משה כן עשו בני ישראל ויחלקו את הארץ
(629657, 42, 4);[8, 10, 300, 40];משיח;163354;(12, 53, 8, 11, 163354);חיים;1;(12, 53, 8, 38, 629657);מעצר וממשפט לקח ואת דורו מי ישוחח כי נגזר מארץ חיים מפשע עמי נגע למו
(814613, 42, 4);[8, 10, 300, 40];משיח;210330;(16, 4, 14, 4, 210330);החרוץ;2;(16, 4, 14, 18, 814613);המונים המונים בעמק החרוץ כי קרוב יום יהוה בעמק החרוץ
(958736, 42, 4);[8, 10, 300, 40];משיח;246606;(28, 26, 6, 3, 246606);חמס;1;(28, 26, 6, 10, 958736);מקצה רגלים חמס שתה שלח דברים ביד כסיל
(960277, 42, 4);[8, 10, 300, 40];משיח;247009;(28, 28, 3, 8, 247009);לחם;2;(28, 28, 3, 25, 960277);גבר רש ועשק דלים מטר סחף ואין לחם
(65220, 43, 4);[8, 10, 300, 40];משיח;17304;(1, 43, 5, 3, 17304);משלח;4;(1, 43, 5, 11, 65220);ואם אינך משלח לא נרד כי האיש אמר אלינו לא תראו פני בלתי אחיכם אתכם
(100714, 43, 4);[8, 10, 300, 40];משיח;26556;(2, 15, 20, 14, 26556);ובמחלת;4;(2, 15, 20, 57, 100714);ותקח מרים הנביאה אחות אהרן את התף בידה ותצאן כל הנשים אחריה בתפים ובמחלת
(199369, 43, 4);[8, 10, 300, 40];משיח;52572;(4, 7, 23, 8, 52572);חמשה;1;(4, 7, 23, 32, 199369);ולזבח השלמים בקר שנים אילם חמשה עתדים חמשה כבשים בני שנה חמשה זה קרבן נתנאל בן צוער
(345963, 43, 4);[8, 10, 300, 40];משיח;90377;(7, 1, 26, 4, 90377);החתים;2;(7, 1, 26, 13, 345963);וילך האיש ארץ החתים ויבן עיר ויקרא שמה לוז הוא שמה עד היום הזה
(474037, 43, 4);[8, 10, 300, 40];משיח;123408;(9, 23, 9, 11, 123408);בחרפם;2;(9, 23, 9, 38, 474037);ואחרו אלעזר בן דדי בן אחחי בשלשה גברים עם דוד בחרפם בפלשתים נאספו שם למלחמה ויעלו איש ישראל
(477514, 43, 4);[8, 10, 300, 40];משיח;124308;(10, 1, 9, 8, 124308);הזחלת;3;(10, 1, 9, 31, 477514);ויזבח אדניהו צאן ובקר ומריא עם אבן הזחלת אשר אצל עין רגל ויקרא את כל אחיו בני המלך ולכל אנשי יהודה עבדי המלך
(487840, 43, 4);[8, 10, 300, 40];משיח;127035;(10, 6, 3, 15, 127035);רחבו;2;(10, 6, 3, 52, 487840);והאולם על פני היכל הבית עשרים אמה ארכו על פני רחב הבית עשר באמה רחבו על פני הבית
(517880, 43, 4);[8, 10, 300, 40];משיח;134799;(10, 18, 38, 17, 134799);לחכה;2;(10, 18, 38, 62, 517880);ותפל אש יהוה ותאכל את העלה ואת העצים ואת האבנים ואת העפר ואת המים אשר בתעלה לחכה
(585431, 43, 4);[8, 10, 300, 40];משיח;152115;(12, 10, 7, 8, 152115);יחשב;2;(12, 10, 7, 23, 585431);והוא לא כן ידמה ולבבו לא כן יחשב כי להשמיד בלבבו ולהכרית גוים לא מעט
(638042, 43, 4);[8, 10, 300, 40];משיח;165446;(12, 63, 3, 11, 165446);בחמתי;2;(12, 63, 3, 46, 638042);פורה דרכתי לבדי ומעמים אין איש אתי ואדרכם באפי וארמסם בחמתי ויז נצחם על בגדי וכל מלבושי אגאלתי
(790865, 43, 4);[8, 10, 300, 40];משיח;204358;(14, 42, 11, 14, 204358);וכפתחיהן;5;(14, 42, 11, 67, 790865);ודרך לפניהם כמראה הלשכות אשר דרך הצפון כארכן כן רחבן וכל מוצאיהן וכמשפטיהן וכפתחיהן
(792855, 43, 4);[8, 10, 300, 40];משיח;204852;(14, 43, 23, 2, 204852);מחטא;2;(14, 43, 23, 8, 792855);בכלותך מחטא תקריב פר בן בקר תמים ואיל מן הצאן תמים
(828955, 43, 4);[8, 10, 300, 40];משיח;213972;(20, 3, 11, 5, 213972);במחיר;3;(20, 3, 11, 23, 828955);ראשיה בשחד ישפטו וכהניה במחיר יורו ונביאיה בכסף יקסמו ועל יהוה ישענו לאמר הלוא יהוה בקרבנו לא תבוא עלינו רעה
(887609, 43, 4);[8, 10, 300, 40];משיח;228755;(27, 58, 10, 8, 228755);חרון;1;(27, 58, 10, 27, 887609);בטרם יבינו סירתכם אטד כמו חי כמו חרון ישערנו
(930480, 43, 4);[8, 10, 300, 40];משיח;239323;(27, 135, 12, 3, 239323);נחלה;2;(27, 135, 12, 10, 930480);ונתן ארצם נחלה נחלה לישראל עמו
(968381, 43, 4);[8, 10, 300, 40];משיח;249125;(29, 6, 10, 7, 249125);יחמול;2;(29, 6, 10, 27, 968381);ותהי עוד נחמתי ואסלדה בחילה לא יחמול כי לא כחדתי אמרי קדוש
(1007709, 43, 4);[8, 10, 300, 40];משיח;259336;(32, 2, 9, 6, 259336);בריחיה;4;(32, 2, 9, 24, 1007709);טבעו בארץ שעריה אבד ושבר בריחיה מלכה ושריה בגוים אין תורה גם נביאיה לא מצאו חזון מיהוה
(1054407, 43, 4);[8, 10, 300, 40];משיח;271168;(35, 9, 26, 20, 271168);נחרצת;2;(35, 9, 26, 78, 1054407);ואחרי השבעים ששים ושנים יכרת משיח ואין לו והעיר והקדש ישחית עם נגיד הבא וקצו בשטף ועד קץ מלחמה נחרצת שממות
(181933, 44, 4);[8, 10, 300, 40];משיח;48144;(3, 25, 48, 7, 48144);מאחיו;3;(3, 25, 48, 24, 181933);אחרי נמכר גאלה תהיה לו אחד מאחיו יגאלנו
(217936, 44, 4);[8, 10, 300, 40];משיח;57444;(4, 17, 15, 6, 57444);פתח;3;(4, 17, 15, 18, 217936);וישב אהרן אל משה אל פתח אהל מועד והמגפה נעצרה
(250584, 44, 4);[8, 10, 300, 40];משיח;65858;(5, 1, 13, 4, 65858);חכמים;1;(5, 1, 13, 12, 250584);הבו לכם אנשים חכמים ונבנים וידעים לשבטיכם ואשימם בראשיכם
(429654, 44, 4);[8, 10, 300, 40];משיח;111824;(8, 28, 1, 7, 111824);מחניהם;2;(8, 28, 1, 28, 429654);ויהי בימים ההם ויקבצו פלשתים את מחניהם לצבא להלחם בישראל ויאמר אכיש אל דוד ידע תדע כי אתי תצא במחנה אתה ואנשיך
(437610, 44, 4);[8, 10, 300, 40];משיח;113868;(9, 2, 22, 18, 113868);אחיך;2;(9, 2, 22, 61, 437610);ויסף עוד אבנר לאמר אל עשהאל סור לך מאחרי למה אככה ארצה ואיך אשא פני אל יואב אחיך
(448345, 44, 4);[8, 10, 300, 40];משיח;116666;(9, 10, 4, 1, 116666);ויקח;4;(9, 10, 4, 4, 448345);ויקח חנון את עבדי דוד ויגלח את חצי זקנם ויכרת את מדויהם בחצי עד שתותיהם וישלחם
(552871, 44, 4);[8, 10, 300, 40];משיח;143814;(11, 14, 17, 7, 143814);אחרי;2;(11, 14, 17, 26, 552871);ויחי אמציהו בן יואש מלך יהודה אחרי מות יהואש בן יהואחז מלך ישראל חמש עשרה שנה
(613466, 44, 4);[8, 10, 300, 40];משיח;159280;(12, 38, 16, 8, 159280);ותחלימני;3;(12, 38, 16, 30, 613466);אדני עליהם יחיו ולכל בהן חיי רוחי ותחלימני והחיני
(875015, 44, 4);[8, 10, 300, 40];משיח;225597;(27, 35, 16, 4, 225597);חרק;1;(27, 35, 16, 14, 875015);בחנפי לעגי מעוג חרק עלי שנימו
(932098, 44, 4);[8, 10, 300, 40];משיח;239738;(27, 139, 3, 1, 239738);ארחי;3;(27, 139, 3, 3, 932098);ארחי ורבעי זרית וכל דרכי הסכנתה
(1030133, 44, 4);[8, 10, 300, 40];משיח;265252;(34, 6, 13, 21, 265252);החלות;2;(34, 6, 13, 80, 1030133);ויספר המן לזרש אשתו ולכל אהביו את כל אשר קרהו ויאמרו לו חכמיו וזרש אשתו אם מזרע היהודים מרדכי אשר החלות לנפל לפניו לא תוכל לו כי נפול תפול לפניו
(1050047, 44, 4);[8, 10, 300, 40];משיח;270129;(35, 7, 14, 21, 270129);תתחבל;3;(35, 7, 14, 79, 1050047);ולה יהב שלטן ויקר ומלכו וכל עממיא אמיא ולשניא לה יפלחון שלטנה שלטן עלם די לא יעדה ומלכותה די לא תתחבל
(1174504, 44, 4);[8, 10, 300, 40];משיח;300168;(39, 24, 17, 7, 300168);וישתחוו;5;(39, 24, 17, 30, 1174504);ואחרי מות יהוידע באו שרי יהודה וישתחוו למלך אז שמע המלך אליהם
(105610, 45, 4);[8, 10, 300, 40];משיח;27878;(2, 19, 1, 1, 27878);בחדש;2;(2, 19, 1, 2, 105610);בחדש השלישי לצאת בני ישראל מארץ מצרים ביום הזה באו מדבר סיני
(312247, 45, 4);[8, 10, 300, 40];משיח;81875;(6, 6, 13, 19, 81875);אחרי;2;(6, 6, 13, 91, 312247);ושבעה הכהנים נשאים שבעה שופרות היבלים לפני ארון יהוה הלכים הלוך ותקעו בשופרות והחלוץ הלך לפניהם והמאסף הלך אחרי ארון יהוה הולך ותקוע בשופרות
(334242, 45, 4);[8, 10, 300, 40];משיח;87428;(6, 19, 23, 2, 87428);נחלת;2;(6, 19, 23, 5, 334242);זאת נחלת מטה בני יששכר למשפחתם הערים וחצריהן
(496920, 45, 4);[8, 10, 300, 40];משיח;129323;(10, 8, 63, 4, 129323);זבח;3;(10, 8, 63, 14, 496920);ויזבח שלמה את זבח השלמים אשר זבח ליהוה בקר עשרים ושנים אלף וצאן מאה ועשרים אלף ויחנכו את בית יהוה המלך וכל בני ישראל
(559847, 45, 4);[8, 10, 300, 40];משיח;145601;(11, 17, 38, 6, 145601);תשכחו;4;(11, 17, 38, 23, 559847);והברית אשר כרתי אתכם לא תשכחו ולא תיראו אלהים אחרים
(577848, 45, 4);[8, 10, 300, 40];משיח;150187;(12, 2, 20, 15, 150187);לחפר;2;(12, 2, 20, 57, 577848);ביום ההוא ישליך האדם את אלילי כספו ואת אלילי זהבו אשר עשו לו להשתחות לחפר פרות ולעטלפים
(632230, 45, 4);[8, 10, 300, 40];משיח;164004;(12, 56, 12, 9, 164004);מחר;2;(12, 56, 12, 32, 632230);אתיו אקחה יין ונסבאה שכר והיה כזה יום מחר גדול יתר מאד
(682403, 45, 4);[8, 10, 300, 40];משיח;176862;(13, 27, 20, 18, 176862);חרי;1;(13, 27, 20, 72, 682403);אשר לא לקחם נבוכדנאצר מלך בבל בגלותו את יכוניה בן יהויקים מלך יהודה מירושלם בבלה ואת כל חרי יהודה וירושלם
(731451, 45, 4);[8, 10, 300, 40];משיח;189439;(14, 4, 9, 2, 189439);קח;2;(14, 4, 9, 6, 731451);ואתה קח לך חטין ושערים ופול ועדשים ודחן וכסמים ונתתה אותם בכלי אחד ועשית אותם לך ללחם מספר הימים אשר אתה שוכב על צדך שלש מאות ותשעים יום תאכלנו
(760791, 45, 4);[8, 10, 300, 40];משיח;196834;(14, 23, 40, 6, 196834);ממרחק;4;(14, 23, 40, 25, 760791);ואף כי תשלחנה לאנשים באים ממרחק אשר מלאך שלוח אליהם והנה באו לאשר רחצת כחלת עיניך ועדית עדי
(778411, 45, 4);[8, 10, 300, 40];משיח;201286;(14, 35, 15, 1, 201286);כשמחתך;4;(14, 35, 15, 4, 778411);כשמחתך לנחלת בית ישראל על אשר שממה כן אעשה לך שממה תהיה הר שעיר וכל אדום כלה וידעו כי אני יהוה
(818354, 45, 4);[8, 10, 300, 40];משיח;211257;(17, 4, 13, 6, 211257);רוח;3;(17, 4, 13, 20, 818354);כי הנה יוצר הרים וברא רוח ומגיד לאדם מה שחו עשה שחר עיפה ודרך על במתי ארץ יהוה אלהי צבאות שמו
(942238, 45, 4);[8, 10, 300, 40];משיח;242272;(28, 6, 33, 4, 242272);וחרפתו;2;(28, 6, 33, 14, 942238);נגע וקלון ימצא וחרפתו לא תמחה
(67112, 46, 4);[8, 10, 300, 40];משיח;17767;(1, 44, 2, 7, 17767);אמתחת;4;(1, 44, 2, 27, 67112);ואת גביעי גביע הכסף תשים בפי אמתחת הקטן ואת כסף שברו ויעש כדבר יוסף אשר דבר
(87652, 46, 4);[8, 10, 300, 40];משיח;23112;(2, 7, 24, 1, 23112);ויחפרו;3;(2, 7, 24, 3, 87652);ויחפרו כל מצרים סביבת היאר מים לשתות כי לא יכלו לשתת ממימי היאר
(109130, 46, 4);[8, 10, 300, 40];משיח;28847;(2, 21, 26, 11, 28847);ושחתה;3;(2, 21, 26, 32, 109130);וכי יכה איש את עין עבדו או את עין אמתו ושחתה לחפשי ישלחנו תחת עינו
(148139, 46, 4);[8, 10, 300, 40];משיח;39088;(3, 6, 6, 5, 39088);המזבח;5;(3, 6, 6, 17, 148139);אש תמיד תוקד על המזבח לא תכבה
(235240, 46, 4);[8, 10, 300, 40];משיח;61976;(4, 28, 2, 12, 61976);ניחחי;3;(4, 28, 2, 42, 235240);צו את בני ישראל ואמרת אלהם את קרבני לחמי לאשי ריח ניחחי תשמרו להקריב לי במועדו
(524854, 46, 4);[8, 10, 300, 40];משיח;136602;(10, 22, 6, 17, 136602);אחדל;2;(10, 22, 6, 66, 524854);ויקבץ מלך ישראל את הנביאים כארבע מאות איש ויאמר אלהם האלך על רמת גלעד למלחמה אם אחדל ויאמרו עלה ויתן אדני ביד המלך
(774129, 46, 4);[8, 10, 300, 40];משיח;200185;(14, 33, 4, 9, 200185);חרב;1;(14, 33, 4, 31, 774129);ושמע השמע את קול השופר ולא נזהר ותבוא חרב ותקחהו דמו בראשו יהיה
(876875, 46, 4);[8, 10, 300, 40];משיח;226058;(27, 37, 35, 5, 226058);כאזרח;5;(27, 37, 35, 23, 876875);ראיתי רשע עריץ ומתערה כאזרח רענן
(890393, 46, 4);[8, 10, 300, 40];משיח;229453;(27, 65, 7, 3, 229453);בכחו;3;(27, 65, 7, 11, 890393);מכין הרים בכחו נאזר בגבורה
(1078775, 46, 4);[8, 10, 300, 40];משיח;277046;(37, 3, 27, 11, 277046);חומת;1;(37, 3, 27, 47, 1078775);אחריו החזיקו התקעים מדה שנית מנגד המגדל הגדול היוצא ועד חומת העפל
(1078819, 46, 4);[8, 10, 300, 40];משיח;277056;(37, 3, 29, 1, 277056);אחריו;2;(37, 3, 29, 2, 1078819);אחריו החזיק צדוק בן אמר נגד ביתו ואחריו החזיק שמעיה בן שכניה שמר שער המזרח
(1110363, 46, 4);[8, 10, 300, 40];משיח;284570;(38, 8, 8, 6, 284570);שלחו;3;(38, 8, 8, 24, 1110363);ושחרים הוליד בשדה מואב מן שלחו אתם חושים ואת בערא נשיו
(1182365, 46, 4);[8, 10, 300, 40];משיח;302076;(39, 29, 19, 7, 302076);אחז;2;(39, 29, 19, 24, 1182365);ואת כל הכלים אשר הזניח המלך אחז במלכותו במעלו הכנו והקדשנו והנם לפני מזבח יהוה
(68932, 47, 4);[8, 10, 300, 40];משיח;18246;(1, 45, 4, 4, 18246);אחיו;2;(1, 45, 4, 13, 68932);ויאמר יוסף אל אחיו גשו נא אלי ויגשו ויאמר אני יוסף אחיכם אשר מכרתם אתי מצרימה
(133630, 47, 4);[8, 10, 300, 40];משיח;35268;(2, 36, 15, 10, 35268);האחת;3;(2, 36, 15, 43, 133630);ארך היריעה האחת שלשים באמה וארבע אמות רחב היריעה האחת מדה אחת לעשתי עשרה יריעת
(151826, 47, 4);[8, 10, 300, 40];משיח;40058;(3, 8, 20, 10, 40058);הנתחים;4;(3, 8, 20, 37, 151826);ואת האיל נתח לנתחיו ויקטר משה את הראש ואת הנתחים ואת הפדר
(238349, 47, 4);[8, 10, 300, 40];משיח;62710;(4, 29, 38, 2, 62710);חטאת;1;(4, 29, 38, 6, 238349);ושעיר חטאת אחד מלבד עלת התמיד ומנחתה ונסכה
(300356, 47, 4);[8, 10, 300, 40];משיח;78818;(5, 31, 29, 7, 78818);תשחתון;3;(5, 31, 29, 24, 300356);כי ידעתי אחרי מותי כי השחת תשחתון וסרתם מן הדרך אשר צויתי אתכם וקראת אתכם הרעה באחרית הימים כי תעשו את הרע בעיני יהוה להכעיסו במעשה ידיכם
(948060, 47, 4);[8, 10, 300, 40];משיח;243765;(28, 14, 8, 1, 243765);חכמת;1;(28, 14, 8, 1, 948060);חכמת ערום הבין דרכו ואולת כסילים מרמה
(1005842, 47, 4);[8, 10, 300, 40];משיח;258842;(32, 1, 2, 6, 258842);לחיה;2;(32, 1, 2, 22, 1005842);בכו תבכה בלילה ודמעתה על לחיה אין לה מנחם מכל אהביה כל רעיה בגדו בה היו לה לאיבים
(1152120, 47, 4);[8, 10, 300, 40];משיח;294656;(39, 7, 22, 15, 294656);אחרים;2;(39, 7, 22, 63, 1152120);ואמרו על אשר עזבו את יהוה אלהי אבתיהם אשר הוציאם מארץ מצרים ויחזיקו באלהים אחרים וישתחוו להם ויעבדום על כן הביא עליהם את כל הרעה הזאת
(1177069, 47, 4);[8, 10, 300, 40];משיח;300800;(39, 25, 25, 7, 300800);אחרי;2;(39, 25, 25, 26, 1177069);ויחי אמציהו בן יואש מלך יהודה אחרי מות יואש בן יהואחז מלך ישראל חמש עשרה שנה
(31302, 48, 4);[8, 10, 300, 40];משיח;8360;(1, 24, 38, 8, 8360);משפחתי;4;(1, 24, 38, 22, 31302);אם לא אל בית אבי תלך ואל משפחתי ולקחת אשה לבני
(57908, 48, 4);[8, 10, 300, 40];משיח;15396;(1, 39, 7, 2, 15396);אחר;2;(1, 39, 7, 6, 57908);ויהי אחר הדברים האלה ותשא אשת אדניו את עיניה אל יוסף ותאמר שכבה עמי
(109595, 48, 4);[8, 10, 300, 40];משיח;28983;(2, 21, 36, 5, 28983);נגח;3;(2, 21, 36, 14, 109595);או נודע כי שור נגח הוא מתמול שלשם ולא ישמרנו בעליו שלם ישלם שור תחת השור והמת יהיה לו
(135669, 48, 4);[8, 10, 300, 40];משיח;35778;(2, 37, 19, 12, 35778);אחד;2;(2, 37, 19, 53, 135669);שלשה גבעים משקדים בקנה האחד כפתר ופרח ושלשה גבעים משקדים בקנה אחד כפתר ופרח כן לששת הקנים היצאים מן המנרה
(176060, 48, 4);[8, 10, 300, 40];משיח;46636;(3, 22, 32, 2, 46636);תחללו;2;(3, 22, 32, 5, 176060);ולא תחללו את שם קדשי ונקדשתי בתוך בני ישראל אני יהוה מקדשכם
(236514, 48, 4);[8, 10, 300, 40];משיח;62287;(4, 28, 28, 12, 62287);האחד;3;(4, 28, 28, 51, 236514);ומנחתם סלת בלולה בשמן שלשה עשרנים לפר האחד שני עשרנים לאיל האחד
(286222, 48, 4);[8, 10, 300, 40];משיח;75157;(5, 23, 15, 12, 75157);מחניך;2;(5, 23, 15, 50, 286222);כי יהוה אלהיך מתהלך בקרב מחנך להצילך ולתת איביך לפניך והיה מחניך קדוש ולא יראה בך ערות דבר ושב מאחריך
(536137, 48, 4);[8, 10, 300, 40];משיח;139522;(11, 5, 17, 17, 139522);וזבח;4;(11, 5, 17, 60, 536137);ויאמר נעמן ולא יתן נא לעבדך משא צמד פרדים אדמה כי לוא יעשה עוד עבדך עלה וזבח לאלהים אחרים כי אם ליהוה
(538028, 48, 4);[8, 10, 300, 40];משיח;140001;(11, 6, 20, 12, 140001);ויפקח;5;(11, 6, 20, 49, 538028);ויהי כבאם שמרון ויאמר אלישע יהוה פקח את עיני אלה ויראו ויפקח יהוה את עיניהם ויראו והנה בתוך שמרון
(557432, 48, 4);[8, 10, 300, 40];משיח;145003;(11, 17, 4, 7, 145003);שלח;3;(11, 17, 4, 26, 557432);וימצא מלך אשור בהושע קשר אשר שלח מלאכים אל סוא מלך מצרים ולא העלה מנחה למלך אשור כשנה בשנה ויעצרהו מלך אשור ויאסרהו בית כלא
(886170, 48, 4);[8, 10, 300, 40];משיח;228385;(27, 55, 18, 4, 228385);אשיחה;4;(27, 55, 18, 17, 886170);ערב ובקר וצהרים אשיחה ואהמה וישמע קולי
(899800, 48, 4);[8, 10, 300, 40];משיח;231756;(27, 78, 39, 5, 231756);רוח;3;(27, 78, 39, 16, 899800);ויזכר כי בשר המה רוח הולך ולא ישוב
(1024463, 48, 4);[8, 10, 300, 40];משיח;263784;(34, 2, 4, 7, 263784);תחת;2;(34, 2, 4, 28, 1024463);והנערה אשר תיטב בעיני המלך תמלך תחת ושתי וייטב הדבר בעיני המלך ויעש כן
(1094484, 48, 4);[8, 10, 300, 40];משיח;280735;(37, 12, 36, 9, 280735);חנני;1;(37, 12, 36, 39, 1094484);ואחיו שמעיה ועזראל מללי גללי מעי נתנאל ויהודה חנני בכלי שיר דויד איש האלהים ועזרא הסופר לפניהם
(2540, 49, 4);[8, 10, 300, 40];משיח;665;(1, 2, 19, 7, 665);חית;1;(1, 2, 19, 23, 2540);ויצר יהוה אלהים מן האדמה כל חית השדה ואת כל עוף השמים ויבא אל האדם לראות מה יקרא לו וכל אשר יקרא לו האדם נפש חיה הוא שמו
(109257, 49, 4);[8, 10, 300, 40];משיח;28884;(2, 21, 29, 3, 28884);נגח;3;(2, 21, 29, 9, 109257);ואם שור נגח הוא מתמל שלשם והועד בבעליו ולא ישמרנו והמית איש או אשה השור יסקל וגם בעליו יומת
(200883, 49, 4);[8, 10, 300, 40];משיח;52966;(4, 7, 59, 6, 52966);חמשה;1;(4, 7, 59, 23, 200883);ולזבח השלמים בקר שנים אילם חמשה עתדים חמשה כבשים בני שנה חמשה זה קרבן גמליאל בן פדהצור
(480607, 49, 4);[8, 10, 300, 40];משיח;125110;(10, 2, 6, 2, 125110);כחכמתך;2;(10, 2, 6, 7, 480607);ועשית כחכמתך ולא תורד שיבתו בשלם שאל
(723527, 49, 4);[8, 10, 300, 40];משיח;187418;(13, 51, 39, 1, 187418);בחמם;2;(13, 51, 39, 2, 723527);בחמם אשית את משתיהם והשכרתים למען יעלזו וישנו שנת עולם ולא יקיצו נאם יהוה
(796036, 49, 4);[8, 10, 300, 40];משיח;205652;(14, 45, 14, 15, 205652);חמר;1;(14, 45, 14, 50, 796036);וחק השמן הבת השמן מעשר הבת מן הכר עשרת הבתים חמר כי עשרת הבתים חמר
(822094, 49, 4);[8, 10, 300, 40];משיח;212231;(17, 9, 1, 16, 212231);בחרב;2;(17, 9, 1, 66, 822094);ראיתי את אדני נצב על המזבח ויאמר הך הכפתור וירעשו הספים ובצעם בראש כלם ואחריתם בחרב אהרג לא ינוס להם נס ולא ימלט להם פליט
(969663, 49, 4);[8, 10, 300, 40];משיח;249466;(29, 8, 4, 5, 249466);וישלחם;5;(29, 8, 4, 17, 969663);אם בניך חטאו לו וישלחם ביד פשעם
(984234, 49, 4);[8, 10, 300, 40];משיח;253262;(29, 29, 18, 5, 253262);וכחול;3;(29, 29, 18, 16, 984234);ואמר עם קני אגוע וכחול ארבה ימים
(1050434, 49, 4);[8, 10, 300, 40];משיח;270224;(35, 7, 21, 1, 270224);חזה;1;(35, 7, 21, 1, 1050434);חזה הוית וקרנא דכן עבדה קרב עם קדישין ויכלה להן
