(66072, -33, 6);[8, 10, 300, 40, 5, 40];מהמשיח;17518;(1, 43, 18, 13, 17518);בתחלה;3;(1, 43, 18, 56, 66072);וייראו האנשים כי הובאו בית יוסף ויאמרו על דבר הכסף השב באמתחתינו בתחלה אנחנו מובאים להתגלל עלינו ולהתנפל עלינו ולקחת אתנו לעבדים ואת חמרינו
(3317, -20, 6);[8, 10, 300, 40, 5, 40];מהמשיח;870;(1, 3, 8, 8, 870);לרוח;4;(1, 3, 8, 32, 3317);וישמעו את קול יהוה אלהים מתהלך בגן לרוח היום ויתחבא האדם ואשתו מפני יהוה אלהים בתוך עץ הגן
(15061, -100, 5);[10, 8, 10, 300, 40];משיחי;4032;(1, 12, 18, 12, 4032);לי;2;(1, 12, 18, 41, 15061);ויקרא פרעה לאברם ויאמר מה זאת עשית לי למה לא הגדת לי כי אשתך הוא
(27217, -98, 5);[10, 8, 10, 300, 40];משיחי;7265;(1, 22, 4, 6, 7265);עיניו;2;(1, 22, 4, 23, 27217);ביום השלישי וישא אברהם את עיניו וירא את המקום מרחק
(5864, -92, 5);[10, 8, 10, 300, 40];משיחי;1569;(1, 5, 11, 3, 1569);ימי;1;(1, 5, 11, 8, 5864);ויהיו כל ימי אנוש חמש שנים ותשע מאות שנה וימת
(1082, -89, 5);[10, 8, 10, 300, 40];משיחי;275;(1, 1, 22, 9, 275);המים;3;(1, 1, 22, 34, 1082);ויברך אתם אלהים לאמר פרו ורבו ומלאו את המים בימים והעוף ירב בארץ
(65868, -81, 5);[10, 8, 10, 300, 40];משיחי;17469;(1, 43, 15, 13, 17469);וירדו;2;(1, 43, 15, 53, 65868);ויקחו האנשים את המנחה הזאת ומשנה כסף לקחו בידם ואת בנימן ויקמו וירדו מצרים ויעמדו לפני יוסף
(9476, -55, 5);[10, 8, 10, 300, 40];משיחי;2540;(1, 8, 8, 1, 2540);וישלח;2;(1, 8, 8, 2, 9476);וישלח את היונה מאתו לראות הקלו המים מעל פני האדמה
(54539, -54, 5);[10, 8, 10, 300, 40];משיחי;14521;(1, 37, 9, 10, 14521);חלמתי;5;(1, 37, 9, 41, 54539);ויחלם עוד חלום אחר ויספר אתו לאחיו ויאמר הנה חלמתי חלום עוד והנה השמש והירח ואחד עשר כוכבים משתחוים לי
(60631, -51, 5);[10, 8, 10, 300, 40];משיחי;16101;(1, 41, 12, 7, 16101);הטבחים;5;(1, 41, 12, 25, 60631);ושם אתנו נער עברי עבד לשר הטבחים ונספר לו ויפתר לנו את חלמתינו איש כחלמו פתר
(11650, -45, 5);[10, 8, 10, 300, 40];משיחי;3135;(1, 10, 3, 1, 3135);ובני;4;(1, 10, 3, 4, 11650);ובני גמר אשכנז וריפת ותגרמה
(51254, -44, 5);[10, 8, 10, 300, 40];משיחי;13658;(1, 35, 8, 11, 13658);ויקרא;2;(1, 35, 8, 42, 51254);ותמת דברה מינקת רבקה ותקבר מתחת לבית אל תחת האלון ויקרא שמו אלון בכות
(75790, -44, 5);[10, 8, 10, 300, 40];משיחי;20011;(1, 49, 14, 1, 20011);יששכר;1;(1, 49, 14, 1, 75790);יששכר חמר גרם רבץ בין המשפתים
(7871, -13, 5);[10, 8, 10, 300, 40];משיחי;2105;(1, 6, 21, 7, 2105);יאכל;1;(1, 6, 21, 19, 7871);ואתה קח לך מכל מאכל אשר יאכל ואספת אליך והיה לך ולהם לאכלה
(51254, -44, 7);[10, 8, 10, 300, 40, 400, 1];את משיחי;13658;(1, 35, 8, 11, 13658);ויקרא;2;(1, 35, 8, 42, 51254);ותמת דברה מינקת רבקה ותקבר מתחת לבית אל תחת האלון ויקרא שמו אלון בכות
(1082, -89, 6);[10, 8, 10, 300, 40, 30];למשיחי;275;(1, 1, 22, 9, 275);המים;3;(1, 1, 22, 34, 1082);ויברך אתם אלהים לאמר פרו ורבו ומלאו את המים בימים והעוף ירב בארץ
(54539, -54, 6);[10, 8, 10, 300, 40, 30];למשיחי;14521;(1, 37, 9, 10, 14521);חלמתי;5;(1, 37, 9, 41, 54539);ויחלם עוד חלום אחר ויספר אתו לאחיו ויאמר הנה חלמתי חלום עוד והנה השמש והירח ואחד עשר כוכבים משתחוים לי
(11650, -45, 6);[10, 8, 10, 300, 40, 30];למשיחי;3135;(1, 10, 3, 1, 3135);ובני;4;(1, 10, 3, 4, 11650);ובני גמר אשכנז וריפת ותגרמה
(50485, -23, 5);[20, 8, 10, 300, 40];משיחך;13455;(1, 34, 26, 4, 13455);שכם;2;(1, 34, 26, 12, 50485);ואת חמור ואת שכם בנו הרגו לפי חרב ויקחו את דינה מבית שכם ויצאו
(48564, -12, 5);[20, 8, 10, 300, 40];משיחך;12934;(1, 33, 8, 4, 12934);כל;1;(1, 33, 8, 10, 48564);ויאמר מי לך כל המחנה הזה אשר פגשתי ויאמר למצא חן בעיני אדני
(13583, -75, 5);[6, 8, 10, 300, 40];משיחו;3640;(1, 11, 21, 1, 3640);ויחי;1;(1, 11, 21, 1, 13583);ויחי רעו אחרי הולידו את שרוג שבע שנים ומאתים שנה ויולד בנים ובנות
(12560, -71, 5);[6, 8, 10, 300, 40];משיחו;3369;(1, 10, 29, 5, 3369);ואת;1;(1, 10, 29, 16, 12560);ואת אופר ואת חוילה ואת יובב כל אלה בני יקטן
(33778, -67, 5);[6, 8, 10, 300, 40];משיחו;8997;(1, 25, 21, 5, 8997);אשתו;4;(1, 25, 21, 22, 33778);ויעתר יצחק ליהוה לנכח אשתו כי עקרה הוא ויעתר לו יהוה ותהר רבקה אשתו
(67228, -60, 5);[6, 8, 10, 300, 40];משיחו;17798;(1, 44, 4, 16, 17798);והשגתם;1;(1, 44, 4, 55, 67228);הם יצאו את העיר לא הרחיקו ויוסף אמר לאשר על ביתו קום רדף אחרי האנשים והשגתם ואמרת אלהם למה שלמתם רעה תחת טובה
(75260, -60, 5);[6, 8, 10, 300, 40];משיחו;19876;(1, 49, 1, 7, 19876);ואגידה;1;(1, 49, 1, 26, 75260);ויקרא יעקב אל בניו ויאמר האספו ואגידה לכם את אשר יקרא אתכם באחרית הימים
(77805, -40, 5);[6, 8, 10, 300, 40];משיחו;20546;(1, 50, 22, 6, 20546);אביו;4;(1, 50, 22, 25, 77805);וישב יוסף במצרים הוא ובית אביו ויחי יוסף מאה ועשר שנים
(39743, -32, 5);[6, 8, 10, 300, 40];משיחו;10570;(1, 28, 21, 6, 10570);והיה;1;(1, 28, 21, 19, 39743);ושבתי בשלום אל בית אבי והיה יהוה לי לאלהים
(27144, -13, 5);[6, 8, 10, 300, 40];משיחו;7245;(1, 22, 3, 11, 7245);אתו;3;(1, 22, 3, 42, 27144);וישכם אברהם בבקר ויחבש את חמרו ויקח את שני נעריו אתו ואת יצחק בנו ויבקע עצי עלה ויקם וילך אל המקום אשר אמר לו האלהים
(7435, -9, 5);[6, 8, 10, 300, 40];משיחו;1989;(1, 6, 13, 14, 1989);והנני;1;(1, 6, 13, 46, 7435);ויאמר אלהים לנח קץ כל בשר בא לפני כי מלאה הארץ חמס מפניהם והנני משחיתם את הארץ
(61544, -5, 5);[6, 8, 10, 300, 40];משיחו;16334;(1, 41, 30, 6, 16334);ונשכח;1;(1, 41, 30, 20, 61544);וקמו שבע שני רעב אחריהן ונשכח כל השבע בארץ מצרים וכלה הרעב את הארץ
(46874, -2, 5);[6, 8, 10, 300, 40];משיחו;12493;(1, 32, 8, 17, 12493);מחנות;4;(1, 32, 8, 62, 46874);ויירא יעקב מאד ויצר לו ויחץ את העם אשר אתו ואת הצאן ואת הבקר והגמלים לשני מחנות
(27144, -13, 6);[6, 8, 10, 300, 40, 30];למשיחו;7245;(1, 22, 3, 11, 7245);אתו;3;(1, 22, 3, 42, 27144);וישכם אברהם בבקר ויחבש את חמרו ויקח את שני נעריו אתו ואת יצחק בנו ויבקע עצי עלה ויקם וילך אל המקום אשר אמר לו האלהים
(46874, -2, 6);[6, 8, 10, 300, 40, 30];למשיחו;12493;(1, 32, 8, 17, 12493);מחנות;4;(1, 32, 8, 62, 46874);ויירא יעקב מאד ויצר לו ויחץ את העם אשר אתו ואת הצאן ואת הבקר והגמלים לשני מחנות
(6266, -76, 5);[5, 8, 10, 300, 40];משיחה;1670;(1, 5, 20, 7, 1670);שנה;3;(1, 5, 20, 25, 6266);ויהיו כל ימי ירד שתים וששים שנה ותשע מאות שנה וימת
(22616, -75, 5);[5, 8, 10, 300, 40];משיחה;6027;(1, 19, 8, 20, 6027);האל;1;(1, 19, 8, 70, 22616);הנה נא לי שתי בנות אשר לא ידעו איש אוציאה נא אתהן אליכם ועשו להן כטוב בעיניכם רק לאנשים האל אל תעשו דבר כי על כן באו בצל קרתי
(13323, -10, 5);[5, 8, 10, 300, 40];משיחה;3572;(1, 11, 14, 4, 3572);שנה;3;(1, 11, 14, 14, 13323);ושלח חי שלשים שנה ויולד את עבר
(28382, -5, 5);[5, 8, 10, 300, 40];משיחה;7575;(1, 23, 1, 12, 7575);שרה;3;(1, 23, 1, 43, 28382);ויהיו חיי שרה מאה שנה ועשרים שנה ושבע שנים שני חיי שרה
